        Direct address: 00:00:00:00:00:00 (OUI 00-00-00)
        Channel map: 37, 38, 39 (0x07)
        Filter policy: Allow Scan Request from Any, Allow Connect Request from Any (0x00)
> HCI Event: Command Complete (0x0e) plen 4                                                   #19 [hci0] 54.096995
      LE Set Advertising Parameters (0x08|0x0006) ncmd 1
        Status: Success (0x00)
< HCI Command: LE Set Advertise Enable (0x08|0x000a) plen 1                                   #20 [hci0] 54.097130
        Advertising: Enabled (0x01)
> HCI Event: Command Complete (0x0e) plen 4                                                   #21 [hci0] 54.097575
      LE Set Advertise Enable (0x08|0x000a) ncmd 1
        Status: Success (0x00)
> HCI Event: LE Meta Event (0x3e) plen 19                                                     #22 [hci0] 77.202326
      LE Connection Complete (0x01)
        Status: Success (0x00)
        Handle: 64
        Role: Peripheral (0x01)
        Peer address type: Random (0x01)
        Peer address: 45:BE:32:89:81:9C (Resolvable)
        Connection interval: 30.00 msec (0x0018)
        Connection latency: 0 (0x0000)
        Supervision timeout: 5000 msec (0x01f4)
        Central clock accuracy: 0x05
@ MGMT Event: Device Connected (0x000b) plen 13                                          {0x0001} [hci0] 77.202402
        LE Address: 45:BE:32:89:81:9C (Resolvable)
        Flags: 0x00000000
        Data length: 0
> HCI Event: Vendor (0xff) plen 5                                                             #23 [hci0] 77.202379
        55 00 00 40 00                                   U..@.           
< HCI Command: LE Read Remote Used Features (0x08|0x0016) plen 2                              #24 [hci0] 77.202658
        Handle: 64 Address: 45:BE:32:89:81:9C (Resolvable)
btmon[20829]: @ RAW Open: btmon (privileged) version 2.22                                       {0x0002} 77.204845
btmon[20829]: @ RAW Close: btmon                                                                {0x0002} 77.204890
> HCI Event: Command Status (0x0f) plen 4                                                     #25 [hci0] 77.209274
      LE Read Remote Used Features (0x08|0x0016) ncmd 1
        Status: Success (0x00)
> HCI Event: LE Meta Event (0x3e) plen 12                                                     #26 [hci0] 77.244729
      LE Read Remote Used Features (0x04)
        Status: Success (0x00)
        Handle: 64 Address: 45:BE:32:89:81:9C (Resolvable)
        Features: 0x3f 0x00 0x00 0x00 0x00 0x00 0x00 0x00
          LE Encryption
          Connection Parameter Request Procedure
          Extended Reject Indication
          Peripheral-initiated Features Exchange
          LE Ping
          LE Data Packet Length Extension
bluetoothd[656]: < ACL Data TX: Handle 64 flags 0x00 dlen 7                                   #27 [hci0] 77.245855
      ATT: Exchange MTU Request (0x02) len 2
        Client RX MTU: 517
> HCI Event: LE Meta Event (0x3e) plen 11                                                     #28 [hci0] 77.304416
      LE Data Length Change (0x07)
        Handle: 64 Address: 45:BE:32:89:81:9C (Resolvable)
        Max TX octets: 251
        Max TX time: 2120
        Max RX octets: 27
        Max RX time: 328
> ACL Data RX: Handle 64 flags 0x02 dlen 7                                                    #29 [hci0] 77.484008
      ATT: Exchange MTU Response (0x03) len 2
        Server RX MTU: 517
bluetoothd[656]: < ACL Data TX: Handle 64 flags 0x00 dlen 11                                  #30 [hci0] 77.484408
      ATT: Read By Type Request (0x08) len 6
        Handle range: 0x0001-0xffff
        Attribute type: Server Supported Features (0x2b3a)
< HCI Command: LE Set Advertising Parameters (0x08|0x0006) plen 15                            #31 [hci0] 77.541235
        Min advertising interval: 1280.000 msec (0x0800)
        Max advertising interval: 1280.000 msec (0x0800)
        Type: Connectable undirected - ADV_IND (0x00)
        Own address type: Public (0x00)
        Direct address type: Public (0x00)
        Direct address: 00:00:00:00:00:00 (OUI 00-00-00)
        Channel map: 37, 38, 39 (0x07)
        Filter policy: Allow Scan Request from Any, Allow Connect Request from Any (0x00)
> HCI Event: Command Complete (0x0e) plen 4                                                   #32 [hci0] 77.541596
      LE Set Advertising Parameters (0x08|0x0006) ncmd 1
        Status: Success (0x00)
< HCI Command: LE Set Advertise Enable (0x08|0x000a) plen 1                                   #33 [hci0] 77.541691
        Advertising: Enabled (0x01)
> HCI Event: Command Complete (0x0e) plen 4                                                   #34 [hci0] 77.542077
      LE Set Advertise Enable (0x08|0x000a) ncmd 1
        Status: Success (0x00)
> HCI Event: LE Meta Event (0x3e) plen 11                                                     #35 [hci0] 77.544489
      LE Data Length Change (0x07)
        Handle: 64 Address: 45:BE:32:89:81:9C (Resolvable)
        Max TX octets: 251
        Max TX time: 2120
        Max RX octets: 251
        Max RX time: 2120
> ACL Data RX: Handle 64 flags 0x02 dlen 11                                                   #36 [hci0] 77.544750
      ATT: Read By Group Type Request (0x10) len 6
        Handle range: 0x0001-0xffff
        Attribute group type: Primary Service (0x2800)
bluetoothd[656]: < ACL Data TX: Handle 64 flags 0x00 dlen 24                                  #37 [hci0] 77.545093
      ATT: Read By Group Type Response (0x11) len 19
        Attribute data length: 6
        Attribute group list: 3 entries
        Handle range: 0x0001-0x0005
        UUID: Generic Access Profile (0x1800)
        Handle range: 0x0006-0x000f
        UUID: Generic Attribute Profile (0x1801)
        Handle range: 0x0010-0x0012
        UUID: Device Information (0x180a)
> ACL Data RX: Handle 64 flags 0x02 dlen 9                                                    #38 [hci0] 77.574270
      ATT: Read By Type Response (0x09) len 4
        Attribute data length: 3
        Attribute data list: 1 entry
        Handle: 0x0005
        Value[1]: 01
> HCI Event: Number of Completed Packets (0x13) plen 5                                        #39 [hci0] 77.574618
        Num handles: 1
        Handle: 64 Address: 45:BE:32:89:81:9C (Resolvable)
        Count: 2
        #27: len 7 (0 Kb/s)
        Latency: 328 msec (328-328 msec ~328 msec)
        #30: len 11 (0 Kb/s)
        Latency: 90 msec (90-328 msec ~209 msec)
bluetoothd[656]: < ACL Data TX: Handle 64 flags 0x00 dlen 11                                  #40 [hci0] 77.574661
      ATT: Read By Group Type Request (0x10) len 6
        Handle range: 0x0001-0xffff
        Attribute group type: Primary Service (0x2800)
> HCI Event: LE Meta Event (0x3e) plen 11                                                     #41 [hci0] 77.634724
      LE Remote Connection Parameter Request (0x06)
        Handle: 64 Address: 45:BE:32:89:81:9C (Resolvable)
        Min connection interval: 7.50 msec (0x0006)
        Max connection interval: 7.50 msec (0x0006)
        Connection latency: 0 (0x0000)
        Supervision timeout: 5000 msec (0x01f4)
< HCI Command: LE Remote Connection Parameter Request Reply (0x08|0x0020) plen 14             #42 [hci0] 77.634780
        Handle: 64 Address: 45:BE:32:89:81:9C (Resolvable)
        Min connection interval: 7.50 msec (0x0006)
        Max connection interval: 7.50 msec (0x0006)
        Connection latency: 0 (0x0000)
        Supervision timeout: 5000 msec (0x01f4)
        Min connection length: 0.000 msec (0x0000)
        Max connection length: 0.000 msec (0x0000)
> HCI Event: Command Complete (0x0e) plen 6                                                   #43 [hci0] 77.639941
      LE Remote Connection Parameter Request Reply (0x08|0x0020) ncmd 1
        Status: Success (0x00)
        Handle: 64 Address: 45:BE:32:89:81:9C (Resolvable)
> HCI Event: Number of Completed Packets (0x13) plen 5                                        #44 [hci0] 77.665295
        Num handles: 1
        Handle: 64 Address: 45:BE:32:89:81:9C (Resolvable)
        Count: 2
        #37: len 24 (1 Kb/s)
        Latency: 120 msec (90-328 msec ~164 msec)
        #40: len 11 (0 Kb/s)
        Latency: 90 msec (90-328 msec ~127 msec)
> ACL Data RX: Handle 64 flags 0x02 dlen 11                                                   #45 [hci0] 77.694018
      ATT: Read By Group Type Request (0x10) len 6
        Handle range: 0x0013-0xffff
        Attribute group type: Primary Service (0x2800)
bluetoothd[656]: < ACL Data TX: Handle 64 flags 0x00 dlen 46                                  #46 [hci0] 77.694403
      ATT: Read By Group Type Response (0x11) len 41
        Attribute data length: 20
        Attribute group list: 2 entries
        Handle range: 0x0013-0x0017
        UUID: Vendor specific (03b80e5a-ede8-4b33-a751-6ce34ec4c700)
        Handle range: 0x0027-0x0029
        UUID: Vendor specific (e865862f-0c29-47b7-9a5b-274b2c82ce8c)
> ACL Data RX: Handle 64 flags 0x02 dlen 36                                                   #47 [hci0] 77.725243
      ATT: Read By Group Type Response (0x11) len 31
        Attribute data length: 6
        Attribute group list: 5 entries
        Handle range: 0x0001-0x0009
        UUID: Generic Attribute Profile (0x1801)
        Handle range: 0x0014-0x001a
        UUID: Generic Access Profile (0x1800)
        Handle range: 0x0028-0x004d
        UUID: Generic Media Control (0x1849)
        Handle range: 0x005a-0x007e
        UUID: Generic Telephony Bearer (0x184c)
        Handle range: 0x0082-0x0084
        UUID: Telephony and Media Audio (0x1855)
bluetoothd[656]: < ACL Data TX: Handle 64 flags 0x00 dlen 11                                  #48 [hci0] 77.725561
      ATT: Read By Type Request (0x08) len 6
        Handle range: 0x0006-0xffff
        Attribute type: Server Supported Features (0x2b3a)
> ACL Data RX: Handle 64 flags 0x02 dlen 11                                                   #49 [hci0] 77.784116
      ATT: Read By Group Type Request (0x10) len 6
        Handle range: 0x002a-0xffff
        Attribute group type: Primary Service (0x2800)
bluetoothd[656]: < ACL Data TX: Handle 64 flags 0x00 dlen 9                                   #50 [hci0] 77.784419
      ATT: Error Response (0x01) len 4
        Read By Group Type Request (0x10)
        Handle: 0x002a
        Error: Attribute Not Found (0x0a)
> HCI Event: Number of Completed Packets (0x13) plen 5                                        #51 [hci0] 77.784488
        Num handles: 1
        Handle: 64 Address: 45:BE:32:89:81:9C (Resolvable)
        Count: 2
        #46: len 46 (4 Kb/s)
        Latency: 90 msec (90-328 msec ~108 msec)
        #48: len 11 (1 Kb/s)
        Latency: 58 msec (58-328 msec ~83 msec)
> ACL Data RX: Handle 64 flags 0x02 dlen 9                                                    #52 [hci0] 77.813986
      ATT: Error Response (0x01) len 4
        Read By Type Request (0x08)
        Handle: 0x0006
        Error: Attribute Not Found (0x0a)
bluetoothd[656]: < ACL Data TX: Handle 64 flags 0x00 dlen 11                                  #53 [hci0] 77.814275
      ATT: Read By Group Type Request (0x10) len 6
        Handle range: 0x0085-0xffff
        Attribute group type: Primary Service (0x2800)
> ACL Data RX: Handle 64 flags 0x02 dlen 11                                                   #54 [hci0] 77.844032
      ATT: Read By Type Request (0x08) len 6
        Handle range: 0x0001-0x0005
        Attribute type: Include (0x2802)
bluetoothd[656]: < ACL Data TX: Handle 64 flags 0x00 dlen 9                                   #55 [hci0] 77.844294
      ATT: Error Response (0x01) len 4
        Read By Type Request (0x08)
        Handle: 0x0001
        Error: Attribute Not Found (0x0a)
> ACL Data RX: Handle 64 flags 0x02 dlen 46                                                   #56 [hci0] 77.874647
      ATT: Read By Group Type Response (0x11) len 41
        Attribute data length: 20
        Attribute group list: 2 entries
        Handle range: 0x0090-0x0092
        UUID: Vendor specific (e73e0001-ef1b-4e74-8291-2e4f3164f3b5)
        Handle range: 0x0093-0xffff
        UUID: Vendor specific (594a34fc-31db-11ea-978f-2e728ce88125)
> HCI Event: Number of Completed Packets (0x13) plen 5                                        #57 [hci0] 77.875126
        Num handles: 1
        Handle: 64 Address: 45:BE:32:89:81:9C (Resolvable)
        Count: 2
        #50: len 9 (0 Kb/s)
        Latency: 90 msec (58-328 msec ~87 msec)
        #53: len 11 (1 Kb/s)
        Latency: 60 msec (58-328 msec ~74 msec)
bluetoothd[656]: < ACL Data TX: Handle 64 flags 0x00 dlen 11                                  #58 [hci0] 77.875333
      ATT: Read By Group Type Request (0x10) len 6
        Handle range: 0x0001-0xffff
        Attribute group type: Secondary Service (0x2801)
> ACL Data RX: Handle 64 flags 0x02 dlen 11                                                   #59 [hci0] 77.904055
      ATT: Read By Type Request (0x08) len 6
        Handle range: 0x0001-0x0005
        Attribute type: Characteristic (0x2803)
bluetoothd[656]: < ACL Data TX: Handle 64 flags 0x00 dlen 20                                  #60 [hci0] 77.904460
      ATT: Read By Type Response (0x09) len 15
        Attribute data length: 7
        Attribute data list: 2 entries
        Handle: 0x0002
        Value[5]: 020300002a
            Properties: 0x02
              Read (0x02)
            Value Handle: 0x0003
            Value UUID: Device Name (0x2a00)
        Handle: 0x0004
        Value[5]: 020500012a
            Properties: 0x02
              Read (0x02)
            Value Handle: 0x0005
            Value UUID: Appearance (0x2a01)
> ACL Data RX: Handle 64 flags 0x02 dlen 9                                                    #61 [hci0] 77.934045
      ATT: Error Response (0x01) len 4
        Read By Group Type Request (0x10)
        Handle: 0x0001
        Error: Unsupported Group Type (0x10)
bluetoothd[656]: < ACL Data TX: Handle 64 flags 0x00 dlen 11                                  #62 [hci0] 77.934341
      ATT: Read By Type Request (0x08) len 6
        Handle range: 0x0001-0xffff
        Attribute type: Include (0x2802)
> HCI Event: Number of Completed Packets (0x13) plen 5                                        #63 [hci0] 77.934426
        Num handles: 1
        Handle: 64 Address: 45:BE:32:89:81:9C (Resolvable)
        Count: 2
        #55: len 9 (0 Kb/s)
        Latency: 90 msec (58-328 msec ~82 msec)
        #58: len 11 (1 Kb/s)
        Latency: 59 msec (58-328 msec ~70 msec)
> ACL Data RX: Handle 64 flags 0x02 dlen 11                                                   #64 [hci0] 77.964030
      ATT: Read By Type Request (0x08) len 6
        Handle range: 0x0005-0x0005
        Attribute type: Characteristic (0x2803)
bluetoothd[656]: < ACL Data TX: Handle 64 flags 0x00 dlen 9                                   #65 [hci0] 77.964302
      ATT: Error Response (0x01) len 4
        Read By Type Request (0x08)
        Handle: 0x0005
        Error: Attribute Not Found (0x0a)
> ACL Data RX: Handle 64 flags 0x02 dlen 9                                                    #66 [hci0] 77.994038
      ATT: Error Response (0x01) len 4
        Read By Type Request (0x08)
        Handle: 0x0001
        Error: Attribute Not Found (0x0a)
bluetoothd[656]: < ACL Data TX: Handle 64 flags 0x00 dlen 11                                  #67 [hci0] 77.994310
      ATT: Read By Type Request (0x08) len 6
        Handle range: 0x0001-0xffff
        Attribute type: Characteristic (0x2803)
> HCI Event: Number of Completed Packets (0x13) plen 5                                        #68 [hci0] 77.994640
        Num handles: 1
        Handle: 64 Address: 45:BE:32:89:81:9C (Resolvable)
        Count: 2
        #60: len 20 (1 Kb/s)
        Latency: 90 msec (58-328 msec ~80 msec)
        #62: len 11 (1 Kb/s)
        Latency: 60 msec (58-328 msec ~70 msec)
> ACL Data RX: Handle 64 flags 0x02 dlen 11                                                   #69 [hci0] 78.025322
      ATT: Read By Type Request (0x08) len 6
        Handle range: 0x0006-0x000f
        Attribute type: Include (0x2802)
bluetoothd[656]: < ACL Data TX: Handle 64 flags 0x00 dlen 9                                   #70 [hci0] 78.025562
      ATT: Error Response (0x01) len 4
        Read By Type Request (0x08)
        Handle: 0x0006
        Error: Attribute Not Found (0x0a)
> HCI Event: LE Meta Event (0x3e) plen 10                                                     #71 [hci0] 78.025930
      LE Connection Update Complete (0x03)
        Status: Success (0x00)
        Handle: 64 Address: 45:BE:32:89:81:9C (Resolvable)
        Connection interval: 7.50 msec (0x0006)
        Connection latency: 0 (0x0000)
        Supervision timeout: 5000 msec (0x01f4)
> ACL Data RX: Handle 64 flags 0x02 dlen 244                                                  #72 [hci0] 78.035583
      ATT: Read By Type Response (0x09) len 239
        Attribute data length: 7
        Attribute data list: 34 entries
        Handle: 0x0002
        Value[5]: 200300052a
            Properties: 0x20
              Indicate (0x20)
            Value Handle: 0x0003
            Value UUID: Service Changed (0x2a05)
        Handle: 0x0004
        Value[5]: 0205003a2b
            Properties: 0x02
              Read (0x02)
            Value Handle: 0x0005
            Value UUID: Server Supported Features (0x2b3a)
        Handle: 0x0006
        Value[5]: 0a0700292b
            Properties: 0x0a
              Read (0x02)
              Write (0x08)
            Value Handle: 0x0007
            Value UUID: Client Supported Features (0x2b29)
        Handle: 0x0008
        Value[5]: 0209002a2b
            Properties: 0x02
              Read (0x02)
            Value Handle: 0x0009
            Value UUID: Database Hash (0x2b2a)
        Handle: 0x0015
        Value[5]: 021600002a
            Properties: 0x02
              Read (0x02)
            Value Handle: 0x0016
            Value UUID: Device Name (0x2a00)
        Handle: 0x0017
        Value[5]: 021800012a
            Properties: 0x02
              Read (0x02)
            Value Handle: 0x0018
            Value UUID: Appearance (0x2a01)
        Handle: 0x0019
        Value[5]: 021a00a62a
            Properties: 0x02
              Read (0x02)
            Value Handle: 0x001a
            Value UUID: Central Address Resolution (0x2aa6)
        Handle: 0x0029
        Value[5]: 122a00932b
            Properties: 0x12
              Read (0x02)
              Notify (0x10)
            Value Handle: 0x002a
            Value UUID: Media Player Name (0x2b93)
        Handle: 0x002c
        Value[5]: 102d00962b
            Properties: 0x10
              Notify (0x10)
            Value Handle: 0x002d
            Value UUID: Track Changed (0x2b96)
        Handle: 0x002f
        Value[5]: 123000972b
            Properties: 0x12
              Read (0x02)
              Notify (0x10)
            Value Handle: 0x0030
            Value UUID: Track Title (0x2b97)
        Handle: 0x0032
        Value[5]: 123300982b
            Properties: 0x12
              Read (0x02)
              Notify (0x10)
            Value Handle: 0x0033
            Value UUID: Track Duration (0x2b98)
        Handle: 0x0035
        Value[5]: 1e3600992b
            Properties: 0x1e
              Read (0x02)
              Write Without Response (0x04)
              Write (0x08)
              Notify (0x10)
            Value Handle: 0x0036
            Value UUID: Track Position (0x2b99)
        Handle: 0x0038
        Value[5]: 1e39009a2b
            Properties: 0x1e
              Read (0x02)
              Write Without Response (0x04)
              Write (0x08)
              Notify (0x10)
            Value Handle: 0x0039
            Value UUID: Playback Speed (0x2b9a)
        Handle: 0x003b
        Value[5]: 123c009b2b
            Properties: 0x12
              Read (0x02)
              Notify (0x10)
            Value Handle: 0x003c
            Value UUID: Seeking Speed (0x2b9b)
        Handle: 0x003e
        Value[5]: 1e3f00a12b
            Properties: 0x1e
              Read (0x02)
              Write Without Response (0x04)
              Write (0x08)
              Notify (0x10)
            Value Handle: 0x003f
            Value UUID: Playing Order (0x2ba1)
        Handle: 0x0041
        Value[5]: 024200a22b
            Properties: 0x02
              Read (0x02)
            Value Handle: 0x0042
            Value UUID: Playing Orders Supported (0x2ba2)
        Handle: 0x0043
        Value[5]: 124400a32b
            Properties: 0x12
              Read (0x02)
              Notify (0x10)
            Value Handle: 0x0044
            Value UUID: Media State (0x2ba3)
        Handle: 0x0046
        Value[5]: 1c4700a42b
            Properties: 0x1c
              Write Without Response (0x04)
              Write (0x08)
              Notify (0x10)
            Value Handle: 0x0047
            Value UUID: Media Control Point (0x2ba4)
        Handle: 0x0049
        Value[5]: 124a00a52b
            Properties: 0x12
              Read (0x02)
              Notify (0x10)
            Value Handle: 0x004a
            Value UUID: Media Control Point Opcodes Supported (0x2ba5)
        Handle: 0x004c
        Value[5]: 024d00ba2b
            Properties: 0x02
              Read (0x02)
            Value Handle: 0x004d
            Value UUID: Content Control ID (0x2bba)
        Handle: 0x005b
        Value[5]: 125c00b32b
            Properties: 0x12
              Read (0x02)
              Notify (0x10)
            Value Handle: 0x005c
            Value UUID: Bearer Provider Name (0x2bb3)
        Handle: 0x005e
        Value[5]: 025f00b42b
            Properties: 0x02
              Read (0x02)
            Value Handle: 0x005f
            Value UUID: Bearer UCI (0x2bb4)
        Handle: 0x0060
        Value[5]: 126100b52b
            Properties: 0x12
              Read (0x02)
              Notify (0x10)
            Value Handle: 0x0061
            Value UUID: Bearer Technology (0x2bb5)
        Handle: 0x0063
        Value[5]: 126400b62b
            Properties: 0x12
              Read (0x02)
              Notify (0x10)
            Value Handle: 0x0064
            Value UUID: Bearer URI Schemes Supported List (0x2bb6)
        Handle: 0x0066
        Value[5]: 126700b92b
            Properties: 0x12
              Read (0x02)
              Notify (0x10)
            Value Handle: 0x0067
            Value UUID: Bearer List Current Calls (0x2bb9)
        Handle: 0x0069
        Value[5]: 026a00ba2b
            Properties: 0x02
              Read (0x02)
            Value Handle: 0x006a
            Value UUID: Content Control ID (0x2bba)
        Handle: 0x006b
        Value[5]: 126c00bb2b
            Properties: 0x12
              Read (0x02)
              Notify (0x10)
            Value Handle: 0x006c
            Value UUID: Status Flags (0x2bbb)
        Handle: 0x006e
        Value[5]: 126f00bd2b
            Properties: 0x12
              Read (0x02)
              Notify (0x10)
            Value Handle: 0x006f
            Value UUID: Call State (0x2bbd)
        Handle: 0x0071
        Value[5]: 1c7200be2b
            Properties: 0x1c
              Write Without Response (0x04)
              Write (0x08)
              Notify (0x10)
            Value Handle: 0x0072
            Value UUID: Call Control Point (0x2bbe)
        Handle: 0x0074
        Value[5]: 027500bf2b
            Properties: 0x02
              Read (0x02)
            Value Handle: 0x0075
            Value UUID: Call Control Point Optional Opcodes (0x2bbf)
        Handle: 0x0076
        Value[5]: 107700c02b
            Properties: 0x10
              Notify (0x10)
            Value Handle: 0x0077
            Value UUID: Termination Reason (0x2bc0)
        Handle: 0x0079
        Value[5]: 127a00c12b
            Properties: 0x12
              Read (0x02)
              Notify (0x10)
            Value Handle: 0x007a
            Value UUID: Incoming Call (0x2bc1)
        Handle: 0x007c
        Value[5]: 127d00c22b
            Properties: 0x12
              Read (0x02)
              Notify (0x10)
            Value Handle: 0x007d
            Value UUID: Call Friendly Name (0x2bc2)
        Handle: 0x0083
        Value[5]: 028400512b
            Properties: 0x02
              Read (0x02)
            Value Handle: 0x0084
            Value UUID: Telephony and Media Audio Profile Role (0x2b51)
> HCI Event: Number of Completed Packets (0x13) plen 5                                        #73 [hci0] 78.035605
        Num handles: 1
        Handle: 64 Address: 45:BE:32:89:81:9C (Resolvable)
        Count: 2
        #65: len 9 (1 Kb/s)
        Latency: 71 msec (58-328 msec ~70 msec)
        #67: len 11 (2 Kb/s)
        Latency: 41 msec (41-328 msec ~56 msec)
bluetoothd[656]: < ACL Data TX: Handle 64 flags 0x00 dlen 11                                  #74 [hci0] 78.035811
      ATT: Read By Type Request (0x08) len 6
        Handle range: 0x0084-0xffff
        Attribute type: Characteristic (0x2803)
> ACL Data RX: Handle 64 flags 0x02 dlen 11                                                   #75 [hci0] 78.047859
      ATT: Read By Type Request (0x08) len 6
        Handle range: 0x0006-0x000f
        Attribute type: Characteristic (0x2803)
> HCI Event: Number of Completed Packets (0x13) plen 5                                        #76 [hci0] 78.048147
        Num handles: 1
        Handle: 64 Address: 45:BE:32:89:81:9C (Resolvable)
        Count: 2
        #70: len 9 (3 Kb/s)
        Latency: 22 msec (22-328 msec ~39 msec)
        #74: len 11 (7 Kb/s)
        Latency: 12 msec (12-328 msec ~25 msec)
bluetoothd[656]: < ACL Data TX: Handle 64 flags 0x00 dlen 27                                  #77 [hci0] 78.048208
      ATT: Read By Type Response (0x09) len 22
        Attribute data length: 7
        Attribute data list: 3 entries
        Handle: 0x0007
        Value[5]: 200800052a
            Properties: 0x20
              Indicate (0x20)
            Value Handle: 0x0008
            Value UUID: Service Changed (0x2a05)
        Handle: 0x000a
        Value[5]: 0a0b00292b
            Properties: 0x0a
              Read (0x02)
              Write (0x08)
            Value Handle: 0x000b
            Value UUID: Client Supported Features (0x2b29)
        Handle: 0x000c
        Value[5]: 020d002a2b
            Properties: 0x02
              Read (0x02)
            Value Handle: 0x000d
            Value UUID: Database Hash (0x2b2a)
> ACL Data RX: Handle 64 flags 0x02 dlen 69                                                   #78 [hci0] 78.048946
      ATT: Read By Type Response (0x09) len 64
        Attribute data length: 21
        Attribute data list: 3 entries
        Handle: 0x0091
        Value[19]: 029200b5f364314f2e9182744e1bef02003ee7
            Properties: 0x02
              Read (0x02)
            Value Handle: 0x0092
            Value UUID: Vendor specific (e73e0002-ef1b-4e74-8291-2e4f3164f3b5)
        Handle: 0x0094
        Value[19]: 2895002581e88c722e8f97ea11db31e6364a59
            Properties: 0x28
              Write (0x08)
              Indicate (0x20)
            Value Handle: 0x0095
            Value UUID: Vendor specific (594a36e6-31db-11ea-978f-2e728ce88125)
        Handle: 0x0097
        Value[19]: 0c98002581e88c722e8f97ea11db3110304a59
            Properties: 0x0c
              Write Without Response (0x04)
              Write (0x08)
            Value Handle: 0x0098
            Value UUID: Vendor specific (594a3010-31db-11ea-978f-2e728ce88125)
bluetoothd[656]: < ACL Data TX: Handle 64 flags 0x00 dlen 11                                  #79 [hci0] 78.049241
      ATT: Read By Type Request (0x08) len 6
        Handle range: 0x0098-0xffff
        Attribute type: Characteristic (0x2803)
> ACL Data RX: Handle 64 flags 0x02 dlen 11                                                   #80 [hci0] 78.062865
      ATT: Read By Type Request (0x08) len 6
        Handle range: 0x000d-0x000f
        Attribute type: Characteristic (0x2803)
bluetoothd[656]: < ACL Data TX: Handle 64 flags 0x00 dlen 9                                   #81 [hci0] 78.063200
      ATT: Error Response (0x01) len 4
        Read By Type Request (0x08)
        Handle: 0x000d
        Error: Attribute Not Found (0x0a)
> ACL Data RX: Handle 64 flags 0x02 dlen 9                                                    #82 [hci0] 78.063261
      ATT: Error Response (0x01) len 4
        Read By Type Request (0x08)
        Handle: 0x0098
        Error: Attribute Not Found (0x0a)
> HCI Event: Number of Completed Packets (0x13) plen 5                                        #83 [hci0] 78.063444
        Num handles: 1
        Handle: 64 Address: 45:BE:32:89:81:9C (Resolvable)
        Count: 2
        #77: len 27 (14 Kb/s)
        Latency: 15 msec (12-328 msec ~20 msec)
        #79: len 11 (6 Kb/s)
        Latency: 14 msec (12-328 msec ~17 msec)
bluetoothd[656]: < ACL Data TX: Handle 64 flags 0x00 dlen 9                                   #84 [hci0] 78.063829
      ATT: Find Information Request (0x04) len 4
        Handle range: 0x0099-0xffff
> ACL Data RX: Handle 64 flags 0x02 dlen 9                                                    #85 [hci0] 78.077847
      ATT: Find Information Request (0x04) len 4
        Handle range: 0x0009-0x0009
bluetoothd[656]: < ACL Data TX: Handle 64 flags 0x00 dlen 10                                  #86 [hci0] 78.078169
      ATT: Find Information Response (0x05) len 5
        Format: UUID-16 (0x01)
        Handle: 0x0009
        UUID: Client Characteristic Configuration (0x2902)
> HCI Event: Number of Completed Packets (0x13) plen 5                                        #87 [hci0] 78.078150
        Num handles: 1
        Handle: 64 Address: 45:BE:32:89:81:9C (Resolvable)
        Count: 2
        #81: len 9 (5 Kb/s)
        Latency: 14 msec (12-328 msec ~16 msec)
        #84: len 9 (5 Kb/s)
        Latency: 14 msec (12-328 msec ~15 msec)
> ACL Data RX: Handle 64 flags 0x02 dlen 24                                                   #88 [hci0] 78.078625
      ATT: Find Information Response (0x05) len 19
        Format: UUID-128 (0x02)
        Handle: 0x0099
        UUID: Vendor specific (594a3952-31db-11ea-978f-2e728ce88125)
bluetoothd[656]: < ACL Data TX: Handle 64 flags 0x00 dlen 9                                   #89 [hci0] 78.078853
      ATT: Find Information Request (0x04) len 4
        Handle range: 0x009a-0xffff
> ACL Data RX: Handle 64 flags 0x02 dlen 9                                                    #90 [hci0] 78.092837
      ATT: Find Information Request (0x04) len 4
        Handle range: 0x000e-0x000f
bluetoothd[656]: < ACL Data TX: Handle 64 flags 0x00 dlen 9                                   #91 [hci0] 78.093074
      ATT: Error Response (0x01) len 4
        Find Information Request (0x04)
        Handle: 0x000e
        Error: Attribute Not Found (0x0a)
> ACL Data RX: Handle 64 flags 0x02 dlen 9                                                    #92 [hci0] 78.093250
      ATT: Error Response (0x01) len 4
        Find Information Request (0x04)
        Handle: 0x009a
        Error: Attribute Not Found (0x0a)
> HCI Event: Number of Completed Packets (0x13) plen 5                                        #93 [hci0] 78.093707
        Num handles: 1
        Handle: 64 Address: 45:BE:32:89:81:9C (Resolvable)
        Count: 2
        #86: len 10 (5 Kb/s)
        Latency: 15 msec (12-328 msec ~15 msec)
        #89: len 9 (5 Kb/s)
        Latency: 14 msec (12-328 msec ~15 msec)
bluetoothd[656]: < ACL Data TX: Handle 64 flags 0x00 dlen 11                                  #94 [hci0] 78.093988
      ATT: Read By Type Request (0x08) len 6
        Handle range: 0x0001-0xffff
        Attribute type: Database Hash (0x2b2a)
> ACL Data RX: Handle 64 flags 0x02 dlen 11                                                   #95 [hci0] 78.107998
      ATT: Read By Type Request (0x08) len 6
        Handle range: 0x0010-0x0012
        Attribute type: Include (0x2802)
> HCI Event: Number of Completed Packets (0x13) plen 5                                        #96 [hci0] 78.108190
        Num handles: 1
        Handle: 64 Address: 45:BE:32:89:81:9C (Resolvable)
        Count: 2
        #91: len 9 (4 Kb/s)
        Latency: 15 msec (12-328 msec ~15 msec)
        #94: len 11 (6 Kb/s)
        Latency: 14 msec (12-328 msec ~14 msec)
bluetoothd[656]: < ACL Data TX: Handle 64 flags 0x00 dlen 9                                   #97 [hci0] 78.108252
      ATT: Error Response (0x01) len 4
        Read By Type Request (0x08)
        Handle: 0x0010
        Error: Attribute Not Found (0x0a)
> ACL Data RX: Handle 64 flags 0x02 dlen 24                                                   #98 [hci0] 78.115396
      ATT: Read By Type Response (0x09) len 19
        Attribute data length: 18
        Attribute data list: 1 entry
        Handle: 0x0009
        Value[16]: 8a3eadd4aef49a49dc575516f4663a43
bluetoothd[656]: < ACL Data TX: Handle 64 flags 0x00 dlen 11                                  #99 [hci0] 78.115605
      ATT: Read By Type Request (0x08) len 6
        Handle range: 0x000a-0xffff
        Attribute type: Database Hash (0x2b2a)
> ACL Data RX: Handle 64 flags 0x02 dlen 11                                                  #100 [hci0] 78.130364
      ATT: Read By Type Request (0x08) len 6
        Handle range: 0x0010-0x0012
        Attribute type: Characteristic (0x2803)
bluetoothd[656]: < ACL Data TX: Handle 64 flags 0x00 dlen 13                                 #101 [hci0] 78.130689
      ATT: Read By Type Response (0x09) len 8
        Attribute data length: 7
        Attribute data list: 1 entry
        Handle: 0x0011
        Value[5]: 021200502a
            Properties: 0x02
              Read (0x02)
            Value Handle: 0x0012
            Value UUID: PnP ID (0x2a50)
> ACL Data RX: Handle 64 flags 0x02 dlen 9                                                   #102 [hci0] 78.130736
      ATT: Error Response (0x01) len 4
        Read By Type Request (0x08)
        Handle: 0x000a
        Error: Attribute Not Found (0x0a)
> HCI Event: Number of Completed Packets (0x13) plen 5                                       #103 [hci0] 78.131071
        Num handles: 1
        Handle: 64 Address: 45:BE:32:89:81:9C (Resolvable)
        Count: 2
        #97: len 9 (3 Kb/s)
        Latency: 22 msec (12-328 msec ~18 msec)
        #99: len 11 (5 Kb/s)
        Latency: 15 msec (12-328 msec ~17 msec)
bluetoothd[656]: < ACL Data TX: Handle 64 flags 0x00 dlen 8                                  #104 [hci0] 78.137326
      ATT: Write Request (0x12) len 3
        Handle: 0x0007 Type: Client Supported Features (0x2b29)
          Data[1]: 05
> ACL Data RX: Handle 64 flags 0x02 dlen 11                                                  #105 [hci0] 78.145292
      ATT: Read By Type Request (0x08) len 6
        Handle range: 0x0012-0x0012
        Attribute type: Characteristic (0x2803)
> ACL Data RX: Handle 64 flags 0x02 dlen 5                                                   #106 [hci0] 78.152877
      ATT: Write Response (0x13) len 0
> HCI Event: Number of Completed Packets (0x13) plen 5                                       #107 [hci0] 78.153181
        Num handles: 1
        Handle: 64 Address: 45:BE:32:89:81:9C (Resolvable)
        Count: 2
        #101: len 13 (4 Kb/s)
        Latency: 22 msec (12-328 msec ~19 msec)
        #104: len 8 (4 Kb/s)
        Latency: 15 msec (12-328 msec ~17 msec)
bluetoothd[656]: < ACL Data TX: Handle 64 flags 0x00 dlen 9                                  #108 [hci0] 78.153636
      ATT: Error Response (0x01) len 4
        Read By Type Request (0x08)
        Handle: 0x0012
        Error: Attribute Not Found (0x0a)
bluetoothd[656]: < ACL Data TX: Handle 64 flags 0x00 dlen 7                                  #109 [hci0] 78.153664
      ATT: Read Request (0x0a) len 2
        Handle: 0x0016 Type: Device Name (0x2a00)
> ACL Data RX: Handle 64 flags 0x02 dlen 11                                                  #110 [hci0] 78.167893
      ATT: Read By Type Request (0x08) len 6
        Handle range: 0x0013-0x0017
        Attribute type: Include (0x2802)
> HCI Event: Number of Completed Packets (0x13) plen 5                                       #111 [hci0] 78.168145
        Num handles: 1
        Handle: 64 Address: 45:BE:32:89:81:9C (Resolvable)
        Count: 2
        #108: len 9 (5 Kb/s)
        Latency: 14 msec (12-328 msec ~16 msec)
        #109: len 7 (4 Kb/s)
        Latency: 14 msec (12-328 msec ~15 msec)
> ACL Data RX: Handle 64 flags 0x02 dlen 20                                                  #112 [hci0] 78.168354
      ATT: Read Response (0x0b) len 15
        Value[15]: 5332332b20646520416e74686f6e79
        Handle: 0x0016 Type: Device Name (0x2a00)
        Value[15]: 5332332b20646520416e74686f6e79
bluetoothd[656]: < ACL Data TX: Handle 64 flags 0x00 dlen 9                                  #113 [hci0] 78.169530
      ATT: Error Response (0x01) len 4
        Read By Type Request (0x08)
        Handle: 0x0013
        Error: Attribute Not Found (0x0a)
bluetoothd[656]: < ACL Data TX: Handle 64 flags 0x00 dlen 7                                  #114 [hci0] 78.169596
      ATT: Read Request (0x0a) len 2
        Handle: 0x0018 Type: Appearance (0x2a01)
> ACL Data RX: Handle 64 flags 0x02 dlen 11                                                  #115 [hci0] 78.183026
      ATT: Read By Type Request (0x08) len 6
        Handle range: 0x0013-0x0017
        Attribute type: Characteristic (0x2803)
> HCI Event: Number of Completed Packets (0x13) plen 5                                       #116 [hci0] 78.183340
        Num handles: 1
        Handle: 64 Address: 45:BE:32:89:81:9C (Resolvable)
        Count: 2
        #113: len 9 (5 Kb/s)
        Latency: 13 msec (12-328 msec ~14 msec)
        #114: len 7 (4 Kb/s)
        Latency: 13 msec (12-328 msec ~14 msec)
bluetoothd[656]: < ACL Data TX: Handle 64 flags 0x00 dlen 27                                 #117 [hci0] 78.183399
      ATT: Read By Type Response (0x09) len 22
        Attribute data length: 21
        Attribute data list: 1 entry
        Handle: 0x0014
        Value[19]: 1e1500f36b109d66f2a9a112416838dbe57277
            Properties: 0x1e
              Read (0x02)
              Write Without Response (0x04)
              Write (0x08)
              Notify (0x10)
            Value Handle: 0x0015
            Value UUID: Vendor specific (7772e5db-3868-4112-a1a9-f2669d106bf3)
> ACL Data RX: Handle 64 flags 0x02 dlen 7                                                   #118 [hci0] 78.190321
      ATT: Read Response (0x0b) len 2
        Value[2]: 0000
        Handle: 0x0018 Type: Appearance (0x2a01)
        Value[2]: 0000
> ACL Data RX: Handle 64 flags 0x02 dlen 11                                                  #119 [hci0] 78.198231
      ATT: Read By Type Request (0x08) len 6
        Handle range: 0x0015-0x0017
        Attribute type: Characteristic (0x2803)
bluetoothd[656]: < ACL Data TX: Handle 64 flags 0x00 dlen 9                                  #120 [hci0] 78.198481
      ATT: Error Response (0x01) len 4
        Read By Type Request (0x08)
        Handle: 0x0015
        Error: Attribute Not Found (0x0a)
> ACL Data RX: Handle 64 flags 0x02 dlen 9                                                   #121 [hci0] 78.214832
      ATT: Find Information Request (0x04) len 4
        Handle range: 0x0016-0x0017
> HCI Event: Number of Completed Packets (0x13) plen 5                                       #122 [hci0] 78.214842
        Num handles: 1
        Handle: 64 Address: 45:BE:32:89:81:9C (Resolvable)
        Count: 2
        #117: len 27 (6 Kb/s)
        Latency: 31 msec (12-328 msec ~22 msec)
        #120: len 9 (4 Kb/s)
        Latency: 16 msec (12-328 msec ~19 msec)
bluetoothd[656]: < ACL Data TX: Handle 64 flags 0x00 dlen 14                                 #123 [hci0] 78.215079
      ATT: Find Information Response (0x05) len 9
        Format: UUID-16 (0x01)
        Handle: 0x0016
        UUID: Client Characteristic Configuration (0x2902)
        Handle: 0x0017
        UUID: Characteristic User Description (0x2901)
> ACL Data RX: Handle 64 flags 0x02 dlen 11                                                  #124 [hci0] 78.227785
      ATT: Read By Type Request (0x08) len 6
        Handle range: 0x0027-0x0029
        Attribute type: Include (0x2802)
bluetoothd[656]: < ACL Data TX: Handle 64 flags 0x00 dlen 9                                  #125 [hci0] 78.228010
      ATT: Error Response (0x01) len 4
        Read By Type Request (0x08)
        Handle: 0x0027
        Error: Attribute Not Found (0x0a)
> ACL Data RX: Handle 64 flags 0x02 dlen 11                                                  #126 [hci0] 78.243030
      ATT: Read By Type Request (0x08) len 6
        Handle range: 0x0027-0x0029
        Attribute type: Characteristic (0x2803)
> HCI Event: Number of Completed Packets (0x13) plen 5                                       #127 [hci0] 78.243186
        Num handles: 1
        Handle: 64 Address: 45:BE:32:89:81:9C (Resolvable)
        Count: 2
        #123: len 14 (4 Kb/s)
        Latency: 28 msec (12-328 msec ~23 msec)
        #125: len 9 (4 Kb/s)
        Latency: 15 msec (12-328 msec ~19 msec)
bluetoothd[656]: < ACL Data TX: Handle 64 flags 0x00 dlen 27                                 #128 [hci0] 78.243278
      ATT: Read By Type Response (0x09) len 22
        Attribute data length: 21
        Attribute data list: 1 entry
        Handle: 0x0028
        Value[19]: 022900274168e036276e88434fd7b20428496f
            Properties: 0x02
              Read (0x02)
            Value Handle: 0x0029
            Value UUID: Vendor specific (6f492804-b2d7-4f43-886e-2736e0684127)
> ACL Data RX: Handle 64 flags 0x02 dlen 11                                                  #129 [hci0] 78.257787
      ATT: Read By Type Request (0x08) len 6
        Handle range: 0x0029-0x0029
        Attribute type: Characteristic (0x2803)
bluetoothd[656]: < ACL Data TX: Handle 64 flags 0x00 dlen 9                                  #130 [hci0] 78.259648
      ATT: Error Response (0x01) len 4
        Read By Type Request (0x08)
        Handle: 0x0029
        Error: Attribute Not Found (0x0a)
> HCI Event: Number of Completed Packets (0x13) plen 5                                       #131 [hci0] 78.273052
        Num handles: 1
        Handle: 64 Address: 45:BE:32:89:81:9C (Resolvable)
        Count: 2
        #128: len 27 (7 Kb/s)
        Latency: 29 msec (12-328 msec ~24 msec)
        #130: len 9 (5 Kb/s)
        Latency: 13 msec (12-328 msec ~19 msec)
> HCI Event: LE Meta Event (0x3e) plen 11                                                    #132 [hci0] 78.288238
      LE Remote Connection Parameter Request (0x06)
        Handle: 64 Address: 45:BE:32:89:81:9C (Resolvable)
        Min connection interval: 30.00 msec (0x0018)
        Max connection interval: 30.00 msec (0x0018)
        Connection latency: 0 (0x0000)
        Supervision timeout: 5000 msec (0x01f4)
< HCI Command: LE Remote Connection Parameter Request Reply (0x08|0x0020) plen 14            #133 [hci0] 78.288278
        Handle: 64 Address: 45:BE:32:89:81:9C (Resolvable)
        Min connection interval: 30.00 msec (0x0018)
        Max connection interval: 30.00 msec (0x0018)
        Connection latency: 0 (0x0000)
        Supervision timeout: 5000 msec (0x01f4)
        Min connection length: 0.000 msec (0x0000)
        Max connection length: 0.000 msec (0x0000)
> HCI Event: Command Complete (0x0e) plen 6                                                  #134 [hci0] 78.292493
      LE Remote Connection Parameter Request Reply (0x08|0x0020) ncmd 1
        Status: Success (0x00)
        Handle: 64 Address: 45:BE:32:89:81:9C (Resolvable)
> HCI Event: LE Meta Event (0x3e) plen 10                                                    #135 [hci0] 78.384440
      LE Connection Update Complete (0x03)
        Status: Success (0x00)
        Handle: 64 Address: 45:BE:32:89:81:9C (Resolvable)
        Connection interval: 30.00 msec (0x0018)
        Connection latency: 0 (0x0000)
        Supervision timeout: 5000 msec (0x01f4)
> ACL Data RX: Handle 64 flags 0x02 dlen 7                                                  #136 [hci0] 111.594119
      ATT: Read Request (0x0a) len 2
        Handle: 0x0003 Type: Device Name (0x2a00)
bluetoothd[656]: < ACL Data TX: Handle 64 flags 0x00 dlen 18                                #137 [hci0] 111.594575
      ATT: Read Response (0x0b) len 13
        Value[13]: 53656e74696e656c6c652d5631
        Handle: 0x0003 Type: Device Name (0x2a00)
        Value[13]: 53656e74696e656c6c652d5631
> HCI Event: Number of Completed Packets (0x13) plen 5                                      #138 [hci0] 111.819025
        Num handles: 1
        Handle: 64 Address: 45:BE:32:89:81:9C (Resolvable)
        Count: 1
        #137: len 18 (0 Kb/s)
        Latency: 224 msec (12-328 msec ~121 msec)
> ACL Data RX: Handle 64 flags 0x02 dlen 7                                                  #139 [hci0] 118.074135
      ATT: Read Request (0x0a) len 2
        Handle: 0x0029 Type: Vendor specific (6f492804-b2d7-4f43-886e-2736e0684127)
bluetoothd[656]: < ACL Data TX: Handle 64 flags 0x00 dlen 251                               #140 [hci0] 118.079987
bluetoothd[656]: < ACL Data TX: Handle 64 flags 0x01 dlen 119                               #141 [hci0] 118.080024
      ATT: Read Response (0x0b) len 365
        Value[109]: 686f726f6461746167653b74656d703b6c75783b7072657373696f6e3b6971610a32362d30382d31325f31353a33303a30303b32302e353b39303b313030303b33350a32362d30382d31325f31363a30303a30303b32312e353b39303b313030303b33350a32362d30382d3132
        Handle: 0x0029 Type: Vendor specific (6f492804-b2d7-4f43-886e-2736e0684127)
        Value[109]: 686f726f6461746167653b74656d703b6c75783b7072657373696f6e3b6971610a32362d30382d31325f31353a33303a30303b32302e353b39303b313030303b33350a32362d30382d31325f31363a30303a30303b32312e353b39303b313030303b33350a32362d30382d3132
> HCI Event: Number of Completed Packets (0x13) plen 5                                      #142 [hci0] 118.134473
        Num handles: 1
        Handle: 64 Address: 45:BE:32:89:81:9C (Resolvable)
        Count: 2
        #140: len 251 (37 Kb/s)
        Latency: 54 msec (12-328 msec ~88 msec)
        #141: len 119 (17 Kb/s)
        Latency: 54 msec (12-328 msec ~71 msec)
@ MGMT Event: New Settings (0x0006) plen 4                                              {0x0001} [hci0] 202.437200
        Current settings: 0x00000ad3
          Powered
          Connectable
          Bondable
          Secure Simple Pairing
          BR/EDR
          Low Energy
          Secure Connections
bluetoothd[656]: @ MGMT Command: Add Extended Advertising Parameters (0x0054) plen 18   {0x0001} [hci0] 202.448321
        Instance: 1
        Flags: 0x00010001
          Switch into Connectable mode
          Contain Scan Response Data
        Duration: 0
        Timeout: 0
        Min advertising interval: 0.000 msec (0x0000)
        Max advertising interval: 0.000 msec (0x0000)
        TX power: 0 dbm (0x00)
@ MGMT Event: Command Complete (0x0001) plen 7                                          {0x0001} [hci0] 202.448348
      Add Extended Advertising Parameters (0x0054) plen 4
        Status: Success (0x00)
        Instance: 1
        TX power: 127 dbm (0x7f)
        Available adv data len: 31
        Available scan rsp data len: 31
bluetoothd[656]: @ MGMT Command: Add Extended Advertising Data (0x0055) plen 44         {0x0001} [hci0] 202.448552
        Instance: 1
        Advertising data length: 18
        128-bit Service UUIDs (complete): 1 entry
          Vendor specific
        Scan response length: 15
        Name (complete): Sentinel-TEST
< HCI Command: LE Set Advertising Data (0x08|0x0008) plen 32                                #143 [hci0] 202.448652
        Length: 18
        128-bit Service UUIDs (complete): 1 entry
          Vendor specific
> HCI Event: Command Complete (0x0e) plen 4                                                 #144 [hci0] 202.449311
      LE Set Advertising Data (0x08|0x0008) ncmd 1
        Status: Success (0x00)
< HCI Command: LE Set Advertise Enable (0x08|0x000a) plen 1                                 #145 [hci0] 202.449417
        Advertising: Disabled (0x00)
> HCI Event: Command Complete (0x0e) plen 4                                                 #146 [hci0] 202.450425
      LE Set Advertise Enable (0x08|0x000a) ncmd 1
        Status: Success (0x00)
< HCI Command: LE Set Advertising Parameters (0x08|0x0006) plen 15                          #147 [hci0] 202.450515
        Min advertising interval: 1280.000 msec (0x0800)
        Max advertising interval: 1280.000 msec (0x0800)
        Type: Connectable undirected - ADV_IND (0x00)
        Own address type: Public (0x00)
        Direct address type: Public (0x00)
        Direct address: 00:00:00:00:00:00 (OUI 00-00-00)
        Channel map: 37, 38, 39 (0x07)
        Filter policy: Allow Scan Request from Any, Allow Connect Request from Any (0x00)
> HCI Event: Command Complete (0x0e) plen 4                                                 #148 [hci0] 202.450898
      LE Set Advertising Parameters (0x08|0x0006) ncmd 1
        Status: Success (0x00)
< HCI Command: LE Set Advertise Enable (0x08|0x000a) plen 1                                 #149 [hci0] 202.451020
        Advertising: Enabled (0x01)
> HCI Event: Command Complete (0x0e) plen 4                                                 #150 [hci0] 202.451418
      LE Set Advertise Enable (0x08|0x000a) ncmd 1
        Status: Success (0x00)
@ MGMT Event: Command Complete (0x0001) plen 4                                          {0x0001} [hci0] 202.451499
      Add Extended Advertising Data (0x0055) plen 1
        Status: Success (0x00)
        Instance: 1

