> ACL Data RX: Handle 64 flags 0x02 dlen 11                                                 #318 [hci0] 280.260953
      SMP: Pairing Request (0x01) len 6
        IO capability: KeyboardDisplay (0x04)
        OOB data: Authentication data not present (0x00)
        Authentication requirement: Bonding, MITM, SC, No Keypresses, CT2 (0x2d)
        Max encryption key size: 16
        Initiator key distribution: EncKey IdKey Sign LinkKey (0x0f)
        Responder key distribution: EncKey IdKey Sign LinkKey (0x0f)
< ACL Data TX: Handle 64 flags 0x00 dlen 11                                                 #319 [hci0] 280.261021
      SMP: Pairing Response (0x02) len 6
        IO capability: DisplayYesNo (0x01)
        OOB data: Authentication data not present (0x00)
        Authentication requirement: Bonding, MITM, SC, No Keypresses, CT2 (0x2d)
        Max encryption key size: 16
        Initiator key distribution: EncKey IdKey Sign LinkKey (0x0f)
        Responder key distribution: EncKey Sign LinkKey (0x0d)
> ACL Data RX: Handle 64 flags 0x02 dlen 69                                                 #320 [hci0] 280.321770
      SMP: Pairing Public Key (0x0c) len 64
        X[32]: 6f4d8a75f2f858ae6838849065159836796ccb0128260c48ab0602abebcb23a8
        Y[32]: bc73af4f9a4adf1834d8f1142725c9189ed9760a5d935cfe8179a639fea48d4c
> HCI Event: Number of Completed Packets (0x13) plen 5                                      #321 [hci0] 280.325171
        Num handles: 1
        Handle: 64 Address: 7B:F7:D7:AE:BE:3A (Resolvable)
        Count: 2
        #317: len 9 (0 Kb/s)
        Latency: 124 msec (10-295 msec ~109 msec)
        #319: len 11 (1 Kb/s)
        Latency: 64 msec (10-295 msec ~86 msec)
< ACL Data TX: Handle 64 flags 0x00 dlen 69                                                 #322 [hci0] 280.325924
      SMP: Pairing Public Key (0x0c) len 64
        X[32]: 89eabd436064097ce6d27f6119b22975f070409d75ea48677f69df023143eba8
        Y[32]: 2d1c70b76cf8ec627cbd02921eb040d5337d36378c2dd6a117bb84f318f74ce8
< ACL Data TX: Handle 64 flags 0x00 dlen 21                                                 #323 [hci0] 280.325929
      SMP: Pairing Confirm (0x03) len 16
        Confim value[16]: 60094f2f658900c31d5eb977985a4868
> ACL Data RX: Handle 64 flags 0x02 dlen 21                                                 #324 [hci0] 280.381289
      SMP: Pairing Random (0x04) len 16
        Random value[16]: 4966854c28ecaf78d0afaea94751aca9
@ MGMT Event: User Confirmation Request (0x000f) plen 12                                {0x0001} [hci0] 280.381318
        LE Address: 7B:F7:D7:AE:BE:3A (Resolvable)
        Confirm hint: 0x00
        Value: 0x000d9c79
< ACL Data TX: Handle 64 flags 0x00 dlen 21                                                 #325 [hci0] 280.381328
      SMP: Pairing Random (0x04) len 16
        Random value[16]: 7186dec39d7e37ebf8e08363244b1a7a
> HCI Event: Number of Completed Packets (0x13) plen 5                                      #326 [hci0] 280.381451
        Num handles: 1
        Handle: 64 Address: 7B:F7:D7:AE:BE:3A (Resolvable)
        Count: 2
        #322: len 69 (10 Kb/s)
        Latency: 55 msec (10-295 msec ~71 msec)
        #323: len 21 (3 Kb/s)
        Latency: 55 msec (10-295 msec ~63 msec)
> HCI Event: Number of Completed Packets (0x13) plen 5                                      #327 [hci0] 280.567362
        Num handles: 1
        Handle: 64 Address: 7B:F7:D7:AE:BE:3A (Resolvable)
        Count: 1
        #325: len 21 (0 Kb/s)
        Latency: 186 msec (10-295 msec ~124 msec)
> ACL Data RX: Handle 64 flags 0x02 dlen 21                                                 #328 [hci0] 282.571041
      SMP: Pairing DHKey Check (0x0d) len 16
        E[16]: a8862a139e37b5df780fc3f9d4fbb311
< HCI Command: Disconnect (0x01|0x0006) plen 3                                              #329 [hci0] 311.661225
        Handle: 64 Address: 7B:F7:D7:AE:BE:3A (Resolvable)
        Reason: Authentication Failure (0x05)
> HCI Event: Command Status (0x0f) plen 4                                                   #330 [hci0] 311.661582
      Disconnect (0x01|0x0006) ncmd 1
        Status: Success (0x00)
> HCI Event: Disconnect Complete (0x05) plen 4                                              #331 [hci0] 311.701843
        Status: Success (0x00)
        Handle: 64 Address: 7B:F7:D7:AE:BE:3A (Resolvable)
        Reason: Connection Terminated By Local Host (0x16)
@ MGMT Event: Device Disconnected (0x000c) plen 8                                       {0x0001} [hci0] 311.701881
        LE Address: 7B:F7:D7:AE:BE:3A (Resolvable)
        Reason: Connection terminated by local host (0x02)
< HCI Command: LE Set Advertise Enable (0x08|0x000a) plen 1                                 #332 [hci0] 311.733437
        Advertising: Disabled (0x00)
> HCI Event: Command Complete (0x0e) plen 4                                                 #333 [hci0] 311.734306
      LE Set Advertise Enable (0x08|0x000a) ncmd 1
        Status: Success (0x00)
< HCI Command: LE Set Advertising Parameters (0x08|0x0006) plen 15                          #334 [hci0] 311.734388
        Min advertising interval: 1280.000 msec (0x0800)
        Max advertising interval: 1280.000 msec (0x0800)
        Type: Connectable undirected - ADV_IND (0x00)
        Own address type: Public (0x00)
        Direct address type: Public (0x00)
        Direct address: 00:00:00:00:00:00 (OUI 00-00-00)
        Channel map: 37, 38, 39 (0x07)
        Filter policy: Allow Scan Request from Any, Allow Connect Request from Any (0x00)
> HCI Event: Command Complete (0x0e) plen 4                                                 #335 [hci0] 311.734813
      LE Set Advertising Parameters (0x08|0x0006) ncmd 1
        Status: Success (0x00)
< HCI Command: LE Set Advertise Enable (0x08|0x000a) plen 1                                 #336 [hci0] 311.734881
        Advertising: Enabled (0x01)
> HCI Event: Command Complete (0x0e) plen 4                                                 #337 [hci0] 311.735259
      LE Set Advertise Enable (0x08|0x000a) ncmd 1
        Status: Success (0x00)
> HCI Event: LE Meta Event (0x3e) plen 19                                                   #338 [hci0] 319.433826
      LE Connection Complete (0x01)
        Status: Success (0x00)
        Handle: 64
        Role: Peripheral (0x01)
        Peer address type: Random (0x01)
        Peer address: 4D:C0:DF:3F:4B:7B (Resolvable)
        Connection interval: 30.00 msec (0x0018)
        Connection latency: 0 (0x0000)
        Supervision timeout: 5000 msec (0x01f4)
        Central clock accuracy: 0x05
@ MGMT Event: Device Connected (0x000b) plen 13                                         {0x0001} [hci0] 319.433913
        LE Address: 4D:C0:DF:3F:4B:7B (Resolvable)
        Flags: 0x00000000
        Data length: 0
> HCI Event: Vendor (0xff) plen 5                                                           #339 [hci0] 319.433835
        55 00 00 40 00                                   U..@.           
< HCI Command: LE Read Remote Used Features (0x08|0x0016) plen 2                            #340 [hci0] 319.434191
        Handle: 64 Address: 4D:C0:DF:3F:4B:7B (Resolvable)
btmon[14618]: @ RAW Open: btmon (privileged) version 2.22                                      {0x0002} 319.434545
btmon[14618]: @ RAW Close: btmon                                                               {0x0002} 319.434562
> HCI Event: Command Status (0x0f) plen 4                                                   #341 [hci0] 319.435763
      LE Read Remote Used Features (0x08|0x0016) ncmd 1
        Status: Success (0x00)
> HCI Event: LE Meta Event (0x3e) plen 12                                                   #342 [hci0] 319.491621
      LE Read Remote Used Features (0x04)
        Status: Success (0x00)
        Handle: 64 Address: 4D:C0:DF:3F:4B:7B (Resolvable)
        Features: 0x3f 0x00 0x00 0x00 0x00 0x00 0x00 0x00
          LE Encryption
          Connection Parameter Request Procedure
          Extended Reject Indication
          Peripheral-initiated Features Exchange
          LE Ping
          LE Data Packet Length Extension
bluetoothd[656]: < ACL Data TX: Handle 64 flags 0x00 dlen 7                                 #343 [hci0] 319.492456
      ATT: Exchange MTU Request (0x02) len 2
        Client RX MTU: 517
> HCI Event: LE Meta Event (0x3e) plen 11                                                   #344 [hci0] 319.551308
      LE Data Length Change (0x07)
        Handle: 64 Address: 4D:C0:DF:3F:4B:7B (Resolvable)
        Max TX octets: 251
        Max TX time: 2120
        Max RX octets: 27
        Max RX time: 328
> ACL Data RX: Handle 64 flags 0x02 dlen 11                                                 #345 [hci0] 319.731009
      ATT: Read By Type Request (0x08) len 6
        Handle range: 0x0001-0xffff
        Attribute type: Device Name (0x2a00)
> ACL Data RX: Handle 64 flags 0x02 dlen 7                                                  #346 [hci0] 319.731365
      ATT: Exchange MTU Response (0x03) len 2
        Server RX MTU: 517
bluetoothd[656]: < ACL Data TX: Handle 64 flags 0x00 dlen 21                                #347 [hci0] 319.731410
      ATT: Read By Type Response (0x09) len 16
        Attribute data length: 15
        Attribute data list: 1 entry
        Handle: 0x0003
        Value[13]: 53656e74696e656c6c652d5631
bluetoothd[656]: < ACL Data TX: Handle 64 flags 0x00 dlen 11                                #348 [hci0] 319.731540
      ATT: Read By Type Request (0x08) len 6
        Handle range: 0x0001-0xffff
        Attribute type: Server Supported Features (0x2b3a)
> HCI Event: LE Meta Event (0x3e) plen 11                                                   #349 [hci0] 319.761296
      LE Data Length Change (0x07)
        Handle: 64 Address: 4D:C0:DF:3F:4B:7B (Resolvable)
        Max TX octets: 251
        Max TX time: 2120
        Max RX octets: 251
        Max RX time: 2120
> HCI Event: Number of Completed Packets (0x13) plen 5                                      #350 [hci0] 319.791513
        Num handles: 1
        Handle: 64 Address: 4D:C0:DF:3F:4B:7B (Resolvable)
        Count: 2
        #343: len 7 (0 Kb/s)
        Latency: 299 msec (299-299 msec ~299 msec)
        #347: len 21 (2 Kb/s)
        Latency: 60 msec (60-299 msec ~179 msec)
> ACL Data RX: Handle 64 flags 0x02 dlen 9                                                  #351 [hci0] 319.820880
      ATT: Read By Type Response (0x09) len 4
        Attribute data length: 3
        Attribute data list: 1 entry
        Handle: 0x0005
        Value[1]: 01
bluetoothd[656]: < ACL Data TX: Handle 64 flags 0x00 dlen 11                                #352 [hci0] 319.821164
      ATT: Read By Group Type Request (0x10) len 6
        Handle range: 0x0001-0xffff
        Attribute group type: Primary Service (0x2800)
> HCI Event: LE Meta Event (0x3e) plen 11                                                   #353 [hci0] 319.851431
      LE Remote Connection Parameter Request (0x06)
        Handle: 64 Address: 4D:C0:DF:3F:4B:7B (Resolvable)
        Min connection interval: 7.50 msec (0x0006)
        Max connection interval: 7.50 msec (0x0006)
        Connection latency: 0 (0x0000)
        Supervision timeout: 5000 msec (0x01f4)
< HCI Command: LE Remote Connection Parameter Request Reply (0x08|0x0020) plen 14           #354 [hci0] 319.851480
        Handle: 64 Address: 4D:C0:DF:3F:4B:7B (Resolvable)
        Min connection interval: 7.50 msec (0x0006)
        Max connection interval: 7.50 msec (0x0006)
        Connection latency: 0 (0x0000)
        Supervision timeout: 5000 msec (0x01f4)
        Min connection length: 0.000 msec (0x0000)
        Max connection length: 0.000 msec (0x0000)
> HCI Event: Command Complete (0x0e) plen 6                                                 #355 [hci0] 319.854534
      LE Remote Connection Parameter Request Reply (0x08|0x0020) ncmd 1
        Status: Success (0x00)
        Handle: 64 Address: 4D:C0:DF:3F:4B:7B (Resolvable)
> ACL Data RX: Handle 64 flags 0x02 dlen 36                                                 #356 [hci0] 319.911447
      ATT: Read By Group Type Response (0x11) len 31
        Attribute data length: 6
        Attribute group list: 5 entries
        Handle range: 0x0001-0x0009
        UUID: Generic Attribute Profile (0x1801)
        Handle range: 0x0014-0x001a
        UUID: Generic Access Profile (0x1800)
        Handle range: 0x0028-0x004d
        UUID: Generic Media Control (0x1849)
        Handle range: 0x005a-0x007e
        UUID: Generic Telephony Bearer (0x184c)
        Handle range: 0x0082-0x0084
        UUID: Telephony and Media Audio (0x1855)
bluetoothd[656]: < ACL Data TX: Handle 64 flags 0x00 dlen 11                                #357 [hci0] 319.911761
      ATT: Read By Type Request (0x08) len 6
        Handle range: 0x0006-0xffff
        Attribute type: Server Supported Features (0x2b3a)
> HCI Event: Number of Completed Packets (0x13) plen 5                                      #358 [hci0] 319.912676
        Num handles: 1
        Handle: 64 Address: 4D:C0:DF:3F:4B:7B (Resolvable)
        Count: 2
        #348: len 11 (0 Kb/s)
        Latency: 181 msec (60-299 msec ~180 msec)
        #352: len 11 (0 Kb/s)
        Latency: 91 msec (60-299 msec ~135 msec)
> ACL Data RX: Handle 64 flags 0x02 dlen 11                                                 #359 [hci0] 320.000889
      ATT: Read By Group Type Request (0x10) len 6
        Handle range: 0x0001-0xffff
        Attribute group type: Primary Service (0x2800)
bluetoothd[656]: < ACL Data TX: Handle 64 flags 0x00 dlen 24                                #360 [hci0] 320.001261
      ATT: Read By Group Type Response (0x11) len 19
        Attribute data length: 6
        Attribute group list: 3 entries
        Handle range: 0x0001-0x0005
        UUID: Generic Access Profile (0x1800)
        Handle range: 0x0006-0x000f
        UUID: Generic Attribute Profile (0x1801)
        Handle range: 0x0010-0x0012
        UUID: Device Information (0x180a)
> ACL Data RX: Handle 64 flags 0x02 dlen 9                                                  #361 [hci0] 320.030909
      ATT: Error Response (0x01) len 4
        Read By Type Request (0x08)
        Handle: 0x0006
        Error: Attribute Not Found (0x0a)
bluetoothd[656]: < ACL Data TX: Handle 64 flags 0x00 dlen 11                                #362 [hci0] 320.031195
      ATT: Read By Group Type Request (0x10) len 6
        Handle range: 0x0085-0xffff
        Attribute group type: Primary Service (0x2800)
> ACL Data RX: Handle 64 flags 0x02 dlen 11                                                 #363 [hci0] 320.060944
      ATT: Read By Group Type Request (0x10) len 6
        Handle range: 0x0013-0xffff
        Attribute group type: Primary Service (0x2800)
bluetoothd[656]: < ACL Data TX: Handle 64 flags 0x00 dlen 46                                #364 [hci0] 320.061256
      ATT: Read By Group Type Response (0x11) len 41
        Attribute data length: 20
        Attribute group list: 2 entries
        Handle range: 0x0013-0x0017
        UUID: Vendor specific (03b80e5a-ede8-4b33-a751-6ce34ec4c700)
        Handle range: 0x0024-0x0026
        UUID: Vendor specific (e865862f-0c29-47b7-9a5b-274b2c82ce8c)
> HCI Event: Number of Completed Packets (0x13) plen 5                                      #365 [hci0] 320.061640
        Num handles: 1
        Handle: 64 Address: 4D:C0:DF:3F:4B:7B (Resolvable)
        Count: 2
        #357: len 11 (0 Kb/s)
        Latency: 149 msec (60-299 msec ~142 msec)
        #360: len 24 (3 Kb/s)
        Latency: 60 msec (60-299 msec ~101 msec)
> ACL Data RX: Handle 64 flags 0x02 dlen 46                                                 #366 [hci0] 320.091411
      ATT: Read By Group Type Response (0x11) len 41
        Attribute data length: 20
        Attribute group list: 2 entries
        Handle range: 0x0090-0x0092
        UUID: Vendor specific (e73e0001-ef1b-4e74-8291-2e4f3164f3b5)
        Handle range: 0x0093-0xffff
        UUID: Vendor specific (594a34fc-31db-11ea-978f-2e728ce88125)
bluetoothd[656]: < ACL Data TX: Handle 64 flags 0x00 dlen 11                                #367 [hci0] 320.092076
      ATT: Read By Group Type Request (0x10) len 6
        Handle range: 0x0001-0xffff
        Attribute group type: Secondary Service (0x2801)
> ACL Data RX: Handle 64 flags 0x02 dlen 11                                                 #368 [hci0] 320.120964
      ATT: Read By Group Type Request (0x10) len 6
        Handle range: 0x0027-0xffff
        Attribute group type: Primary Service (0x2800)
> HCI Event: Number of Completed Packets (0x13) plen 5                                      #369 [hci0] 320.121479
        Num handles: 1
        Handle: 64 Address: 4D:C0:DF:3F:4B:7B (Resolvable)
        Count: 2
        #362: len 11 (0 Kb/s)
        Latency: 90 msec (60-299 msec ~95 msec)
        #364: len 46 (6 Kb/s)
        Latency: 60 msec (60-299 msec ~78 msec)
bluetoothd[656]: < ACL Data TX: Handle 64 flags 0x00 dlen 9                                 #370 [hci0] 320.121928
      ATT: Error Response (0x01) len 4
        Read By Group Type Request (0x10)
        Handle: 0x0027
        Error: Attribute Not Found (0x0a)
> ACL Data RX: Handle 64 flags 0x02 dlen 9                                                  #371 [hci0] 320.150915
      ATT: Error Response (0x01) len 4
        Read By Group Type Request (0x10)
        Handle: 0x0001
        Error: Unsupported Group Type (0x10)
bluetoothd[656]: < ACL Data TX: Handle 64 flags 0x00 dlen 11                                #372 [hci0] 320.151273
      ATT: Read By Type Request (0x08) len 6
        Handle range: 0x0001-0xffff
        Attribute type: Include (0x2802)
> ACL Data RX: Handle 64 flags 0x02 dlen 11                                                 #373 [hci0] 320.180942
      ATT: Read By Type Request (0x08) len 6
        Handle range: 0x0001-0x0005
        Attribute type: Include (0x2802)
bluetoothd[656]: < ACL Data TX: Handle 64 flags 0x00 dlen 9                                 #374 [hci0] 320.181236
      ATT: Error Response (0x01) len 4
        Read By Type Request (0x08)
        Handle: 0x0001
        Error: Attribute Not Found (0x0a)
> HCI Event: Number of Completed Packets (0x13) plen 5                                      #375 [hci0] 320.181341
        Num handles: 1
        Handle: 64 Address: 4D:C0:DF:3F:4B:7B (Resolvable)
        Count: 2
        #367: len 11 (0 Kb/s)
        Latency: 89 msec (60-299 msec ~83 msec)
        #370: len 9 (1 Kb/s)
        Latency: 59 msec (59-299 msec ~71 msec)
> ACL Data RX: Handle 64 flags 0x02 dlen 9                                                  #376 [hci0] 320.210903
      ATT: Error Response (0x01) len 4
        Read By Type Request (0x08)
        Handle: 0x0001
        Error: Attribute Not Found (0x0a)
bluetoothd[656]: < ACL Data TX: Handle 64 flags 0x00 dlen 11                                #377 [hci0] 320.211147
      ATT: Read By Type Request (0x08) len 6
        Handle range: 0x0001-0xffff
        Attribute type: Characteristic (0x2803)
> ACL Data RX: Handle 64 flags 0x02 dlen 11                                                 #378 [hci0] 320.247179
      ATT: Read By Type Request (0x08) len 6
        Handle range: 0x0001-0x0005
        Attribute type: Characteristic (0x2803)
bluetoothd[656]: < ACL Data TX: Handle 64 flags 0x00 dlen 20                                #379 [hci0] 320.247426
      ATT: Read By Type Response (0x09) len 15
        Attribute data length: 7
        Attribute data list: 2 entries
        Handle: 0x0002
        Value[5]: 020300002a
            Properties: 0x02
              Read (0x02)
            Value Handle: 0x0003
            Value UUID: Device Name (0x2a00)
        Handle: 0x0004
        Value[5]: 020500012a
            Properties: 0x02
              Read (0x02)
            Value Handle: 0x0005
            Value UUID: Appearance (0x2a01)
> HCI Event: Number of Completed Packets (0x13) plen 5                                      #380 [hci0] 320.247832
        Num handles: 1
        Handle: 64 Address: 4D:C0:DF:3F:4B:7B (Resolvable)
        Count: 2
        #372: len 11 (0 Kb/s)
        Latency: 96 msec (59-299 msec ~84 msec)
        #374: len 9 (1 Kb/s)
        Latency: 66 msec (59-299 msec ~75 msec)
> HCI Event: LE Meta Event (0x3e) plen 10                                                   #381 [hci0] 320.247913
      LE Connection Update Complete (0x03)
        Status: Success (0x00)
        Handle: 64 Address: 4D:C0:DF:3F:4B:7B (Resolvable)
        Connection interval: 7.50 msec (0x0006)
        Connection latency: 0 (0x0000)
        Supervision timeout: 5000 msec (0x01f4)
> ACL Data RX: Handle 64 flags 0x02 dlen 244                                                #382 [hci0] 320.257441
      ATT: Read By Type Response (0x09) len 239
        Attribute data length: 7
        Attribute data list: 34 entries
        Handle: 0x0002
        Value[5]: 200300052a
            Properties: 0x20
              Indicate (0x20)
            Value Handle: 0x0003
            Value UUID: Service Changed (0x2a05)
        Handle: 0x0004
        Value[5]: 0205003a2b
            Properties: 0x02
              Read (0x02)
            Value Handle: 0x0005
            Value UUID: Server Supported Features (0x2b3a)
        Handle: 0x0006
        Value[5]: 0a0700292b
            Properties: 0x0a
              Read (0x02)
              Write (0x08)
            Value Handle: 0x0007
            Value UUID: Client Supported Features (0x2b29)
        Handle: 0x0008
        Value[5]: 0209002a2b
            Properties: 0x02
              Read (0x02)
            Value Handle: 0x0009
            Value UUID: Database Hash (0x2b2a)
        Handle: 0x0015
        Value[5]: 021600002a
            Properties: 0x02
              Read (0x02)
            Value Handle: 0x0016
            Value UUID: Device Name (0x2a00)
        Handle: 0x0017
        Value[5]: 021800012a
            Properties: 0x02
              Read (0x02)
            Value Handle: 0x0018
            Value UUID: Appearance (0x2a01)
        Handle: 0x0019
        Value[5]: 021a00a62a
            Properties: 0x02
              Read (0x02)
            Value Handle: 0x001a
            Value UUID: Central Address Resolution (0x2aa6)
        Handle: 0x0029
        Value[5]: 122a00932b
            Properties: 0x12
              Read (0x02)
              Notify (0x10)
            Value Handle: 0x002a
            Value UUID: Media Player Name (0x2b93)
        Handle: 0x002c
        Value[5]: 102d00962b
            Properties: 0x10
              Notify (0x10)
            Value Handle: 0x002d
            Value UUID: Track Changed (0x2b96)
        Handle: 0x002f
        Value[5]: 123000972b
            Properties: 0x12
              Read (0x02)
              Notify (0x10)
            Value Handle: 0x0030
            Value UUID: Track Title (0x2b97)
        Handle: 0x0032
        Value[5]: 123300982b
            Properties: 0x12
              Read (0x02)
              Notify (0x10)
            Value Handle: 0x0033
            Value UUID: Track Duration (0x2b98)
        Handle: 0x0035
        Value[5]: 1e3600992b
            Properties: 0x1e
              Read (0x02)
              Write Without Response (0x04)
              Write (0x08)
              Notify (0x10)
            Value Handle: 0x0036
            Value UUID: Track Position (0x2b99)
        Handle: 0x0038
        Value[5]: 1e39009a2b
            Properties: 0x1e
              Read (0x02)
              Write Without Response (0x04)
              Write (0x08)
              Notify (0x10)
            Value Handle: 0x0039
            Value UUID: Playback Speed (0x2b9a)
        Handle: 0x003b
        Value[5]: 123c009b2b
            Properties: 0x12
              Read (0x02)
              Notify (0x10)
            Value Handle: 0x003c
            Value UUID: Seeking Speed (0x2b9b)
        Handle: 0x003e
        Value[5]: 1e3f00a12b
            Properties: 0x1e
              Read (0x02)
              Write Without Response (0x04)
              Write (0x08)
              Notify (0x10)
            Value Handle: 0x003f
            Value UUID: Playing Order (0x2ba1)
        Handle: 0x0041
        Value[5]: 024200a22b
            Properties: 0x02
              Read (0x02)
            Value Handle: 0x0042
            Value UUID: Playing Orders Supported (0x2ba2)
        Handle: 0x0043
        Value[5]: 124400a32b
            Properties: 0x12
              Read (0x02)
              Notify (0x10)
            Value Handle: 0x0044
            Value UUID: Media State (0x2ba3)
        Handle: 0x0046
        Value[5]: 1c4700a42b
            Properties: 0x1c
              Write Without Response (0x04)
              Write (0x08)
              Notify (0x10)
            Value Handle: 0x0047
            Value UUID: Media Control Point (0x2ba4)
        Handle: 0x0049
        Value[5]: 124a00a52b
            Properties: 0x12
              Read (0x02)
              Notify (0x10)
            Value Handle: 0x004a
            Value UUID: Media Control Point Opcodes Supported (0x2ba5)
        Handle: 0x004c
        Value[5]: 024d00ba2b
            Properties: 0x02
              Read (0x02)
            Value Handle: 0x004d
            Value UUID: Content Control ID (0x2bba)
        Handle: 0x005b
        Value[5]: 125c00b32b
            Properties: 0x12
              Read (0x02)
              Notify (0x10)
            Value Handle: 0x005c
            Value UUID: Bearer Provider Name (0x2bb3)
        Handle: 0x005e
        Value[5]: 025f00b42b
            Properties: 0x02
              Read (0x02)
            Value Handle: 0x005f
            Value UUID: Bearer UCI (0x2bb4)
        Handle: 0x0060
        Value[5]: 126100b52b
            Properties: 0x12
              Read (0x02)
              Notify (0x10)
            Value Handle: 0x0061
            Value UUID: Bearer Technology (0x2bb5)
        Handle: 0x0063
        Value[5]: 126400b62b
            Properties: 0x12
              Read (0x02)
              Notify (0x10)
            Value Handle: 0x0064
            Value UUID: Bearer URI Schemes Supported List (0x2bb6)
        Handle: 0x0066
        Value[5]: 126700b92b
            Properties: 0x12
              Read (0x02)
              Notify (0x10)
            Value Handle: 0x0067
            Value UUID: Bearer List Current Calls (0x2bb9)
        Handle: 0x0069
        Value[5]: 026a00ba2b
            Properties: 0x02
              Read (0x02)
            Value Handle: 0x006a
            Value UUID: Content Control ID (0x2bba)
        Handle: 0x006b
        Value[5]: 126c00bb2b
            Properties: 0x12
              Read (0x02)
              Notify (0x10)
            Value Handle: 0x006c
            Value UUID: Status Flags (0x2bbb)
        Handle: 0x006e
        Value[5]: 126f00bd2b
            Properties: 0x12
              Read (0x02)
              Notify (0x10)
            Value Handle: 0x006f
            Value UUID: Call State (0x2bbd)
        Handle: 0x0071
        Value[5]: 1c7200be2b
            Properties: 0x1c
              Write Without Response (0x04)
              Write (0x08)
              Notify (0x10)
            Value Handle: 0x0072
            Value UUID: Call Control Point (0x2bbe)
        Handle: 0x0074
        Value[5]: 027500bf2b
            Properties: 0x02
              Read (0x02)
            Value Handle: 0x0075
            Value UUID: Call Control Point Optional Opcodes (0x2bbf)
        Handle: 0x0076
        Value[5]: 107700c02b
            Properties: 0x10
              Notify (0x10)
            Value Handle: 0x0077
            Value UUID: Termination Reason (0x2bc0)
        Handle: 0x0079
        Value[5]: 127a00c12b
            Properties: 0x12
              Read (0x02)
              Notify (0x10)
            Value Handle: 0x007a
            Value UUID: Incoming Call (0x2bc1)
        Handle: 0x007c
        Value[5]: 127d00c22b
            Properties: 0x12
              Read (0x02)
              Notify (0x10)
            Value Handle: 0x007d
            Value UUID: Call Friendly Name (0x2bc2)
        Handle: 0x0083
        Value[5]: 028400512b
            Properties: 0x02
              Read (0x02)
            Value Handle: 0x0084
            Value UUID: Telephony and Media Audio Profile Role (0x2b51)
bluetoothd[656]: < ACL Data TX: Handle 64 flags 0x00 dlen 11                                #383 [hci0] 320.257723
      ATT: Read By Type Request (0x08) len 6
        Handle range: 0x0084-0xffff
        Attribute type: Characteristic (0x2803)
> ACL Data RX: Handle 64 flags 0x02 dlen 11                                                 #384 [hci0] 320.262190
      ATT: Read By Type Request (0x08) len 6
        Handle range: 0x0005-0x0005
        Attribute type: Characteristic (0x2803)
bluetoothd[656]: < ACL Data TX: Handle 64 flags 0x00 dlen 9                                 #385 [hci0] 320.262471
      ATT: Error Response (0x01) len 4
        Read By Type Request (0x08)
        Handle: 0x0005
        Error: Attribute Not Found (0x0a)
> HCI Event: Number of Completed Packets (0x13) plen 5                                      #386 [hci0] 320.262614
        Num handles: 1
        Handle: 64 Address: 4D:C0:DF:3F:4B:7B (Resolvable)
        Count: 2
        #377: len 11 (1 Kb/s)
        Latency: 51 msec (51-299 msec ~63 msec)
        #379: len 20 (10 Kb/s)
        Latency: 15 msec (15-299 msec ~39 msec)
> ACL Data RX: Handle 64 flags 0x02 dlen 69                                                 #387 [hci0] 320.270367
      ATT: Read By Type Response (0x09) len 64
        Attribute data length: 21
        Attribute data list: 3 entries
        Handle: 0x0091
        Value[19]: 029200b5f364314f2e9182744e1bef02003ee7
            Properties: 0x02
              Read (0x02)
            Value Handle: 0x0092
            Value UUID: Vendor specific (e73e0002-ef1b-4e74-8291-2e4f3164f3b5)
        Handle: 0x0094
        Value[19]: 2895002581e88c722e8f97ea11db31e6364a59
            Properties: 0x28
              Write (0x08)
              Indicate (0x20)
            Value Handle: 0x0095
            Value UUID: Vendor specific (594a36e6-31db-11ea-978f-2e728ce88125)
        Handle: 0x0097
        Value[19]: 0c98002581e88c722e8f97ea11db3110304a59
            Properties: 0x0c
              Write Without Response (0x04)
              Write (0x08)
            Value Handle: 0x0098
            Value UUID: Vendor specific (594a3010-31db-11ea-978f-2e728ce88125)
bluetoothd[656]: < ACL Data TX: Handle 64 flags 0x00 dlen 11                                #388 [hci0] 320.270600
      ATT: Read By Type Request (0x08) len 6
        Handle range: 0x0098-0xffff
        Attribute type: Characteristic (0x2803)
> ACL Data RX: Handle 64 flags 0x02 dlen 11                                                 #389 [hci0] 320.277188
      ATT: Read By Type Request (0x08) len 6
        Handle range: 0x0006-0x000f
        Attribute type: Include (0x2802)
bluetoothd[656]: < ACL Data TX: Handle 64 flags 0x00 dlen 9                                 #390 [hci0] 320.277416
      ATT: Error Response (0x01) len 4
        Read By Type Request (0x08)
        Handle: 0x0006
        Error: Attribute Not Found (0x0a)
> HCI Event: Number of Completed Packets (0x13) plen 5                                      #391 [hci0] 320.277831
        Num handles: 1
        Handle: 64 Address: 4D:C0:DF:3F:4B:7B (Resolvable)
        Count: 2
        #383: len 11 (4 Kb/s)
        Latency: 20 msec (15-299 msec ~29 msec)
        #385: len 9 (4 Kb/s)
        Latency: 15 msec (15-299 msec ~22 msec)
> ACL Data RX: Handle 64 flags 0x02 dlen 9                                                  #392 [hci0] 320.284663
      ATT: Error Response (0x01) len 4
        Read By Type Request (0x08)
        Handle: 0x0098
        Error: Attribute Not Found (0x0a)
bluetoothd[656]: < ACL Data TX: Handle 64 flags 0x00 dlen 9                                 #393 [hci0] 320.285370
      ATT: Find Information Request (0x04) len 4
        Handle range: 0x0099-0xffff
> ACL Data RX: Handle 64 flags 0x02 dlen 11                                                 #394 [hci0] 320.292194
      ATT: Read By Type Request (0x08) len 6
        Handle range: 0x0006-0x000f
        Attribute type: Characteristic (0x2803)
bluetoothd[656]: < ACL Data TX: Handle 64 flags 0x00 dlen 27                                #395 [hci0] 320.292436
      ATT: Read By Type Response (0x09) len 22
        Attribute data length: 7
        Attribute data list: 3 entries
        Handle: 0x0007
        Value[5]: 200800052a
            Properties: 0x20
              Indicate (0x20)
            Value Handle: 0x0008
            Value UUID: Service Changed (0x2a05)
        Handle: 0x000a
        Value[5]: 0a0b00292b
            Properties: 0x0a
              Read (0x02)
              Write (0x08)
            Value Handle: 0x000b
            Value UUID: Client Supported Features (0x2b29)
        Handle: 0x000c
        Value[5]: 020d002a2b
            Properties: 0x02
              Read (0x02)
            Value Handle: 0x000d
            Value UUID: Database Hash (0x2b2a)
> HCI Event: Number of Completed Packets (0x13) plen 5                                      #396 [hci0] 320.292863
        Num handles: 1
        Handle: 64 Address: 4D:C0:DF:3F:4B:7B (Resolvable)
        Count: 2
        #388: len 11 (4 Kb/s)
        Latency: 22 msec (15-299 msec ~22 msec)
        #390: len 9 (4 Kb/s)
        Latency: 15 msec (15-299 msec ~18 msec)
> ACL Data RX: Handle 64 flags 0x02 dlen 24                                                 #397 [hci0] 320.299825
      ATT: Find Information Response (0x05) len 19
        Format: UUID-128 (0x02)
        Handle: 0x0099
        UUID: Vendor specific (594a3952-31db-11ea-978f-2e728ce88125)
bluetoothd[656]: < ACL Data TX: Handle 64 flags 0x00 dlen 9                                 #398 [hci0] 320.300109
      ATT: Find Information Request (0x04) len 4
        Handle range: 0x009a-0xffff
> ACL Data RX: Handle 64 flags 0x02 dlen 11                                                 #399 [hci0] 320.307189
      ATT: Read By Type Request (0x08) len 6
        Handle range: 0x000d-0x000f
        Attribute type: Characteristic (0x2803)
bluetoothd[656]: < ACL Data TX: Handle 64 flags 0x00 dlen 9                                 #400 [hci0] 320.307494
      ATT: Error Response (0x01) len 4
        Read By Type Request (0x08)
        Handle: 0x000d
        Error: Attribute Not Found (0x0a)
> HCI Event: Number of Completed Packets (0x13) plen 5                                      #401 [hci0] 320.307736
        Num handles: 1
        Handle: 64 Address: 4D:C0:DF:3F:4B:7B (Resolvable)
        Count: 2
        #393: len 9 (3 Kb/s)
        Latency: 22 msec (15-299 msec ~20 msec)
        #395: len 27 (14 Kb/s)
        Latency: 15 msec (15-299 msec ~17 msec)
> ACL Data RX: Handle 64 flags 0x02 dlen 9                                                  #402 [hci0] 320.314649
      ATT: Error Response (0x01) len 4
        Find Information Request (0x04)
        Handle: 0x009a
        Error: Attribute Not Found (0x0a)
bluetoothd[656]: < ACL Data TX: Handle 64 flags 0x00 dlen 11                                #403 [hci0] 320.315331
      ATT: Read By Type Request (0x08) len 6
        Handle range: 0x0001-0xffff
        Attribute type: Database Hash (0x2b2a)
> ACL Data RX: Handle 64 flags 0x02 dlen 9                                                  #404 [hci0] 320.322178
      ATT: Find Information Request (0x04) len 4
        Handle range: 0x0009-0x0009
bluetoothd[656]: < ACL Data TX: Handle 64 flags 0x00 dlen 10                                #405 [hci0] 320.322470
      ATT: Find Information Response (0x05) len 5
        Format: UUID-16 (0x01)
        Handle: 0x0009
        UUID: Client Characteristic Configuration (0x2902)
> HCI Event: Number of Completed Packets (0x13) plen 5                                      #406 [hci0] 320.322642
        Num handles: 1
        Handle: 64 Address: 4D:C0:DF:3F:4B:7B (Resolvable)
        Count: 2
        #398: len 9 (3 Kb/s)
        Latency: 22 msec (15-299 msec ~20 msec)
        #400: len 9 (4 Kb/s)
        Latency: 15 msec (15-299 msec ~17 msec)
> ACL Data RX: Handle 64 flags 0x02 dlen 24                                                 #407 [hci0] 320.329822
      ATT: Read By Type Response (0x09) len 19
        Attribute data length: 18
        Attribute data list: 1 entry
        Handle: 0x0009
        Value[16]: 8a3eadd4aef49a49dc575516f4663a43
bluetoothd[656]: < ACL Data TX: Handle 64 flags 0x00 dlen 11                                #408 [hci0] 320.330179
      ATT: Read By Type Request (0x08) len 6
        Handle range: 0x000a-0xffff
        Attribute type: Database Hash (0x2b2a)
> ACL Data RX: Handle 64 flags 0x02 dlen 9                                                  #409 [hci0] 320.337173
      ATT: Find Information Request (0x04) len 4
        Handle range: 0x000e-0x000f
bluetoothd[656]: < ACL Data TX: Handle 64 flags 0x00 dlen 9                                 #410 [hci0] 320.337450
      ATT: Error Response (0x01) len 4
        Find Information Request (0x04)
        Handle: 0x000e
        Error: Attribute Not Found (0x0a)
> HCI Event: Number of Completed Packets (0x13) plen 5                                      #411 [hci0] 320.337686
        Num handles: 1
        Handle: 64 Address: 4D:C0:DF:3F:4B:7B (Resolvable)
        Count: 2
        #403: len 11 (4 Kb/s)
        Latency: 22 msec (15-299 msec ~20 msec)
        #405: len 10 (5 Kb/s)
        Latency: 15 msec (15-299 msec ~17 msec)
> ACL Data RX: Handle 64 flags 0x02 dlen 9                                                  #412 [hci0] 320.344652
      ATT: Error Response (0x01) len 4
        Read By Type Request (0x08)
        Handle: 0x000a
        Error: Attribute Not Found (0x0a)
bluetoothd[656]: < ACL Data TX: Handle 64 flags 0x00 dlen 8                                 #413 [hci0] 320.351983
      ATT: Write Request (0x12) len 3
        Handle: 0x0007 Type: Client Supported Features (0x2b29)
          Data[1]: 05
> ACL Data RX: Handle 64 flags 0x02 dlen 11                                                 #414 [hci0] 320.352416
      ATT: Read By Type Request (0x08) len 6
        Handle range: 0x0010-0x0012
        Attribute type: Include (0x2802)
> HCI Event: Number of Completed Packets (0x13) plen 5                                      #415 [hci0] 320.352687
        Num handles: 1
        Handle: 64 Address: 4D:C0:DF:3F:4B:7B (Resolvable)
        Count: 2
        #408: len 11 (4 Kb/s)
        Latency: 22 msec (15-299 msec ~20 msec)
        #410: len 9 (4 Kb/s)
        Latency: 15 msec (15-299 msec ~17 msec)
> ACL Data RX: Handle 64 flags 0x02 dlen 5                                                  #416 [hci0] 320.367276
      ATT: Write Response (0x13) len 0
bluetoothd[656]: < ACL Data TX: Handle 64 flags 0x00 dlen 9                                 #417 [hci0] 320.369681
      ATT: Error Response (0x01) len 4
        Read By Type Request (0x08)
        Handle: 0x0010
        Error: Attribute Not Found (0x0a)
bluetoothd[656]: < ACL Data TX: Handle 64 flags 0x00 dlen 7                                 #418 [hci0] 320.369770
      ATT: Read Request (0x0a) len 2
        Handle: 0x0016 Type: Device Name (0x2a00)
> HCI Event: Number of Completed Packets (0x13) plen 5                                      #419 [hci0] 320.376399
        Num handles: 1
        Handle: 64 Address: 4D:C0:DF:3F:4B:7B (Resolvable)
        Count: 2
        #413: len 8 (2 Kb/s)
        Latency: 24 msec (15-299 msec ~21 msec)
        #417: len 9 (12 Kb/s)
        Latency: 6 msec (6-299 msec ~13 msec)
> ACL Data RX: Handle 64 flags 0x02 dlen 11                                                 #420 [hci0] 320.382264
      ATT: Read By Type Request (0x08) len 6
        Handle range: 0x0010-0x0012
        Attribute type: Characteristic (0x2803)
bluetoothd[656]: < ACL Data TX: Handle 64 flags 0x00 dlen 13                                #421 [hci0] 320.382629
      ATT: Read By Type Response (0x09) len 8
        Attribute data length: 7
        Attribute data list: 1 entry
        Handle: 0x0011
        Value[5]: 021200502a
            Properties: 0x02
              Read (0x02)
            Value Handle: 0x0012
            Value UUID: PnP ID (0x2a50)
> ACL Data RX: Handle 64 flags 0x02 dlen 20                                                 #422 [hci0] 320.382744
      ATT: Read Response (0x0b) len 15
        Value[15]: 5332332b20646520416e74686f6e79
        Handle: 0x0016 Type: Device Name (0x2a00)
        Value[15]: 5332332b20646520416e74686f6e79
bluetoothd[656]: < ACL Data TX: Handle 64 flags 0x00 dlen 7                                 #423 [hci0] 320.382958
      ATT: Read Request (0x0a) len 2
        Handle: 0x0018 Type: Appearance (0x2a01)
> HCI Event: Number of Completed Packets (0x13) plen 5                                      #424 [hci0] 320.390189
        Num handles: 1
        Handle: 64 Address: 4D:C0:DF:3F:4B:7B (Resolvable)
        Count: 2
        #418: len 7 (2 Kb/s)
        Latency: 20 msec (6-299 msec ~17 msec)
        #421: len 13 (14 Kb/s)
        Latency: 7 msec (6-299 msec ~12 msec)
> ACL Data RX: Handle 64 flags 0x02 dlen 11                                                 #425 [hci0] 320.397235
      ATT: Read By Type Request (0x08) len 6
        Handle range: 0x0012-0x0012
        Attribute type: Characteristic (0x2803)
> ACL Data RX: Handle 64 flags 0x02 dlen 7                                                  #426 [hci0] 320.397603
      ATT: Read Response (0x0b) len 2
        Value[2]: 0000
        Handle: 0x0018 Type: Appearance (0x2a01)
        Value[2]: 0000
bluetoothd[656]: < ACL Data TX: Handle 64 flags 0x00 dlen 9                                 #427 [hci0] 320.397646
      ATT: Error Response (0x01) len 4
        Read By Type Request (0x08)
        Handle: 0x0012
        Error: Attribute Not Found (0x0a)
> ACL Data RX: Handle 64 flags 0x02 dlen 11                                                 #428 [hci0] 320.412426
      ATT: Read By Type Request (0x08) len 6
        Handle range: 0x0013-0x0017
        Attribute type: Include (0x2802)
> HCI Event: Number of Completed Packets (0x13) plen 5                                      #429 [hci0] 320.412582
        Num handles: 1
        Handle: 64 Address: 4D:C0:DF:3F:4B:7B (Resolvable)
        Count: 2
        #423: len 7 (1 Kb/s)
        Latency: 29 msec (6-299 msec ~20 msec)
        #427: len 9 (5 Kb/s)
        Latency: 14 msec (6-299 msec ~17 msec)
bluetoothd[656]: < ACL Data TX: Handle 64 flags 0x00 dlen 9                                 #430 [hci0] 320.412781
      ATT: Error Response (0x01) len 4
        Read By Type Request (0x08)
        Handle: 0x0013
        Error: Attribute Not Found (0x0a)
> ACL Data RX: Handle 64 flags 0x02 dlen 11                                                 #431 [hci0] 320.428230
      ATT: Read By Type Request (0x08) len 6
        Handle range: 0x0013-0x0017
        Attribute type: Characteristic (0x2803)
bluetoothd[656]: < ACL Data TX: Handle 64 flags 0x00 dlen 27                                #432 [hci0] 320.428547
      ATT: Read By Type Response (0x09) len 22
        Attribute data length: 21
        Attribute data list: 1 entry
        Handle: 0x0014
        Value[19]: 1e1500f36b109d66f2a9a112416838dbe57277
            Properties: 0x1e
              Read (0x02)
              Write Without Response (0x04)
              Write (0x08)
              Notify (0x10)
            Value Handle: 0x0015
            Value UUID: Vendor specific (7772e5db-3868-4112-a1a9-f2669d106bf3)
> ACL Data RX: Handle 64 flags 0x02 dlen 11                                                 #433 [hci0] 320.442432
      ATT: Read By Type Request (0x08) len 6
        Handle range: 0x0015-0x0017
        Attribute type: Characteristic (0x2803)
> HCI Event: Number of Completed Packets (0x13) plen 5                                      #434 [hci0] 320.442604
        Num handles: 1
        Handle: 64 Address: 4D:C0:DF:3F:4B:7B (Resolvable)
        Count: 2
        #430: len 9 (2 Kb/s)
        Latency: 29 msec (6-299 msec ~23 msec)
        #432: len 27 (15 Kb/s)
        Latency: 14 msec (6-299 msec ~18 msec)
bluetoothd[656]: < ACL Data TX: Handle 64 flags 0x00 dlen 9                                 #435 [hci0] 320.442788
      ATT: Error Response (0x01) len 4
        Read By Type Request (0x08)
        Handle: 0x0015
        Error: Attribute Not Found (0x0a)
> ACL Data RX: Handle 64 flags 0x02 dlen 9                                                  #436 [hci0] 320.457195
      ATT: Find Information Request (0x04) len 4
        Handle range: 0x0016-0x0017
bluetoothd[656]: < ACL Data TX: Handle 64 flags 0x00 dlen 14                                #437 [hci0] 320.457529
      ATT: Find Information Response (0x05) len 9
        Format: UUID-16 (0x01)
        Handle: 0x0016
        UUID: Client Characteristic Configuration (0x2902)
        Handle: 0x0017
        UUID: Characteristic User Description (0x2901)
> ACL Data RX: Handle 64 flags 0x02 dlen 11                                                 #438 [hci0] 320.475656
      ATT: Read By Type Request (0x08) len 6
        Handle range: 0x0024-0x0026
        Attribute type: Include (0x2802)
> HCI Event: Number of Completed Packets (0x13) plen 5                                      #439 [hci0] 320.475664
        Num handles: 1
        Handle: 64 Address: 4D:C0:DF:3F:4B:7B (Resolvable)
        Count: 2
        #435: len 9 (2 Kb/s)
        Latency: 32 msec (6-299 msec ~25 msec)
        #437: len 14 (6 Kb/s)
        Latency: 18 msec (6-299 msec ~22 msec)
bluetoothd[656]: < ACL Data TX: Handle 64 flags 0x00 dlen 9                                 #440 [hci0] 320.475896
      ATT: Error Response (0x01) len 4
        Read By Type Request (0x08)
        Handle: 0x0024
        Error: Attribute Not Found (0x0a)
> ACL Data RX: Handle 64 flags 0x02 dlen 11                                                 #441 [hci0] 320.487184
      ATT: Read By Type Request (0x08) len 6
        Handle range: 0x0024-0x0026
        Attribute type: Characteristic (0x2803)
bluetoothd[656]: < ACL Data TX: Handle 64 flags 0x00 dlen 27                                #442 [hci0] 320.487437
      ATT: Read By Type Response (0x09) len 22
        Attribute data length: 21
        Attribute data list: 1 entry
        Handle: 0x0025
        Value[19]: 022600274168e036276e88434fd7b20428496f
            Properties: 0x02
              Read (0x02)
            Value Handle: 0x0026
            Value UUID: Vendor specific (6f492804-b2d7-4f43-886e-2736e0684127)
> ACL Data RX: Handle 64 flags 0x02 dlen 11                                                 #443 [hci0] 320.502413
      ATT: Read By Type Request (0x08) len 6
        Handle range: 0x0026-0x0026
        Attribute type: Characteristic (0x2803)
> HCI Event: Number of Completed Packets (0x13) plen 5                                      #444 [hci0] 320.502580
        Num handles: 1
        Handle: 64 Address: 4D:C0:DF:3F:4B:7B (Resolvable)
        Count: 2
        #440: len 9 (2 Kb/s)
        Latency: 26 msec (6-299 msec ~24 msec)
        #442: len 27 (14 Kb/s)
        Latency: 15 msec (6-299 msec ~19 msec)
bluetoothd[656]: < ACL Data TX: Handle 64 flags 0x00 dlen 9                                 #445 [hci0] 320.502681
      ATT: Error Response (0x01) len 4
        Read By Type Request (0x08)
        Handle: 0x0026
        Error: Attribute Not Found (0x0a)
> HCI Event: LE Meta Event (0x3e) plen 11                                                   #446 [hci0] 320.525134
      LE Remote Connection Parameter Request (0x06)
        Handle: 64 Address: 4D:C0:DF:3F:4B:7B (Resolvable)
        Min connection interval: 30.00 msec (0x0018)
        Max connection interval: 30.00 msec (0x0018)
        Connection latency: 0 (0x0000)
        Supervision timeout: 5000 msec (0x01f4)
< HCI Command: LE Remote Connection Parameter Request Reply (0x08|0x0020) plen 14           #447 [hci0] 320.525209
        Handle: 64 Address: 4D:C0:DF:3F:4B:7B (Resolvable)
        Min connection interval: 30.00 msec (0x0018)
        Max connection interval: 30.00 msec (0x0018)
        Connection latency: 0 (0x0000)
        Supervision timeout: 5000 msec (0x01f4)
        Min connection length: 0.000 msec (0x0000)
        Max connection length: 0.000 msec (0x0000)
> HCI Event: Command Complete (0x0e) plen 6                                                 #448 [hci0] 320.528293
      LE Remote Connection Parameter Request Reply (0x08|0x0020) ncmd 1
        Status: Success (0x00)
        Handle: 64 Address: 4D:C0:DF:3F:4B:7B (Resolvable)
> HCI Event: LE Meta Event (0x3e) plen 10                                                   #449 [hci0] 320.621371
      LE Connection Update Complete (0x03)
        Status: Success (0x00)
        Handle: 64 Address: 4D:C0:DF:3F:4B:7B (Resolvable)
        Connection interval: 30.00 msec (0x0018)
        Connection latency: 0 (0x0000)
        Supervision timeout: 5000 msec (0x01f4)
> HCI Event: Number of Completed Packets (0x13) plen 5                                      #450 [hci0] 320.692356
        Num handles: 1
        Handle: 64 Address: 4D:C0:DF:3F:4B:7B (Resolvable)
        Count: 1
        #445: len 9 (0 Kb/s)
        Latency: 189 msec (6-299 msec ~104 msec)
< HCI Command: LE Set Advertising Parameters (0x08|0x0006) plen 15                          #451 [hci0] 321.389234
        Min advertising interval: 1280.000 msec (0x0800)
        Max advertising interval: 1280.000 msec (0x0800)
        Type: Connectable undirected - ADV_IND (0x00)
        Own address type: Public (0x00)
        Direct address type: Public (0x00)
        Direct address: 00:00:00:00:00:00 (OUI 00-00-00)
        Channel map: 37, 38, 39 (0x07)
        Filter policy: Allow Scan Request from Any, Allow Connect Request from Any (0x00)
> HCI Event: Command Complete (0x0e) plen 4                                                 #452 [hci0] 321.389568
      LE Set Advertising Parameters (0x08|0x0006) ncmd 1
        Status: Success (0x00)
< HCI Command: LE Set Advertise Enable (0x08|0x000a) plen 1                                 #453 [hci0] 321.389613
        Advertising: Enabled (0x01)
> HCI Event: Command Complete (0x0e) plen 4                                                 #454 [hci0] 321.390005
      LE Set Advertise Enable (0x08|0x000a) ncmd 1
        Status: Success (0x00)

