        Available adv data len: 28
        Available scan rsp data len: 31
bluetoothd[656]: @ MGMT Command: Add Extended Advertising Data (0x0055) plen 44          {0x0001} [hci0] 14.762438
        Instance: 1
        Advertising data length: 18
        128-bit Service UUIDs (complete): 1 entry
          Vendor specific
        Scan response length: 15
        Name (complete): Sentinel-STRI
< HCI Command: LE Set Advertising Parameters (0x08|0x0006) plen 15                             #3 [hci0] 14.762552
        Min advertising interval: 1280.000 msec (0x0800)
        Max advertising interval: 1280.000 msec (0x0800)
        Type: Connectable undirected - ADV_IND (0x00)
        Own address type: Public (0x00)
        Direct address type: Public (0x00)
        Direct address: 00:00:00:00:00:00 (OUI 00-00-00)
        Channel map: 37, 38, 39 (0x07)
        Filter policy: Allow Scan Request from Any, Allow Connect Request from Any (0x00)
> HCI Event: Command Complete (0x0e) plen 4                                                    #4 [hci0] 14.762891
      LE Set Advertising Parameters (0x08|0x0006) ncmd 1
        Status: Success (0x00)
< HCI Command: LE Set Advertise Enable (0x08|0x000a) plen 1                                    #5 [hci0] 14.762938
        Advertising: Enabled (0x01)
> HCI Event: Command Complete (0x0e) plen 4                                                    #6 [hci0] 14.763358
      LE Set Advertise Enable (0x08|0x000a) ncmd 1
        Status: Success (0x00)
@ MGMT Event: Command Complete (0x0001) plen 4                                           {0x0001} [hci0] 14.763442
      Add Extended Advertising Data (0x0055) plen 1
        Status: Success (0x00)
        Instance: 1
@ MGMT Event: New Settings (0x0006) plen 4                                              {0x0001} [hci0] 169.141180
        Current settings: 0x00000ad3
          Powered
          Connectable
          Bondable
          Secure Simple Pairing
          BR/EDR
          Low Energy
          Secure Connections
bluetoothd[656]: @ MGMT Command: Add Extended Advertising Parameters (0x0054) plen 18   {0x0001} [hci0] 169.149859
        Instance: 1
        Flags: 0x00010001
          Switch into Connectable mode
          Contain Scan Response Data
        Duration: 0
        Timeout: 0
        Min advertising interval: 0.000 msec (0x0000)
        Max advertising interval: 0.000 msec (0x0000)
        TX power: 0 dbm (0x00)
@ MGMT Event: Command Complete (0x0001) plen 7                                          {0x0001} [hci0] 169.150211
      Add Extended Advertising Parameters (0x0054) plen 4
        Status: Success (0x00)
        Instance: 1
        TX power: 127 dbm (0x7f)
        Available adv data len: 31
        Available scan rsp data len: 31
bluetoothd[656]: @ MGMT Command: Add Extended Advertising Data (0x0055) plen 44         {0x0001} [hci0] 169.150499
        Instance: 1
        Advertising data length: 18
        128-bit Service UUIDs (complete): 1 entry
          Vendor specific
        Scan response length: 15
        Name (complete): Sentinel-STRI
< HCI Command: LE Set Advertising Data (0x08|0x0008) plen 32                                  #7 [hci0] 169.150642
        Length: 18
        128-bit Service UUIDs (complete): 1 entry
          Vendor specific
> HCI Event: Command Complete (0x0e) plen 4                                                   #8 [hci0] 169.151054
      LE Set Advertising Data (0x08|0x0008) ncmd 1
        Status: Success (0x00)
< HCI Command: LE Set Advertise Enable (0x08|0x000a) plen 1                                   #9 [hci0] 169.151154
        Advertising: Disabled (0x00)
> HCI Event: Command Complete (0x0e) plen 4                                                  #10 [hci0] 169.153227
      LE Set Advertise Enable (0x08|0x000a) ncmd 1
        Status: Success (0x00)
< HCI Command: LE Set Advertising Parameters (0x08|0x0006) plen 15                           #11 [hci0] 169.153432
        Min advertising interval: 1280.000 msec (0x0800)
        Max advertising interval: 1280.000 msec (0x0800)
        Type: Connectable undirected - ADV_IND (0x00)
        Own address type: Public (0x00)
        Direct address type: Public (0x00)
        Direct address: 00:00:00:00:00:00 (OUI 00-00-00)
        Channel map: 37, 38, 39 (0x07)
        Filter policy: Allow Scan Request from Any, Allow Connect Request from Any (0x00)
> HCI Event: Command Complete (0x0e) plen 4                                                  #12 [hci0] 169.154270
      LE Set Advertising Parameters (0x08|0x0006) ncmd 1
        Status: Success (0x00)
< HCI Command: LE Set Advertise Enable (0x08|0x000a) plen 1                                  #13 [hci0] 169.154354
        Advertising: Enabled (0x01)
> HCI Event: Command Complete (0x0e) plen 4                                                  #14 [hci0] 169.154741
      LE Set Advertise Enable (0x08|0x000a) ncmd 1
        Status: Success (0x00)
@ MGMT Event: Command Complete (0x0001) plen 4                                          {0x0001} [hci0] 169.154794
      Add Extended Advertising Data (0x0055) plen 1
        Status: Success (0x00)
        Instance: 1
> HCI Event: LE Meta Event (0x3e) plen 19                                                    #15 [hci0] 228.144079
      LE Connection Complete (0x01)
        Status: Success (0x00)
        Handle: 64
        Role: Peripheral (0x01)
        Peer address type: Random (0x01)
        Peer address: 50:81:1C:08:7C:04 (Resolvable)
        Connection interval: 30.00 msec (0x0018)
        Connection latency: 0 (0x0000)
        Supervision timeout: 5000 msec (0x01f4)
        Central clock accuracy: 0x05
@ MGMT Event: Device Connected (0x000b) plen 13                                         {0x0001} [hci0] 228.144154
        LE Address: 50:81:1C:08:7C:04 (Resolvable)
        Flags: 0x00000000
        Data length: 0
btmon[9657]: @ RAW Open: btmon (privileged) version 2.22                                       {0x0002} 228.144474
btmon[9657]: @ RAW Close: btmon                                                                {0x0002} 228.144493
< HCI Command: LE Read Remote Used Features (0x08|0x0016) plen 2                             #16 [hci0] 228.144815
        Handle: 64 Address: 50:81:1C:08:7C:04 (Resolvable)
> HCI Event: Vendor (0xff) plen 5                                                            #17 [hci0] 228.144855
        55 00 00 40 00                                   U..@.           
> HCI Event: Command Status (0x0f) plen 4                                                    #18 [hci0] 228.149370
      LE Read Remote Used Features (0x08|0x0016) ncmd 1
        Status: Success (0x00)
> HCI Event: LE Meta Event (0x3e) plen 12                                                    #19 [hci0] 228.195221
      LE Read Remote Used Features (0x04)
        Status: Success (0x00)
        Handle: 64 Address: 50:81:1C:08:7C:04 (Resolvable)
        Features: 0x3f 0x00 0x00 0x00 0x00 0x00 0x00 0x00
          LE Encryption
          Connection Parameter Request Procedure
          Extended Reject Indication
          Peripheral-initiated Features Exchange
          LE Ping
          LE Data Packet Length Extension
bluetoothd[656]: < ACL Data TX: Handle 64 flags 0x00 dlen 7                                  #20 [hci0] 228.195995
      ATT: Exchange MTU Request (0x02) len 2
        Client RX MTU: 517
> HCI Event: LE Meta Event (0x3e) plen 11                                                    #21 [hci0] 228.254899
      LE Data Length Change (0x07)
        Handle: 64 Address: 50:81:1C:08:7C:04 (Resolvable)
        Max TX octets: 251
        Max TX time: 2120
        Max RX octets: 27
        Max RX time: 328
> ACL Data RX: Handle 64 flags 0x02 dlen 11                                                  #22 [hci0] 228.434579
      ATT: Read By Type Request (0x08) len 6
        Handle range: 0x0001-0xffff
        Attribute type: Device Name (0x2a00)
bluetoothd[656]: < ACL Data TX: Handle 64 flags 0x00 dlen 21                                 #23 [hci0] 228.434826
      ATT: Read By Type Response (0x09) len 16
        Attribute data length: 15
        Attribute data list: 1 entry
        Handle: 0x0003
        Value[13]: 53656e74696e656c6c652d5631
> ACL Data RX: Handle 64 flags 0x02 dlen 7                                                   #24 [hci0] 228.434957
      ATT: Exchange MTU Response (0x03) len 2
        Server RX MTU: 517
bluetoothd[656]: < ACL Data TX: Handle 64 flags 0x00 dlen 11                                 #25 [hci0] 228.435263
      ATT: Read By Type Request (0x08) len 6
        Handle range: 0x0001-0xffff
        Attribute type: Server Supported Features (0x2b3a)
> HCI Event: LE Meta Event (0x3e) plen 11                                                    #26 [hci0] 228.464873
      LE Data Length Change (0x07)
        Handle: 64 Address: 50:81:1C:08:7C:04 (Resolvable)
        Max TX octets: 251
        Max TX time: 2120
        Max RX octets: 251
        Max RX time: 2120
> HCI Event: Number of Completed Packets (0x13) plen 5                                       #27 [hci0] 228.495094
        Num handles: 1
        Handle: 64 Address: 50:81:1C:08:7C:04 (Resolvable)
        Count: 2
        #20: len 7 (0 Kb/s)
        Latency: 299 msec (299-299 msec ~299 msec)
        #23: len 21 (2 Kb/s)
        Latency: 60 msec (60-299 msec ~179 msec)
> ACL Data RX: Handle 64 flags 0x02 dlen 11                                                  #28 [hci0] 228.524490
      ATT: Read By Group Type Request (0x10) len 6
        Handle range: 0x0001-0xffff
        Attribute group type: Primary Service (0x2800)
bluetoothd[656]: < ACL Data TX: Handle 64 flags 0x00 dlen 24                                 #29 [hci0] 228.524644
      ATT: Read By Group Type Response (0x11) len 19
        Attribute data length: 6
        Attribute group list: 3 entries
        Handle range: 0x0001-0x0005
        UUID: Generic Access Profile (0x1800)
        Handle range: 0x0006-0x000f
        UUID: Generic Attribute Profile (0x1801)
        Handle range: 0x0010-0x0012
        UUID: Device Information (0x180a)
> ACL Data RX: Handle 64 flags 0x02 dlen 9                                                   #30 [hci0] 228.525056
      ATT: Read By Type Response (0x09) len 4
        Attribute data length: 3
        Attribute data list: 1 entry
        Handle: 0x0005
        Value[1]: 01
bluetoothd[656]: < ACL Data TX: Handle 64 flags 0x00 dlen 11                                 #31 [hci0] 228.525188
      ATT: Read By Group Type Request (0x10) len 6
        Handle range: 0x0001-0xffff
        Attribute group type: Primary Service (0x2800)
> HCI Event: LE Meta Event (0x3e) plen 11                                                    #32 [hci0] 228.554914
      LE Remote Connection Parameter Request (0x06)
        Handle: 64 Address: 50:81:1C:08:7C:04 (Resolvable)
        Min connection interval: 7.50 msec (0x0006)
        Max connection interval: 7.50 msec (0x0006)
        Connection latency: 0 (0x0000)
        Supervision timeout: 5000 msec (0x01f4)
< HCI Command: LE Remote Connection Parameter Request Reply (0x08|0x0020) plen 14            #33 [hci0] 228.554934
        Handle: 64 Address: 50:81:1C:08:7C:04 (Resolvable)
        Min connection interval: 7.50 msec (0x0006)
        Max connection interval: 7.50 msec (0x0006)
        Connection latency: 0 (0x0000)
        Supervision timeout: 5000 msec (0x01f4)
        Min connection length: 0.000 msec (0x0000)
        Max connection length: 0.000 msec (0x0000)
> HCI Event: Number of Completed Packets (0x13) plen 5                                       #34 [hci0] 228.555610
        Num handles: 1
        Handle: 64 Address: 50:81:1C:08:7C:04 (Resolvable)
        Count: 2
        #25: len 11 (0 Kb/s)
        Latency: 120 msec (60-299 msec ~150 msec)
        #29: len 24 (6 Kb/s)
        Latency: 30 msec (30-299 msec ~90 msec)
> HCI Event: Command Complete (0x0e) plen 6                                                  #35 [hci0] 228.559347
      LE Remote Connection Parameter Request Reply (0x08|0x0020) ncmd 1
        Status: Success (0x00)
        Handle: 64 Address: 50:81:1C:08:7C:04 (Resolvable)
> ACL Data RX: Handle 64 flags 0x02 dlen 11                                                  #36 [hci0] 228.584582
      ATT: Read By Group Type Request (0x10) len 6
        Handle range: 0x0013-0xffff
        Attribute group type: Primary Service (0x2800)
bluetoothd[656]: < ACL Data TX: Handle 64 flags 0x00 dlen 46                                 #37 [hci0] 228.584730
      ATT: Read By Group Type Response (0x11) len 41
        Attribute data length: 20
        Attribute group list: 2 entries
        Handle range: 0x0013-0x0017
        UUID: Vendor specific (03b80e5a-ede8-4b33-a751-6ce34ec4c700)
        Handle range: 0x001e-0x0020
        UUID: Vendor specific (e865862f-0c29-47b7-9a5b-274b2c82ce8c)
> ACL Data RX: Handle 64 flags 0x02 dlen 36                                                  #38 [hci0] 228.614852
      ATT: Read By Group Type Response (0x11) len 31
        Attribute data length: 6
        Attribute group list: 5 entries
        Handle range: 0x0001-0x0009
        UUID: Generic Attribute Profile (0x1801)
        Handle range: 0x0014-0x001a
        UUID: Generic Access Profile (0x1800)
        Handle range: 0x0028-0x004d
        UUID: Generic Media Control (0x1849)
        Handle range: 0x005a-0x007e
        UUID: Generic Telephony Bearer (0x184c)
        Handle range: 0x0082-0x0084
        UUID: Telephony and Media Audio (0x1855)
bluetoothd[656]: < ACL Data TX: Handle 64 flags 0x00 dlen 11                                 #39 [hci0] 228.614980
      ATT: Read By Type Request (0x08) len 6
        Handle range: 0x0006-0xffff
        Attribute type: Server Supported Features (0x2b3a)
> HCI Event: Number of Completed Packets (0x13) plen 5                                       #40 [hci0] 228.675475
        Num handles: 1
        Handle: 64 Address: 50:81:1C:08:7C:04 (Resolvable)
        Count: 2
        #31: len 11 (0 Kb/s)
        Latency: 150 msec (30-299 msec ~120 msec)
        #37: len 46 (4 Kb/s)
        Latency: 90 msec (30-299 msec ~105 msec)
> ACL Data RX: Handle 64 flags 0x02 dlen 11                                                  #41 [hci0] 228.704561
      ATT: Read By Group Type Request (0x10) len 6
        Handle range: 0x0021-0xffff
        Attribute group type: Primary Service (0x2800)
bluetoothd[656]: < ACL Data TX: Handle 64 flags 0x00 dlen 9                                  #42 [hci0] 228.704759
      ATT: Error Response (0x01) len 4
        Read By Group Type Request (0x10)
        Handle: 0x0021
        Error: Attribute Not Found (0x0a)
> ACL Data RX: Handle 64 flags 0x02 dlen 9                                                   #43 [hci0] 228.704983
      ATT: Error Response (0x01) len 4
        Read By Type Request (0x08)
        Handle: 0x0006
        Error: Attribute Not Found (0x0a)
bluetoothd[656]: < ACL Data TX: Handle 64 flags 0x00 dlen 11                                 #44 [hci0] 228.705160
      ATT: Read By Group Type Request (0x10) len 6
        Handle range: 0x0085-0xffff
        Attribute group type: Primary Service (0x2800)
> HCI Event: Number of Completed Packets (0x13) plen 5                                       #45 [hci0] 228.734976
        Num handles: 1
        Handle: 64 Address: 50:81:1C:08:7C:04 (Resolvable)
        Count: 2
        #39: len 11 (0 Kb/s)
        Latency: 119 msec (30-299 msec ~112 msec)
        #42: len 9 (2 Kb/s)
        Latency: 30 msec (30-299 msec ~71 msec)
> ACL Data RX: Handle 64 flags 0x02 dlen 11                                                  #46 [hci0] 228.764560
      ATT: Read By Type Request (0x08) len 6
        Handle range: 0x0001-0x0005
        Attribute type: Include (0x2802)
bluetoothd[656]: < ACL Data TX: Handle 64 flags 0x00 dlen 9                                  #47 [hci0] 228.764684
      ATT: Error Response (0x01) len 4
        Read By Type Request (0x08)
        Handle: 0x0001
        Error: Attribute Not Found (0x0a)
> ACL Data RX: Handle 64 flags 0x02 dlen 46                                                  #48 [hci0] 228.765588
      ATT: Read By Group Type Response (0x11) len 41
        Attribute data length: 20
        Attribute group list: 2 entries
        Handle range: 0x0090-0x0092
        UUID: Vendor specific (e73e0001-ef1b-4e74-8291-2e4f3164f3b5)
        Handle range: 0x0093-0xffff
        UUID: Vendor specific (594a34fc-31db-11ea-978f-2e728ce88125)
bluetoothd[656]: < ACL Data TX: Handle 64 flags 0x00 dlen 11                                 #49 [hci0] 228.766170
      ATT: Read By Group Type Request (0x10) len 6
        Handle range: 0x0001-0xffff
        Attribute group type: Secondary Service (0x2801)
> HCI Event: Number of Completed Packets (0x13) plen 5                                       #50 [hci0] 228.794978
        Num handles: 1
        Handle: 64 Address: 50:81:1C:08:7C:04 (Resolvable)
        Count: 2
        #44: len 11 (0 Kb/s)
        Latency: 89 msec (30-299 msec ~80 msec)
        #47: len 9 (2 Kb/s)
        Latency: 30 msec (30-299 msec ~55 msec)
> ACL Data RX: Handle 64 flags 0x02 dlen 11                                                  #51 [hci0] 228.824560
      ATT: Read By Type Request (0x08) len 6
        Handle range: 0x0001-0x0005
        Attribute type: Characteristic (0x2803)
bluetoothd[656]: < ACL Data TX: Handle 64 flags 0x00 dlen 20                                 #52 [hci0] 228.824712
      ATT: Read By Type Response (0x09) len 15
        Attribute data length: 7
        Attribute data list: 2 entries
        Handle: 0x0002
        Value[5]: 020300002a
            Properties: 0x02
              Read (0x02)
            Value Handle: 0x0003
            Value UUID: Device Name (0x2a00)
        Handle: 0x0004
        Value[5]: 020500012a
            Properties: 0x02
              Read (0x02)
            Value Handle: 0x0005
            Value UUID: Appearance (0x2a01)
> ACL Data RX: Handle 64 flags 0x02 dlen 9                                                   #53 [hci0] 228.825045
      ATT: Error Response (0x01) len 4
        Read By Group Type Request (0x10)
        Handle: 0x0001
        Error: Unsupported Group Type (0x10)
bluetoothd[656]: < ACL Data TX: Handle 64 flags 0x00 dlen 11                                 #54 [hci0] 228.825250
      ATT: Read By Type Request (0x08) len 6
        Handle range: 0x0001-0xffff
        Attribute type: Include (0x2802)
> HCI Event: Number of Completed Packets (0x13) plen 5                                       #55 [hci0] 228.855068
        Num handles: 1
        Handle: 64 Address: 50:81:1C:08:7C:04 (Resolvable)
        Count: 2
        #49: len 11 (1 Kb/s)
        Latency: 88 msec (30-299 msec ~72 msec)
        #52: len 20 (5 Kb/s)
        Latency: 30 msec (30-299 msec ~51 msec)
> ACL Data RX: Handle 64 flags 0x02 dlen 11                                                  #56 [hci0] 228.884558
      ATT: Read By Type Request (0x08) len 6
        Handle range: 0x0005-0x0005
        Attribute type: Characteristic (0x2803)
bluetoothd[656]: < ACL Data TX: Handle 64 flags 0x00 dlen 9                                  #57 [hci0] 228.884716
      ATT: Error Response (0x01) len 4
        Read By Type Request (0x08)
        Handle: 0x0005
        Error: Attribute Not Found (0x0a)
> ACL Data RX: Handle 64 flags 0x02 dlen 9                                                   #58 [hci0] 228.885162
      ATT: Error Response (0x01) len 4
        Read By Type Request (0x08)
        Handle: 0x0001
        Error: Attribute Not Found (0x0a)
bluetoothd[656]: < ACL Data TX: Handle 64 flags 0x00 dlen 11                                 #59 [hci0] 228.885331
      ATT: Read By Type Request (0x08) len 6
        Handle range: 0x0001-0xffff
        Attribute type: Characteristic (0x2803)
> HCI Event: Number of Completed Packets (0x13) plen 5                                       #60 [hci0] 228.916233
        Num handles: 1
        Handle: 64 Address: 50:81:1C:08:7C:04 (Resolvable)
        Count: 2
        #54: len 11 (0 Kb/s)
        Latency: 90 msec (30-299 msec ~71 msec)
        #57: len 9 (2 Kb/s)
        Latency: 31 msec (30-299 msec ~51 msec)
> HCI Event: LE Meta Event (0x3e) plen 10                                                    #61 [hci0] 228.916780
      LE Connection Update Complete (0x03)
        Status: Success (0x00)
        Handle: 64 Address: 50:81:1C:08:7C:04 (Resolvable)
        Connection interval: 7.50 msec (0x0006)
        Connection latency: 0 (0x0000)
        Supervision timeout: 5000 msec (0x01f4)
> ACL Data RX: Handle 64 flags 0x02 dlen 11                                                  #62 [hci0] 228.923254
      ATT: Read By Type Request (0x08) len 6
        Handle range: 0x0006-0x000f
        Attribute type: Include (0x2802)
bluetoothd[656]: < ACL Data TX: Handle 64 flags 0x00 dlen 9                                  #63 [hci0] 228.923440
      ATT: Error Response (0x01) len 4
        Read By Type Request (0x08)
        Handle: 0x0006
        Error: Attribute Not Found (0x0a)
> ACL Data RX: Handle 64 flags 0x02 dlen 244                                                 #64 [hci0] 228.933474
      ATT: Read By Type Response (0x09) len 239
        Attribute data length: 7
        Attribute data list: 34 entries
        Handle: 0x0002
        Value[5]: 200300052a
            Properties: 0x20
              Indicate (0x20)
            Value Handle: 0x0003
            Value UUID: Service Changed (0x2a05)
        Handle: 0x0004
        Value[5]: 0205003a2b
            Properties: 0x02
              Read (0x02)
            Value Handle: 0x0005
            Value UUID: Server Supported Features (0x2b3a)
        Handle: 0x0006
        Value[5]: 0a0700292b
            Properties: 0x0a
              Read (0x02)
              Write (0x08)
            Value Handle: 0x0007
            Value UUID: Client Supported Features (0x2b29)
        Handle: 0x0008
        Value[5]: 0209002a2b
            Properties: 0x02
              Read (0x02)
            Value Handle: 0x0009
            Value UUID: Database Hash (0x2b2a)
        Handle: 0x0015
        Value[5]: 021600002a
            Properties: 0x02
              Read (0x02)
            Value Handle: 0x0016
            Value UUID: Device Name (0x2a00)
        Handle: 0x0017
        Value[5]: 021800012a
            Properties: 0x02
              Read (0x02)
            Value Handle: 0x0018
            Value UUID: Appearance (0x2a01)
        Handle: 0x0019
        Value[5]: 021a00a62a
            Properties: 0x02
              Read (0x02)
            Value Handle: 0x001a
            Value UUID: Central Address Resolution (0x2aa6)
        Handle: 0x0029
        Value[5]: 122a00932b
            Properties: 0x12
              Read (0x02)
              Notify (0x10)
            Value Handle: 0x002a
            Value UUID: Media Player Name (0x2b93)
        Handle: 0x002c
        Value[5]: 102d00962b
            Properties: 0x10
              Notify (0x10)
            Value Handle: 0x002d
            Value UUID: Track Changed (0x2b96)
        Handle: 0x002f
        Value[5]: 123000972b
            Properties: 0x12
              Read (0x02)
              Notify (0x10)
            Value Handle: 0x0030
            Value UUID: Track Title (0x2b97)
        Handle: 0x0032
        Value[5]: 123300982b
            Properties: 0x12
              Read (0x02)
              Notify (0x10)
            Value Handle: 0x0033
            Value UUID: Track Duration (0x2b98)
        Handle: 0x0035
        Value[5]: 1e3600992b
            Properties: 0x1e
              Read (0x02)
              Write Without Response (0x04)
              Write (0x08)
              Notify (0x10)
            Value Handle: 0x0036
            Value UUID: Track Position (0x2b99)
        Handle: 0x0038
        Value[5]: 1e39009a2b
            Properties: 0x1e
              Read (0x02)
              Write Without Response (0x04)
              Write (0x08)
              Notify (0x10)
            Value Handle: 0x0039
            Value UUID: Playback Speed (0x2b9a)
        Handle: 0x003b
        Value[5]: 123c009b2b
            Properties: 0x12
              Read (0x02)
              Notify (0x10)
            Value Handle: 0x003c
            Value UUID: Seeking Speed (0x2b9b)
        Handle: 0x003e
        Value[5]: 1e3f00a12b
            Properties: 0x1e
              Read (0x02)
              Write Without Response (0x04)
              Write (0x08)
              Notify (0x10)
            Value Handle: 0x003f
            Value UUID: Playing Order (0x2ba1)
        Handle: 0x0041
        Value[5]: 024200a22b
            Properties: 0x02
              Read (0x02)
            Value Handle: 0x0042
            Value UUID: Playing Orders Supported (0x2ba2)
        Handle: 0x0043
        Value[5]: 124400a32b
            Properties: 0x12
              Read (0x02)
              Notify (0x10)
            Value Handle: 0x0044
            Value UUID: Media State (0x2ba3)
        Handle: 0x0046
        Value[5]: 1c4700a42b
            Properties: 0x1c
              Write Without Response (0x04)
              Write (0x08)
              Notify (0x10)
            Value Handle: 0x0047
            Value UUID: Media Control Point (0x2ba4)
        Handle: 0x0049
        Value[5]: 124a00a52b
            Properties: 0x12
              Read (0x02)
              Notify (0x10)
            Value Handle: 0x004a
            Value UUID: Media Control Point Opcodes Supported (0x2ba5)
        Handle: 0x004c
        Value[5]: 024d00ba2b
            Properties: 0x02
              Read (0x02)
            Value Handle: 0x004d
            Value UUID: Content Control ID (0x2bba)
        Handle: 0x005b
        Value[5]: 125c00b32b
            Properties: 0x12
              Read (0x02)
              Notify (0x10)
            Value Handle: 0x005c
            Value UUID: Bearer Provider Name (0x2bb3)
        Handle: 0x005e
        Value[5]: 025f00b42b
            Properties: 0x02
              Read (0x02)
            Value Handle: 0x005f
            Value UUID: Bearer UCI (0x2bb4)
        Handle: 0x0060
        Value[5]: 126100b52b
            Properties: 0x12
              Read (0x02)
              Notify (0x10)
            Value Handle: 0x0061
            Value UUID: Bearer Technology (0x2bb5)
        Handle: 0x0063
        Value[5]: 126400b62b
            Properties: 0x12
              Read (0x02)
              Notify (0x10)
            Value Handle: 0x0064
            Value UUID: Bearer URI Schemes Supported List (0x2bb6)
        Handle: 0x0066
        Value[5]: 126700b92b
            Properties: 0x12
              Read (0x02)
              Notify (0x10)
            Value Handle: 0x0067
            Value UUID: Bearer List Current Calls (0x2bb9)
        Handle: 0x0069
        Value[5]: 026a00ba2b
            Properties: 0x02
              Read (0x02)
            Value Handle: 0x006a
            Value UUID: Content Control ID (0x2bba)
        Handle: 0x006b
        Value[5]: 126c00bb2b
            Properties: 0x12
              Read (0x02)
              Notify (0x10)
            Value Handle: 0x006c
            Value UUID: Status Flags (0x2bbb)
        Handle: 0x006e
        Value[5]: 126f00bd2b
            Properties: 0x12
              Read (0x02)
              Notify (0x10)
            Value Handle: 0x006f
            Value UUID: Call State (0x2bbd)
        Handle: 0x0071
        Value[5]: 1c7200be2b
            Properties: 0x1c
              Write Without Response (0x04)
              Write (0x08)
              Notify (0x10)
            Value Handle: 0x0072
            Value UUID: Call Control Point (0x2bbe)
        Handle: 0x0074
        Value[5]: 027500bf2b
            Properties: 0x02
              Read (0x02)
            Value Handle: 0x0075
            Value UUID: Call Control Point Optional Opcodes (0x2bbf)
        Handle: 0x0076
        Value[5]: 107700c02b
            Properties: 0x10
              Notify (0x10)
            Value Handle: 0x0077
            Value UUID: Termination Reason (0x2bc0)
        Handle: 0x0079
        Value[5]: 127a00c12b
            Properties: 0x12
              Read (0x02)
              Notify (0x10)
            Value Handle: 0x007a
            Value UUID: Incoming Call (0x2bc1)
        Handle: 0x007c
        Value[5]: 127d00c22b
            Properties: 0x12
              Read (0x02)
              Notify (0x10)
            Value Handle: 0x007d
            Value UUID: Call Friendly Name (0x2bc2)
        Handle: 0x0083
        Value[5]: 028400512b
            Properties: 0x02
              Read (0x02)
            Value Handle: 0x0084
            Value UUID: Telephony and Media Audio Profile Role (0x2b51)
bluetoothd[656]: < ACL Data TX: Handle 64 flags 0x00 dlen 11                                 #65 [hci0] 228.933611
      ATT: Read By Type Request (0x08) len 6
        Handle range: 0x0084-0xffff
        Attribute type: Characteristic (0x2803)
> ACL Data RX: Handle 64 flags 0x02 dlen 11                                                  #66 [hci0] 228.938277
      ATT: Read By Type Request (0x08) len 6
        Handle range: 0x0006-0x000f
        Attribute type: Characteristic (0x2803)
bluetoothd[656]: < ACL Data TX: Handle 64 flags 0x00 dlen 27                                 #67 [hci0] 228.938476
      ATT: Read By Type Response (0x09) len 22
        Attribute data length: 7
        Attribute data list: 3 entries
        Handle: 0x0007
        Value[5]: 200800052a
            Properties: 0x20
              Indicate (0x20)
            Value Handle: 0x0008
            Value UUID: Service Changed (0x2a05)
        Handle: 0x000a
        Value[5]: 0a0b00292b
            Properties: 0x0a
              Read (0x02)
              Write (0x08)
            Value Handle: 0x000b
            Value UUID: Client Supported Features (0x2b29)
        Handle: 0x000c
        Value[5]: 020d002a2b
            Properties: 0x02
              Read (0x02)
            Value Handle: 0x000d
            Value UUID: Database Hash (0x2b2a)
> HCI Event: Number of Completed Packets (0x13) plen 5                                       #68 [hci0] 228.938882
        Num handles: 1
        Handle: 64 Address: 50:81:1C:08:7C:04 (Resolvable)
        Count: 2
        #59: len 11 (1 Kb/s)
        Latency: 53 msec (30-299 msec ~52 msec)
        #63: len 9 (4 Kb/s)
        Latency: 15 msec (15-299 msec ~33 msec)
> ACL Data RX: Handle 64 flags 0x02 dlen 69                                                  #69 [hci0] 228.946450
      ATT: Read By Type Response (0x09) len 64
        Attribute data length: 21
        Attribute data list: 3 entries
        Handle: 0x0091
        Value[19]: 029200b5f364314f2e9182744e1bef02003ee7
            Properties: 0x02
              Read (0x02)
            Value Handle: 0x0092
            Value UUID: Vendor specific (e73e0002-ef1b-4e74-8291-2e4f3164f3b5)
        Handle: 0x0094
        Value[19]: 2895002581e88c722e8f97ea11db31e6364a59
            Properties: 0x28
              Write (0x08)
              Indicate (0x20)
            Value Handle: 0x0095
            Value UUID: Vendor specific (594a36e6-31db-11ea-978f-2e728ce88125)
        Handle: 0x0097
        Value[19]: 0c98002581e88c722e8f97ea11db3110304a59
            Properties: 0x0c
              Write Without Response (0x04)
              Write (0x08)
            Value Handle: 0x0098
            Value UUID: Vendor specific (594a3010-31db-11ea-978f-2e728ce88125)
bluetoothd[656]: < ACL Data TX: Handle 64 flags 0x00 dlen 11                                 #70 [hci0] 228.946586
      ATT: Read By Type Request (0x08) len 6
        Handle range: 0x0098-0xffff
        Attribute type: Characteristic (0x2803)
> ACL Data RX: Handle 64 flags 0x02 dlen 11                                                  #71 [hci0] 228.953278
      ATT: Read By Type Request (0x08) len 6
        Handle range: 0x000d-0x000f
        Attribute type: Characteristic (0x2803)
bluetoothd[656]: < ACL Data TX: Handle 64 flags 0x00 dlen 9                                  #72 [hci0] 228.953409
      ATT: Error Response (0x01) len 4
        Read By Type Request (0x08)
        Handle: 0x000d
        Error: Attribute Not Found (0x0a)
> HCI Event: Number of Completed Packets (0x13) plen 5                                       #73 [hci0] 228.953809
        Num handles: 1
        Handle: 64 Address: 50:81:1C:08:7C:04 (Resolvable)
        Count: 2
        #65: len 11 (4 Kb/s)
        Latency: 20 msec (15-299 msec ~27 msec)
        #67: len 27 (14 Kb/s)
        Latency: 15 msec (15-299 msec ~21 msec)
> ACL Data RX: Handle 64 flags 0x02 dlen 9                                                   #74 [hci0] 228.960739
      ATT: Error Response (0x01) len 4
        Read By Type Request (0x08)
        Handle: 0x0098
        Error: Attribute Not Found (0x0a)
bluetoothd[656]: < ACL Data TX: Handle 64 flags 0x00 dlen 9                                  #75 [hci0] 228.960984
      ATT: Find Information Request (0x04) len 4
        Handle range: 0x0099-0xffff
> ACL Data RX: Handle 64 flags 0x02 dlen 9                                                   #76 [hci0] 228.968265
      ATT: Find Information Request (0x04) len 4
        Handle range: 0x0009-0x0009
bluetoothd[656]: < ACL Data TX: Handle 64 flags 0x00 dlen 10                                 #77 [hci0] 228.968381
      ATT: Find Information Response (0x05) len 5
        Format: UUID-16 (0x01)
        Handle: 0x0009
        UUID: Client Characteristic Configuration (0x2902)
> HCI Event: Number of Completed Packets (0x13) plen 5                                       #78 [hci0] 228.968784
        Num handles: 1
        Handle: 64 Address: 50:81:1C:08:7C:04 (Resolvable)
        Count: 2
        #70: len 11 (4 Kb/s)
        Latency: 22 msec (15-299 msec ~21 msec)
        #72: len 9 (4 Kb/s)
        Latency: 15 msec (15-299 msec ~18 msec)
> ACL Data RX: Handle 64 flags 0x02 dlen 24                                                  #79 [hci0] 228.975914
      ATT: Find Information Response (0x05) len 19
        Format: UUID-128 (0x02)
        Handle: 0x0099
        UUID: Vendor specific (594a3952-31db-11ea-978f-2e728ce88125)
bluetoothd[656]: < ACL Data TX: Handle 64 flags 0x00 dlen 9                                  #80 [hci0] 228.976024
      ATT: Find Information Request (0x04) len 4
        Handle range: 0x009a-0xffff
> ACL Data RX: Handle 64 flags 0x02 dlen 9                                                   #81 [hci0] 228.983262
      ATT: Find Information Request (0x04) len 4
        Handle range: 0x000e-0x000f
bluetoothd[656]: < ACL Data TX: Handle 64 flags 0x00 dlen 9                                  #82 [hci0] 228.983371
      ATT: Error Response (0x01) len 4
        Find Information Request (0x04)
        Handle: 0x000e
        Error: Attribute Not Found (0x0a)
> HCI Event: Number of Completed Packets (0x13) plen 5                                       #83 [hci0] 228.983802
        Num handles: 1
        Handle: 64 Address: 50:81:1C:08:7C:04 (Resolvable)
        Count: 2
        #75: len 9 (3 Kb/s)
        Latency: 22 msec (15-299 msec ~20 msec)
        #77: len 10 (5 Kb/s)
        Latency: 15 msec (15-299 msec ~18 msec)
> ACL Data RX: Handle 64 flags 0x02 dlen 9                                                   #84 [hci0] 228.990738
      ATT: Error Response (0x01) len 4
        Find Information Request (0x04)
        Handle: 0x009a
        Error: Attribute Not Found (0x0a)
bluetoothd[656]: < ACL Data TX: Handle 64 flags 0x00 dlen 11                                 #85 [hci0] 228.991075
      ATT: Read By Type Request (0x08) len 6
        Handle range: 0x0001-0xffff
        Attribute type: Database Hash (0x2b2a)
> ACL Data RX: Handle 64 flags 0x02 dlen 11                                                  #86 [hci0] 228.998278
      ATT: Read By Type Request (0x08) len 6
        Handle range: 0x0010-0x0012
        Attribute type: Include (0x2802)
bluetoothd[656]: < ACL Data TX: Handle 64 flags 0x00 dlen 9                                  #87 [hci0] 228.998410
      ATT: Error Response (0x01) len 4
        Read By Type Request (0x08)
        Handle: 0x0010
        Error: Attribute Not Found (0x0a)
> HCI Event: Number of Completed Packets (0x13) plen 5                                       #88 [hci0] 228.998817
        Num handles: 1
        Handle: 64 Address: 50:81:1C:08:7C:04 (Resolvable)
        Count: 2
        #80: len 9 (3 Kb/s)
        Latency: 22 msec (15-299 msec ~20 msec)
        #82: len 9 (4 Kb/s)
        Latency: 15 msec (15-299 msec ~17 msec)
> ACL Data RX: Handle 64 flags 0x02 dlen 24                                                  #89 [hci0] 229.005914
      ATT: Read By Type Response (0x09) len 19
        Attribute data length: 18
        Attribute data list: 1 entry
        Handle: 0x0009
        Value[16]: 8a3eadd4aef49a49dc575516f4663a43
bluetoothd[656]: < ACL Data TX: Handle 64 flags 0x00 dlen 11                                 #90 [hci0] 229.006032
      ATT: Read By Type Request (0x08) len 6
        Handle range: 0x000a-0xffff
        Attribute type: Database Hash (0x2b2a)
> ACL Data RX: Handle 64 flags 0x02 dlen 11                                                  #91 [hci0] 229.013276
      ATT: Read By Type Request (0x08) len 6
        Handle range: 0x0010-0x0012
        Attribute type: Characteristic (0x2803)
bluetoothd[656]: < ACL Data TX: Handle 64 flags 0x00 dlen 13                                 #92 [hci0] 229.013392
      ATT: Read By Type Response (0x09) len 8
        Attribute data length: 7
        Attribute data list: 1 entry
        Handle: 0x0011
        Value[5]: 021200502a
            Properties: 0x02
              Read (0x02)
            Value Handle: 0x0012
            Value UUID: PnP ID (0x2a50)
> HCI Event: Number of Completed Packets (0x13) plen 5                                       #93 [hci0] 229.013800
        Num handles: 1
        Handle: 64 Address: 50:81:1C:08:7C:04 (Resolvable)
        Count: 2
        #85: len 11 (4 Kb/s)
        Latency: 22 msec (15-299 msec ~20 msec)
        #87: len 9 (4 Kb/s)
        Latency: 15 msec (15-299 msec ~17 msec)
> ACL Data RX: Handle 64 flags 0x02 dlen 9                                                   #94 [hci0] 229.020739
      ATT: Error Response (0x01) len 4
        Read By Type Request (0x08)
        Handle: 0x000a
        Error: Attribute Not Found (0x0a)
bluetoothd[656]: < ACL Data TX: Handle 64 flags 0x00 dlen 8                                  #95 [hci0] 229.023794
      ATT: Write Request (0x12) len 3
        Handle: 0x0007 Type: Client Supported Features (0x2b29)
          Data[1]: 05
> ACL Data RX: Handle 64 flags 0x02 dlen 11                                                  #96 [hci0] 229.028380
      ATT: Read By Type Request (0x08) len 6
        Handle range: 0x0012-0x0012
        Attribute type: Characteristic (0x2803)
bluetoothd[656]: < ACL Data TX: Handle 64 flags 0x00 dlen 9                                  #97 [hci0] 229.028584
      ATT: Error Response (0x01) len 4
        Read By Type Request (0x08)
        Handle: 0x0012
        Error: Attribute Not Found (0x0a)
> HCI Event: Number of Completed Packets (0x13) plen 5                                       #98 [hci0] 229.028735
        Num handles: 1
        Handle: 64 Address: 50:81:1C:08:7C:04 (Resolvable)
        Count: 2
        #90: len 11 (4 Kb/s)
        Latency: 22 msec (15-299 msec ~20 msec)
        #92: len 13 (6 Kb/s)
        Latency: 15 msec (15-299 msec ~17 msec)
> ACL Data RX: Handle 64 flags 0x02 dlen 5                                                   #99 [hci0] 229.035713
      ATT: Write Response (0x13) len 0
bluetoothd[656]: < ACL Data TX: Handle 64 flags 0x00 dlen 7                                 #100 [hci0] 229.035916
      ATT: Read Request (0x0a) len 2
        Handle: 0x0016 Type: Device Name (0x2a00)
> ACL Data RX: Handle 64 flags 0x02 dlen 11                                                 #101 [hci0] 229.043324
      ATT: Read By Type Request (0x08) len 6
        Handle range: 0x0013-0x0017
        Attribute type: Include (0x2802)
> HCI Event: Number of Completed Packets (0x13) plen 5                                      #102 [hci0] 229.043700
        Num handles: 1
        Handle: 64 Address: 50:81:1C:08:7C:04 (Resolvable)
        Count: 2
        #95: len 8 (3 Kb/s)
        Latency: 19 msec (15-299 msec ~18 msec)
        #97: len 9 (4 Kb/s)
        Latency: 15 msec (15-299 msec ~16 msec)
bluetoothd[656]: < ACL Data TX: Handle 64 flags 0x00 dlen 9                                 #103 [hci0] 229.044106
      ATT: Error Response (0x01) len 4
        Read By Type Request (0x08)
        Handle: 0x0013
        Error: Attribute Not Found (0x0a)
> ACL Data RX: Handle 64 flags 0x02 dlen 20                                                 #104 [hci0] 229.050872
      ATT: Read Response (0x0b) len 15
        Value[15]: 5332332b20646520416e74686f6e79
        Handle: 0x0016 Type: Device Name (0x2a00)
        Value[15]: 5332332b20646520416e74686f6e79
bluetoothd[656]: < ACL Data TX: Handle 64 flags 0x00 dlen 7                                 #105 [hci0] 229.051242
      ATT: Read Request (0x0a) len 2
        Handle: 0x0018 Type: Appearance (0x2a01)
> ACL Data RX: Handle 64 flags 0x02 dlen 11                                                 #106 [hci0] 229.058316
      ATT: Read By Type Request (0x08) len 6
        Handle range: 0x0013-0x0017
        Attribute type: Characteristic (0x2803)
bluetoothd[656]: < ACL Data TX: Handle 64 flags 0x00 dlen 27                                #107 [hci0] 229.058610
      ATT: Read By Type Response (0x09) len 22
        Attribute data length: 21
        Attribute data list: 1 entry
        Handle: 0x0014
        Value[19]: 1e1500f36b109d66f2a9a112416838dbe57277
            Properties: 0x1e
              Read (0x02)
              Write Without Response (0x04)
              Write (0x08)
              Notify (0x10)
            Value Handle: 0x0015
            Value UUID: Vendor specific (7772e5db-3868-4112-a1a9-f2669d106bf3)
> HCI Event: Number of Completed Packets (0x13) plen 5                                      #108 [hci0] 229.058691
        Num handles: 1
        Handle: 64 Address: 50:81:1C:08:7C:04 (Resolvable)
        Count: 2
        #100: len 7 (2 Kb/s)
        Latency: 22 msec (15-299 msec ~19 msec)
        #103: len 9 (5 Kb/s)
        Latency: 14 msec (14-299 msec ~17 msec)
> ACL Data RX: Handle 64 flags 0x02 dlen 7                                                  #109 [hci0] 229.065743
      ATT: Read Response (0x0b) len 2
        Value[2]: 0000
        Handle: 0x0018 Type: Appearance (0x2a01)
        Value[2]: 0000
> ACL Data RX: Handle 64 flags 0x02 dlen 11                                                 #110 [hci0] 229.073586
      ATT: Read By Type Request (0x08) len 6
        Handle range: 0x0015-0x0017
        Attribute type: Characteristic (0x2803)
> HCI Event: Number of Completed Packets (0x13) plen 5                                      #111 [hci0] 229.073706
        Num handles: 1
        Handle: 64 Address: 50:81:1C:08:7C:04 (Resolvable)
        Count: 2
        #105: len 7 (2 Kb/s)
        Latency: 22 msec (14-299 msec ~19 msec)
        #107: len 27 (14 Kb/s)
        Latency: 15 msec (14-299 msec ~17 msec)
bluetoothd[656]: < ACL Data TX: Handle 64 flags 0x00 dlen 9                                 #112 [hci0] 229.079972
      ATT: Error Response (0x01) len 4
        Read By Type Request (0x08)
        Handle: 0x0015
        Error: Attribute Not Found (0x0a)
> ACL Data RX: Handle 64 flags 0x02 dlen 9                                                  #113 [hci0] 229.095776
      ATT: Find Information Request (0x04) len 4
        Handle range: 0x0016-0x0017
bluetoothd[656]: < ACL Data TX: Handle 64 flags 0x00 dlen 14                                #114 [hci0] 229.096037
      ATT: Find Information Response (0x05) len 9
        Format: UUID-16 (0x01)
        Handle: 0x0016
        UUID: Client Characteristic Configuration (0x2902)
        Handle: 0x0017
        UUID: Characteristic User Description (0x2901)
> ACL Data RX: Handle 64 flags 0x02 dlen 11                                                 #115 [hci0] 229.112467
      ATT: Read By Type Request (0x08) len 6
        Handle range: 0x001e-0x0020
        Attribute type: Include (0x2802)
> HCI Event: Number of Completed Packets (0x13) plen 5                                      #116 [hci0] 229.112476
        Num handles: 1
        Handle: 64 Address: 50:81:1C:08:7C:04 (Resolvable)
        Count: 2
        #112: len 9 (2 Kb/s)
        Latency: 32 msec (14-299 msec ~24 msec)
        #114: len 14 (7 Kb/s)
        Latency: 16 msec (14-299 msec ~20 msec)
bluetoothd[656]: < ACL Data TX: Handle 64 flags 0x00 dlen 9                                 #117 [hci0] 229.113298
      ATT: Error Response (0x01) len 4
        Read By Type Request (0x08)
        Handle: 0x001e
        Error: Attribute Not Found (0x0a)
> ACL Data RX: Handle 64 flags 0x02 dlen 11                                                 #118 [hci0] 229.125793
      ATT: Read By Type Request (0x08) len 6
        Handle range: 0x001e-0x0020
        Attribute type: Characteristic (0x2803)
bluetoothd[656]: < ACL Data TX: Handle 64 flags 0x00 dlen 27                                #119 [hci0] 229.126490
      ATT: Read By Type Response (0x09) len 22
        Attribute data length: 21
        Attribute data list: 1 entry
        Handle: 0x001f
        Value[19]: 022000274168e036276e88434fd7b20428496f
            Properties: 0x02
              Read (0x02)
            Value Handle: 0x0020
            Value UUID: Vendor specific (6f492804-b2d7-4f43-886e-2736e0684127)
> ACL Data RX: Handle 64 flags 0x02 dlen 11                                                 #120 [hci0] 229.141004
      ATT: Read By Type Request (0x08) len 6
        Handle range: 0x0020-0x0020
        Attribute type: Characteristic (0x2803)
> HCI Event: Number of Completed Packets (0x13) plen 5                                      #121 [hci0] 229.141208
        Num handles: 1
        Handle: 64 Address: 50:81:1C:08:7C:04 (Resolvable)
        Count: 2
        #117: len 9 (2 Kb/s)
        Latency: 27 msec (14-299 msec ~24 msec)
        #119: len 27 (15 Kb/s)
        Latency: 14 msec (14-299 msec ~19 msec)
bluetoothd[656]: < ACL Data TX: Handle 64 flags 0x00 dlen 9                                 #122 [hci0] 229.141320
      ATT: Error Response (0x01) len 4
        Read By Type Request (0x08)
        Handle: 0x0020
        Error: Attribute Not Found (0x0a)
> HCI Event: LE Meta Event (0x3e) plen 11                                                   #123 [hci0] 229.163766
      LE Remote Connection Parameter Request (0x06)
        Handle: 64 Address: 50:81:1C:08:7C:04 (Resolvable)
        Min connection interval: 30.00 msec (0x0018)
        Max connection interval: 30.00 msec (0x0018)
        Connection latency: 0 (0x0000)
        Supervision timeout: 5000 msec (0x01f4)
< HCI Command: LE Remote Connection Parameter Request Reply (0x08|0x0020) plen 14           #124 [hci0] 229.163828
        Handle: 64 Address: 50:81:1C:08:7C:04 (Resolvable)
        Min connection interval: 30.00 msec (0x0018)
        Max connection interval: 30.00 msec (0x0018)
        Connection latency: 0 (0x0000)
        Supervision timeout: 5000 msec (0x01f4)
        Min connection length: 0.000 msec (0x0000)
        Max connection length: 0.000 msec (0x0000)
> HCI Event: Command Complete (0x0e) plen 6                                                 #125 [hci0] 229.167656
      LE Remote Connection Parameter Request Reply (0x08|0x0020) ncmd 1
        Status: Success (0x00)
        Handle: 64 Address: 50:81:1C:08:7C:04 (Resolvable)
> HCI Event: LE Meta Event (0x3e) plen 10                                                   #126 [hci0] 229.274942
      LE Connection Update Complete (0x03)
        Status: Success (0x00)
        Handle: 64 Address: 50:81:1C:08:7C:04 (Resolvable)
        Connection interval: 30.00 msec (0x0018)
        Connection latency: 0 (0x0000)
        Supervision timeout: 5000 msec (0x01f4)
> HCI Event: Number of Completed Packets (0x13) plen 5                                      #127 [hci0] 229.314365
        Num handles: 1
        Handle: 64 Address: 50:81:1C:08:7C:04 (Resolvable)
        Count: 1
        #122: len 9 (0 Kb/s)
        Latency: 173 msec (14-299 msec ~96 msec)
< HCI Command: LE Set Advertising Parameters (0x08|0x0006) plen 15                          #128 [hci0] 229.621350
        Min advertising interval: 1280.000 msec (0x0800)
        Max advertising interval: 1280.000 msec (0x0800)
        Type: Connectable undirected - ADV_IND (0x00)
        Own address type: Public (0x00)
        Direct address type: Public (0x00)
        Direct address: 00:00:00:00:00:00 (OUI 00-00-00)
        Channel map: 37, 38, 39 (0x07)
        Filter policy: Allow Scan Request from Any, Allow Connect Request from Any (0x00)
> HCI Event: Command Complete (0x0e) plen 4                                                 #129 [hci0] 229.621731
      LE Set Advertising Parameters (0x08|0x0006) ncmd 1
        Status: Success (0x00)
< HCI Command: LE Set Advertise Enable (0x08|0x000a) plen 1                                 #130 [hci0] 229.621813
        Advertising: Enabled (0x01)
> HCI Event: Command Complete (0x0e) plen 4                                                 #131 [hci0] 229.622214
      LE Set Advertise Enable (0x08|0x000a) ncmd 1
        Status: Success (0x00)
> ACL Data RX: Handle 64 flags 0x02 dlen 7                                                  #295 [hci0] 694.848658
      ATT: Read Request (0x0a) len 2
        Handle: 0x0020 Type: Vendor specific (6f492804-b2d7-4f43-886e-2736e0684127)
bluetoothd[656]: < ACL Data TX: Handle 64 flags 0x00 dlen 9                                 #296 [hci0] 694.849092
      ATT: Error Response (0x01) len 4
        Read Request (0x0a)
        Handle: 0x0020
        Error: Insufficient Encryption (0x0f)
> ACL Data RX: Handle 64 flags 0x02 dlen 11                                                 #297 [hci0] 694.908720
      SMP: Pairing Request (0x01) len 6
        IO capability: KeyboardDisplay (0x04)
        OOB data: Authentication data not present (0x00)
        Authentication requirement: Bonding, MITM, SC, No Keypresses, CT2 (0x2d)
        Max encryption key size: 16
        Initiator key distribution: EncKey IdKey Sign LinkKey (0x0f)
        Responder key distribution: EncKey IdKey Sign LinkKey (0x0f)
< ACL Data TX: Handle 64 flags 0x00 dlen 11                                                 #298 [hci0] 694.908817
      SMP: Pairing Response (0x02) len 6
        IO capability: DisplayYesNo (0x01)
        OOB data: Authentication data not present (0x00)
        Authentication requirement: Bonding, MITM, SC, No Keypresses, CT2 (0x2d)
        Max encryption key size: 16
        Initiator key distribution: EncKey IdKey Sign LinkKey (0x0f)
        Responder key distribution: EncKey Sign LinkKey (0x0d)
> ACL Data RX: Handle 64 flags 0x02 dlen 69                                                 #299 [hci0] 694.969547
      SMP: Pairing Public Key (0x0c) len 64
        X[32]: 7d71683a7f61a31e9f6dcc1d1d3fcb7e46722791facbfafc40a8c419f2990781
        Y[32]: 531d3b82b74143e0b4b32ee0ce758e0c6c0a0609f8b0457f101561aa9073dcdb
> HCI Event: Number of Completed Packets (0x13) plen 5                                      #300 [hci0] 694.973177
        Num handles: 1
        Handle: 64 Address: 4F:EA:6D:9D:8F:6B (Resolvable)
        Count: 2
        #296: len 9 (0 Kb/s)
        Latency: 124 msec (4-299 msec ~150 msec)
        #298: len 11 (1 Kb/s)
        Latency: 64 msec (4-299 msec ~107 msec)
< ACL Data TX: Handle 64 flags 0x00 dlen 69                                                 #301 [hci0] 694.981777
      SMP: Pairing Public Key (0x0c) len 64
        X[32]: 93978ec2389b96cb943c39d72d2f7822d8595157c1e9fa65418db23a2513c93f
        Y[32]: 009317870e0a87a8f9f3c76e002417623c995c5f298690785f7e096928f3631a
< ACL Data TX: Handle 64 flags 0x00 dlen 21                                                 #302 [hci0] 694.981791
      SMP: Pairing Confirm (0x03) len 16
        Confim value[16]: 0e36de0d08effd54644f89b64e50f31b
> ACL Data RX: Handle 64 flags 0x02 dlen 21                                                 #303 [hci0] 695.029066
      SMP: Pairing Random (0x04) len 16
        Random value[16]: 3c250871a2f1249e328e9f37d976ded4
@ MGMT Event: User Confirmation Request (0x000f) plen 12                                {0x0001} [hci0] 695.029137
        LE Address: 4F:EA:6D:9D:8F:6B (Resolvable)
        Confirm hint: 0x00
        Value: 0x000bdc90
< ACL Data TX: Handle 64 flags 0x00 dlen 21                                                 #304 [hci0] 695.029178
      SMP: Pairing Random (0x04) len 16
        Random value[16]: f24f14758359ea5e1c0c93b34831d7d6
> HCI Event: Number of Completed Packets (0x13) plen 5                                      #305 [hci0] 695.029245
        Num handles: 1
        Handle: 64 Address: 4F:EA:6D:9D:8F:6B (Resolvable)
        Count: 2
        #301: len 69 (11 Kb/s)
        Latency: 47 msec (4-299 msec ~77 msec)
        #302: len 21 (3 Kb/s)
        Latency: 47 msec (4-299 msec ~62 msec)
> HCI Event: Number of Completed Packets (0x13) plen 5                                      #306 [hci0] 695.317818
        Num handles: 1
        Handle: 64 Address: 4F:EA:6D:9D:8F:6B (Resolvable)
        Count: 1
        #304: len 21 (0 Kb/s)
        Latency: 288 msec (4-299 msec ~175 msec)
< HCI Command: Disconnect (0x01|0x0006) plen 3                                              #307 [hci0] 726.197227
        Handle: 64 Address: 4F:EA:6D:9D:8F:6B (Resolvable)
        Reason: Authentication Failure (0x05)
> HCI Event: Command Status (0x0f) plen 4                                                   #308 [hci0] 726.197567
      Disconnect (0x01|0x0006) ncmd 1
        Status: Success (0x00)
> HCI Event: Disconnect Complete (0x05) plen 4                                              #309 [hci0] 726.229885
        Status: Success (0x00)
        Handle: 64 Address: 4F:EA:6D:9D:8F:6B (Resolvable)
        Reason: Connection Terminated By Local Host (0x16)
@ MGMT Event: Device Disconnected (0x000c) plen 8                                       {0x0001} [hci0] 726.229917
        LE Address: 4F:EA:6D:9D:8F:6B (Resolvable)
        Reason: Connection terminated by local host (0x02)
< HCI Command: LE Set Advertise Enable (0x08|0x000a) plen 1                                 #310 [hci0] 726.269452
        Advertising: Disabled (0x00)
> HCI Event: Command Complete (0x0e) plen 4                                                 #311 [hci0] 726.270444
      LE Set Advertise Enable (0x08|0x000a) ncmd 1
        Status: Success (0x00)
< HCI Command: LE Set Advertising Parameters (0x08|0x0006) plen 15                          #312 [hci0] 726.270566
        Min advertising interval: 1280.000 msec (0x0800)
        Max advertising interval: 1280.000 msec (0x0800)
        Type: Connectable undirected - ADV_IND (0x00)
        Own address type: Public (0x00)
        Direct address type: Public (0x00)
        Direct address: 00:00:00:00:00:00 (OUI 00-00-00)
        Channel map: 37, 38, 39 (0x07)
        Filter policy: Allow Scan Request from Any, Allow Connect Request from Any (0x00)
> HCI Event: Command Complete (0x0e) plen 4                                                 #313 [hci0] 726.270874
      LE Set Advertising Parameters (0x08|0x0006) ncmd 1
        Status: Success (0x00)
< HCI Command: LE Set Advertise Enable (0x08|0x000a) plen 1                                 #314 [hci0] 726.270951
        Advertising: Enabled (0x01)
> HCI Event: Command Complete (0x0e) plen 4                                                 #315 [hci0] 726.271330
      LE Set Advertise Enable (0x08|0x000a) ncmd 1
        Status: Success (0x00)

