        Error: Attribute Not Found (0x0a)
> ACL Data RX: Handle 64 flags 0x02 dlen 11                                                   #46 [hci0] 94.991218
      ATT: Read By Group Type Request (0x10) len 6
        Handle range: 0x0013-0xffff
        Attribute group type: Primary Service (0x2800)
bluetoothd[656]: < ACL Data TX: Handle 64 flags 0x00 dlen 46                                  #47 [hci0] 95.063879
      ATT: Read By Group Type Response (0x11) len 41
        Attribute data length: 20
        Attribute group list: 2 entries
        Handle range: 0x0013-0x0017
        UUID: Vendor specific (03b80e5a-ede8-4b33-a751-6ce34ec4c700)
        Handle range: 0x002d-0x002f
        UUID: Vendor specific (e865862f-0c29-47b7-9a5b-274b2c82ce8c)
bluetoothd[656]: < ACL Data TX: Handle 64 flags 0x00 dlen 8                                   #48 [hci0] 95.063926
      ATT: Write Request (0x12) len 3
        Handle: 0x0007
          Data[1]: 05
> HCI Event: Number of Completed Packets (0x13) plen 5                                        #49 [hci0] 95.079931
        Num handles: 1
        Handle: 64 Address: 7A:35:99:75:D4:38 (Resolvable)
        Count: 2
        #43: len 10 (0 Kb/s)
        Latency: 149 msec (29-329 msec ~106 msec)
        #47: len 46 (23 Kb/s)
        Latency: 16 msec (16-329 msec ~61 msec)
> ACL Data RX: Handle 64 flags 0x02 dlen 11                                                   #50 [hci0] 95.109034
      ATT: Read By Group Type Request (0x10) len 6
        Handle range: 0x0030-0xffff
        Attribute group type: Primary Service (0x2800)
bluetoothd[656]: < ACL Data TX: Handle 64 flags 0x00 dlen 9                                   #51 [hci0] 95.109237
      ATT: Error Response (0x01) len 4
        Read By Group Type Request (0x10)
        Handle: 0x0030
        Error: Attribute Not Found (0x0a)
> ACL Data RX: Handle 64 flags 0x02 dlen 5                                                    #52 [hci0] 95.109546
      ATT: Write Response (0x13) len 0
> ACL Data RX: Handle 64 flags 0x02 dlen 11                                                   #53 [hci0] 95.170468
      ATT: Read By Type Request (0x08) len 6
        Handle range: 0x0001-0x0005
        Attribute type: Include (0x2802)
bluetoothd[656]: < ACL Data TX: Handle 64 flags 0x00 dlen 9                                   #54 [hci0] 95.170669
      ATT: Error Response (0x01) len 4
        Read By Type Request (0x08)
        Handle: 0x0001
        Error: Attribute Not Found (0x0a)
> HCI Event: Number of Completed Packets (0x13) plen 5                                        #55 [hci0] 95.170735
        Num handles: 1
        Handle: 64 Address: 7A:35:99:75:D4:38 (Resolvable)
        Count: 2
        #48: len 8 (0 Kb/s)
        Latency: 106 msec (16-329 msec ~83 msec)
        #51: len 9 (1 Kb/s)
        Latency: 61 msec (16-329 msec ~72 msec)
> HCI Event: LE Meta Event (0x3e) plen 10                                                     #56 [hci0] 95.171148
      LE Connection Update Complete (0x03)
        Status: Success (0x00)
        Handle: 64 Address: 7A:35:99:75:D4:38 (Resolvable)
        Connection interval: 7.50 msec (0x0006)
        Connection latency: 0 (0x0000)
        Supervision timeout: 5000 msec (0x01f4)
> HCI Event: LE Meta Event (0x3e) plen 11                                                     #57 [hci0] 95.178047
      LE Data Length Change (0x07)
        Handle: 64 Address: 7A:35:99:75:D4:38 (Resolvable)
        Max TX octets: 251
        Max TX time: 2120
        Max RX octets: 251
        Max RX time: 2120
> ACL Data RX: Handle 64 flags 0x02 dlen 11                                                   #58 [hci0] 95.185420
      ATT: Read By Type Request (0x08) len 6
        Handle range: 0x0001-0x0005
        Attribute type: Characteristic (0x2803)
bluetoothd[656]: < ACL Data TX: Handle 64 flags 0x00 dlen 20                                  #59 [hci0] 95.185574
      ATT: Read By Type Response (0x09) len 15
        Attribute data length: 7
        Attribute data list: 2 entries
        Handle: 0x0002
        Value[5]: 020300002a
            Properties: 0x02
              Read (0x02)
            Value Handle: 0x0003
            Value UUID: Device Name (0x2a00)
        Handle: 0x0004
        Value[5]: 020500012a
            Properties: 0x02
              Read (0x02)
            Value Handle: 0x0005
            Value UUID: Appearance (0x2a01)
> ACL Data RX: Handle 64 flags 0x02 dlen 11                                                   #60 [hci0] 95.215426
      ATT: Read By Type Request (0x08) len 6
        Handle range: 0x0005-0x0005
        Attribute type: Characteristic (0x2803)
bluetoothd[656]: < ACL Data TX: Handle 64 flags 0x00 dlen 9                                   #61 [hci0] 95.215565
      ATT: Error Response (0x01) len 4
        Read By Type Request (0x08)
        Handle: 0x0005
        Error: Attribute Not Found (0x0a)
> HCI Event: Number of Completed Packets (0x13) plen 5                                        #62 [hci0] 95.215624
        Num handles: 1
        Handle: 64 Address: 7A:35:99:75:D4:38 (Resolvable)
        Count: 2
        #54: len 9 (1 Kb/s)
        Latency: 44 msec (16-329 msec ~58 msec)
        #59: len 20 (5 Kb/s)
        Latency: 30 msec (16-329 msec ~44 msec)
> ACL Data RX: Handle 64 flags 0x02 dlen 11                                                   #63 [hci0] 95.230199
      ATT: Read By Type Request (0x08) len 6
        Handle range: 0x0006-0x000f
        Attribute type: Include (0x2802)
bluetoothd[656]: < ACL Data TX: Handle 64 flags 0x00 dlen 9                                   #64 [hci0] 95.230323
      ATT: Error Response (0x01) len 4
        Read By Type Request (0x08)
        Handle: 0x0006
        Error: Attribute Not Found (0x0a)
> ACL Data RX: Handle 64 flags 0x02 dlen 11                                                   #65 [hci0] 95.245422
      ATT: Read By Type Request (0x08) len 6
        Handle range: 0x0006-0x000f
        Attribute type: Characteristic (0x2803)
bluetoothd[656]: < ACL Data TX: Handle 64 flags 0x00 dlen 27                                  #66 [hci0] 95.245556
      ATT: Read By Type Response (0x09) len 22
        Attribute data length: 7
        Attribute data list: 3 entries
        Handle: 0x0007
        Value[5]: 200800052a
            Properties: 0x20
              Indicate (0x20)
            Value Handle: 0x0008
            Value UUID: Service Changed (0x2a05)
        Handle: 0x000a
        Value[5]: 0a0b00292b
            Properties: 0x0a
              Read (0x02)
              Write (0x08)
            Value Handle: 0x000b
            Value UUID: Client Supported Features (0x2b29)
        Handle: 0x000c
        Value[5]: 020d002a2b
            Properties: 0x02
              Read (0x02)
            Value Handle: 0x000d
            Value UUID: Database Hash (0x2b2a)
> HCI Event: Number of Completed Packets (0x13) plen 5                                        #67 [hci0] 95.245704
        Num handles: 1
        Handle: 64 Address: 7A:35:99:75:D4:38 (Resolvable)
        Count: 2
        #61: len 9 (2 Kb/s)
        Latency: 30 msec (16-329 msec ~37 msec)
        #64: len 9 (4 Kb/s)
        Latency: 15 msec (15-329 msec ~26 msec)
> ACL Data RX: Handle 64 flags 0x02 dlen 11                                                   #68 [hci0] 95.260198
      ATT: Read By Type Request (0x08) len 6
        Handle range: 0x000d-0x000f
        Attribute type: Characteristic (0x2803)
bluetoothd[656]: < ACL Data TX: Handle 64 flags 0x00 dlen 9                                   #69 [hci0] 95.260335
      ATT: Error Response (0x01) len 4
        Read By Type Request (0x08)
        Handle: 0x000d
        Error: Attribute Not Found (0x0a)
> ACL Data RX: Handle 64 flags 0x02 dlen 9                                                    #70 [hci0] 95.275407
      ATT: Find Information Request (0x04) len 4
        Handle range: 0x0009-0x0009
bluetoothd[656]: < ACL Data TX: Handle 64 flags 0x00 dlen 10                                  #71 [hci0] 95.275527
      ATT: Find Information Response (0x05) len 5
        Format: UUID-16 (0x01)
        Handle: 0x0009
        UUID: Client Characteristic Configuration (0x2902)
> HCI Event: Number of Completed Packets (0x13) plen 5                                        #72 [hci0] 95.275673
        Num handles: 1
        Handle: 64 Address: 7A:35:99:75:D4:38 (Resolvable)
        Count: 2
        #66: len 27 (7 Kb/s)
        Latency: 30 msec (15-329 msec ~28 msec)
        #69: len 9 (4 Kb/s)
        Latency: 15 msec (15-329 msec ~21 msec)
> ACL Data RX: Handle 64 flags 0x02 dlen 9                                                    #73 [hci0] 95.290185
      ATT: Find Information Request (0x04) len 4
        Handle range: 0x000e-0x000f
bluetoothd[656]: < ACL Data TX: Handle 64 flags 0x00 dlen 9                                   #74 [hci0] 95.290313
      ATT: Error Response (0x01) len 4
        Find Information Request (0x04)
        Handle: 0x000e
        Error: Attribute Not Found (0x0a)
> ACL Data RX: Handle 64 flags 0x02 dlen 11                                                   #75 [hci0] 95.305421
      ATT: Read By Type Request (0x08) len 6
        Handle range: 0x0010-0x0012
        Attribute type: Include (0x2802)
bluetoothd[656]: < ACL Data TX: Handle 64 flags 0x00 dlen 9                                   #76 [hci0] 95.305535
      ATT: Error Response (0x01) len 4
        Read By Type Request (0x08)
        Handle: 0x0010
        Error: Attribute Not Found (0x0a)
> HCI Event: Number of Completed Packets (0x13) plen 5                                        #77 [hci0] 95.305710
        Num handles: 1
        Handle: 64 Address: 7A:35:99:75:D4:38 (Resolvable)
        Count: 2
        #71: len 10 (2 Kb/s)
        Latency: 30 msec (15-329 msec ~25 msec)
        #74: len 9 (4 Kb/s)
        Latency: 15 msec (15-329 msec ~20 msec)
> ACL Data RX: Handle 64 flags 0x02 dlen 11                                                   #78 [hci0] 95.320197
      ATT: Read By Type Request (0x08) len 6
        Handle range: 0x0010-0x0012
        Attribute type: Characteristic (0x2803)
bluetoothd[656]: < ACL Data TX: Handle 64 flags 0x00 dlen 13                                  #79 [hci0] 95.320325
      ATT: Read By Type Response (0x09) len 8
        Attribute data length: 7
        Attribute data list: 1 entry
        Handle: 0x0011
        Value[5]: 021200502a
            Properties: 0x02
              Read (0x02)
            Value Handle: 0x0012
            Value UUID: PnP ID (0x2a50)
> ACL Data RX: Handle 64 flags 0x02 dlen 11                                                   #80 [hci0] 95.335422
      ATT: Read By Type Request (0x08) len 6
        Handle range: 0x0012-0x0012
        Attribute type: Characteristic (0x2803)
bluetoothd[656]: < ACL Data TX: Handle 64 flags 0x00 dlen 9                                   #81 [hci0] 95.335548
      ATT: Error Response (0x01) len 4
        Read By Type Request (0x08)
        Handle: 0x0012
        Error: Attribute Not Found (0x0a)
> HCI Event: Number of Completed Packets (0x13) plen 5                                        #82 [hci0] 95.335716
        Num handles: 1
        Handle: 64 Address: 7A:35:99:75:D4:38 (Resolvable)
        Count: 2
        #76: len 9 (2 Kb/s)
        Latency: 30 msec (15-329 msec ~25 msec)
        #79: len 13 (6 Kb/s)
        Latency: 15 msec (15-329 msec ~20 msec)
> ACL Data RX: Handle 64 flags 0x02 dlen 11                                                   #83 [hci0] 95.350197
      ATT: Read By Type Request (0x08) len 6
        Handle range: 0x0013-0x0017
        Attribute type: Include (0x2802)
bluetoothd[656]: < ACL Data TX: Handle 64 flags 0x00 dlen 9                                   #84 [hci0] 95.350318
      ATT: Error Response (0x01) len 4
        Read By Type Request (0x08)
        Handle: 0x0013
        Error: Attribute Not Found (0x0a)
> ACL Data RX: Handle 64 flags 0x02 dlen 11                                                   #85 [hci0] 95.365422
      ATT: Read By Type Request (0x08) len 6
        Handle range: 0x0013-0x0017
        Attribute type: Characteristic (0x2803)
bluetoothd[656]: < ACL Data TX: Handle 64 flags 0x00 dlen 27                                  #86 [hci0] 95.365533
      ATT: Read By Type Response (0x09) len 22
        Attribute data length: 21
        Attribute data list: 1 entry
        Handle: 0x0014
        Value[19]: 1e1500f36b109d66f2a9a112416838dbe57277
            Properties: 0x1e
              Read (0x02)
              Write Without Response (0x04)
              Write (0x08)
              Notify (0x10)
            Value Handle: 0x0015
            Value UUID: Vendor specific (7772e5db-3868-4112-a1a9-f2669d106bf3)
> HCI Event: Number of Completed Packets (0x13) plen 5                                        #87 [hci0] 95.365710
        Num handles: 1
        Handle: 64 Address: 7A:35:99:75:D4:38 (Resolvable)
        Count: 2
        #81: len 9 (2 Kb/s)
        Latency: 30 msec (15-329 msec ~25 msec)
        #84: len 9 (4 Kb/s)
        Latency: 15 msec (15-329 msec ~20 msec)
> ACL Data RX: Handle 64 flags 0x02 dlen 11                                                   #88 [hci0] 95.380199
      ATT: Read By Type Request (0x08) len 6
        Handle range: 0x0015-0x0017
        Attribute type: Characteristic (0x2803)
bluetoothd[656]: < ACL Data TX: Handle 64 flags 0x00 dlen 9                                   #89 [hci0] 95.380305
      ATT: Error Response (0x01) len 4
        Read By Type Request (0x08)
        Handle: 0x0015
        Error: Attribute Not Found (0x0a)
> ACL Data RX: Handle 64 flags 0x02 dlen 9                                                    #90 [hci0] 95.395408
      ATT: Find Information Request (0x04) len 4
        Handle range: 0x0016-0x0017
bluetoothd[656]: < ACL Data TX: Handle 64 flags 0x00 dlen 14                                  #91 [hci0] 95.395588
      ATT: Find Information Response (0x05) len 9
        Format: UUID-16 (0x01)
        Handle: 0x0016
        UUID: Client Characteristic Configuration (0x2902)
        Handle: 0x0017
        UUID: Characteristic User Description (0x2901)
> HCI Event: Number of Completed Packets (0x13) plen 5                                        #92 [hci0] 95.395623
        Num handles: 1
        Handle: 64 Address: 7A:35:99:75:D4:38 (Resolvable)
        Count: 2
        #86: len 27 (7 Kb/s)
        Latency: 30 msec (15-329 msec ~25 msec)
        #89: len 9 (4 Kb/s)
        Latency: 15 msec (15-329 msec ~20 msec)
> ACL Data RX: Handle 64 flags 0x02 dlen 11                                                   #93 [hci0] 95.410206
      ATT: Read By Type Request (0x08) len 6
        Handle range: 0x002d-0x002f
        Attribute type: Include (0x2802)
bluetoothd[656]: < ACL Data TX: Handle 64 flags 0x00 dlen 9                                   #94 [hci0] 95.410394
      ATT: Error Response (0x01) len 4
        Read By Type Request (0x08)
        Handle: 0x002d
        Error: Attribute Not Found (0x0a)
> ACL Data RX: Handle 64 flags 0x02 dlen 11                                                   #95 [hci0] 95.425425
      ATT: Read By Type Request (0x08) len 6
        Handle range: 0x002d-0x002f
        Attribute type: Characteristic (0x2803)
bluetoothd[656]: < ACL Data TX: Handle 64 flags 0x00 dlen 27                                  #96 [hci0] 95.425557
      ATT: Read By Type Response (0x09) len 22
        Attribute data length: 21
        Attribute data list: 1 entry
        Handle: 0x002e
        Value[19]: 022f00274168e036276e88434fd7b20428496f
            Properties: 0x02
              Read (0x02)
            Value Handle: 0x002f
            Value UUID: Vendor specific (6f492804-b2d7-4f43-886e-2736e0684127)
> HCI Event: Number of Completed Packets (0x13) plen 5                                        #97 [hci0] 95.425755
        Num handles: 1
        Handle: 64 Address: 7A:35:99:75:D4:38 (Resolvable)
        Count: 2
        #91: len 14 (3 Kb/s)
        Latency: 30 msec (15-329 msec ~25 msec)
        #94: len 9 (4 Kb/s)
        Latency: 15 msec (15-329 msec ~20 msec)
> ACL Data RX: Handle 64 flags 0x02 dlen 11                                                   #98 [hci0] 95.440200
      ATT: Read By Type Request (0x08) len 6
        Handle range: 0x002f-0x002f
        Attribute type: Characteristic (0x2803)
bluetoothd[656]: < ACL Data TX: Handle 64 flags 0x00 dlen 9                                   #99 [hci0] 95.440315
      ATT: Error Response (0x01) len 4
        Read By Type Request (0x08)
        Handle: 0x002f
        Error: Attribute Not Found (0x0a)
> HCI Event: Number of Completed Packets (0x13) plen 5                                       #100 [hci0] 95.455675
        Num handles: 1
        Handle: 64 Address: 7A:35:99:75:D4:38 (Resolvable)
        Count: 2
        #96: len 27 (7 Kb/s)
        Latency: 30 msec (15-329 msec ~25 msec)
        #99: len 9 (4 Kb/s)
        Latency: 15 msec (15-329 msec ~20 msec)
> HCI Event: LE Meta Event (0x3e) plen 11                                                    #101 [hci0] 95.455908
      LE Remote Connection Parameter Request (0x06)
        Handle: 64 Address: 7A:35:99:75:D4:38 (Resolvable)
        Min connection interval: 30.00 msec (0x0018)
        Max connection interval: 30.00 msec (0x0018)
        Connection latency: 0 (0x0000)
        Supervision timeout: 5000 msec (0x01f4)
< HCI Command: LE Remote Connection Parameter Request Reply (0x08|0x0020) plen 14            #102 [hci0] 95.455925
        Handle: 64 Address: 7A:35:99:75:D4:38 (Resolvable)
        Min connection interval: 30.00 msec (0x0018)
        Max connection interval: 30.00 msec (0x0018)
        Connection latency: 0 (0x0000)
        Supervision timeout: 5000 msec (0x01f4)
        Min connection length: 0.000 msec (0x0000)
        Max connection length: 0.000 msec (0x0000)
> HCI Event: Command Complete (0x0e) plen 6                                                  #103 [hci0] 95.459901
      LE Remote Connection Parameter Request Reply (0x08|0x0020) ncmd 1
        Status: Success (0x00)
        Handle: 64 Address: 7A:35:99:75:D4:38 (Resolvable)
> HCI Event: LE Meta Event (0x3e) plen 10                                                    #104 [hci0] 95.559359
      LE Connection Update Complete (0x03)
        Status: Success (0x00)
        Handle: 64 Address: 7A:35:99:75:D4:38 (Resolvable)
        Connection interval: 30.00 msec (0x0018)
        Connection latency: 0 (0x0000)
        Supervision timeout: 5000 msec (0x01f4)
> ACL Data RX: Handle 64 flags 0x02 dlen 11                                                  #105 [hci0] 98.438925
      SMP: Pairing Request (0x01) len 6
        IO capability: KeyboardDisplay (0x04)
        OOB data: Authentication data not present (0x00)
        Authentication requirement: Bonding, MITM, SC, No Keypresses, CT2 (0x2d)
        Max encryption key size: 16
        Initiator key distribution: EncKey IdKey Sign LinkKey (0x0f)
        Responder key distribution: EncKey IdKey Sign LinkKey (0x0f)
< ACL Data TX: Handle 64 flags 0x00 dlen 11                                                  #106 [hci0] 98.438969
      SMP: Pairing Response (0x02) len 6
        IO capability: NoInputNoOutput (0x03)
        OOB data: Authentication data not present (0x00)
        Authentication requirement: Bonding, MITM, SC, No Keypresses, CT2 (0x2d)
        Max encryption key size: 16
        Initiator key distribution: EncKey IdKey Sign LinkKey (0x0f)
        Responder key distribution: EncKey Sign LinkKey (0x0d)
> ACL Data RX: Handle 64 flags 0x02 dlen 69                                                  #107 [hci0] 98.499640
      SMP: Pairing Public Key (0x0c) len 64
        X[32]: 0ec99784508dee6fc3313c3b31bd2c0e70ac88a7689980641588496b87cbf8f8
        Y[32]: 17e4efc6c5a123de660714c1ba25a82e93b717a087608b6365f45bed36dce86e
< ACL Data TX: Handle 64 flags 0x00 dlen 69                                                  #108 [hci0] 98.503660
      SMP: Pairing Public Key (0x0c) len 64
        X[32]: c746146eb655d8e18ac3f20940859fb515ecb07a8ff992f00c036532a587d10b
        Y[32]: 75c4d6b6f015943541e13a11b94316c61eac8fb8b14f58e5b459b01ae0efceb6
< ACL Data TX: Handle 64 flags 0x00 dlen 21                                                  #109 [hci0] 98.503666
      SMP: Pairing Confirm (0x03) len 16
        Confim value[16]: 6e07f0c743b19c205cd4656da4d35f5d
> HCI Event: Number of Completed Packets (0x13) plen 5                                       #110 [hci0] 98.529985
        Num handles: 1
        Handle: 64 Address: 7A:35:99:75:D4:38 (Resolvable)
        Count: 2
        #106: len 11 (0 Kb/s)
        Latency: 91 msec (15-329 msec ~55 msec)
        #108: len 69 (21 Kb/s)
        Latency: 26 msec (15-329 msec ~40 msec)
> ACL Data RX: Handle 64 flags 0x02 dlen 21                                                  #111 [hci0] 98.559068
      SMP: Pairing Random (0x04) len 16
        Random value[16]: c6c75911599e6bf8fedbec30b6f7f22c
@ MGMT Event: User Confirmation Request (0x000f) plen 12                                 {0x0001} [hci0] 98.559103
        LE Address: 8C:6A:3B:86:3A:0A (Samsung Electronics Co.,Ltd)
        Confirm hint: 0x01
        Value: 0x0000d6fe
< ACL Data TX: Handle 64 flags 0x00 dlen 21                                                  #112 [hci0] 98.559112
      SMP: Pairing Random (0x04) len 16
        Random value[16]: 08ef2724cfc4dd89422c957dbbfb32ae
bluetoothd[656]: @ MGMT Command: User Confirmation Negative Reply (0x001d) plen 7        {0x0001} [hci0] 98.559251
        LE Address: 8C:6A:3B:86:3A:0A (Samsung Electronics Co.,Ltd)
@ MGMT Event: Authentication Failed (0x0011) plen 8                                      {0x0001} [hci0] 98.559264
        LE Address: 8C:6A:3B:86:3A:0A (Samsung Electronics Co.,Ltd)
        Status: Authentication Failed (0x05)
< ACL Data TX: Handle 64 flags 0x00 dlen 6                                                   #113 [hci0] 98.559270
      SMP: Pairing Failed (0x05) len 1
        Reason: Numeric comparison failed (0x0c)
@ MGMT Event: Command Complete (0x0001) plen 10                                          {0x0001} [hci0] 98.559274
      User Confirmation Negative Reply (0x001d) plen 7
        Status: Success (0x00)
        LE Address: 8C:6A:3B:86:3A:0A (Samsung Electronics Co.,Ltd)
> HCI Event: Number of Completed Packets (0x13) plen 5                                       #114 [hci0] 98.589526
        Num handles: 1
        Handle: 64 Address: 7A:35:99:75:D4:38 (Resolvable)
        Count: 2
        #109: len 21 (1 Kb/s)
        Latency: 85 msec (15-329 msec ~63 msec)
        #112: len 21 (5 Kb/s)
        Latency: 30 msec (15-329 msec ~46 msec)
> HCI Event: Number of Completed Packets (0x13) plen 5                                       #115 [hci0] 98.827339
        Num handles: 1
        Handle: 64 Address: 7A:35:99:75:D4:38 (Resolvable)
        Count: 1
        #113: len 6 (0 Kb/s)
        Latency: 268 msec (15-329 msec ~157 msec)
> HCI Event: Disconnect Complete (0x05) plen 4                                              #116 [hci0] 101.770166
        Status: Success (0x00)
        Handle: 64 Address: 7A:35:99:75:D4:38 (Resolvable)
        Reason: Remote User Terminated Connection (0x13)
@ MGMT Event: Device Disconnected (0x000c) plen 8                                       {0x0001} [hci0] 101.770231
        LE Address: 8C:6A:3B:86:3A:0A (Samsung Electronics Co.,Ltd)
        Reason: Connection terminated by remote host (0x03)
< HCI Command: LE Set Advertise Enable (0x08|0x000a) plen 1                                 #117 [hci0] 101.805864
        Advertising: Disabled (0x00)
> HCI Event: Command Complete (0x0e) plen 4                                                 #118 [hci0] 101.809264
      LE Set Advertise Enable (0x08|0x000a) ncmd 1
        Status: Success (0x00)
< HCI Command: LE Set Advertising Parameters (0x08|0x0006) plen 15                          #119 [hci0] 101.809446
        Min advertising interval: 1280.000 msec (0x0800)
        Max advertising interval: 1280.000 msec (0x0800)
        Type: Connectable undirected - ADV_IND (0x00)
        Own address type: Public (0x00)
        Direct address type: Public (0x00)
        Direct address: 00:00:00:00:00:00 (OUI 00-00-00)
        Channel map: 37, 38, 39 (0x07)
        Filter policy: Allow Scan Request from Any, Allow Connect Request from Any (0x00)
> HCI Event: Command Complete (0x0e) plen 4                                                 #120 [hci0] 101.811024
      LE Set Advertising Parameters (0x08|0x0006) ncmd 1
        Status: Success (0x00)
< HCI Command: LE Set Advertise Enable (0x08|0x000a) plen 1                                 #121 [hci0] 101.811251
        Advertising: Enabled (0x01)
> HCI Event: Command Complete (0x0e) plen 4                                                 #122 [hci0] 101.811660
      LE Set Advertise Enable (0x08|0x000a) ncmd 1
        Status: Success (0x00)
> HCI Event: LE Meta Event (0x3e) plen 19                                                   #123 [hci0] 119.769083
      LE Connection Complete (0x01)
        Status: Success (0x00)
        Handle: 64
        Role: Peripheral (0x01)
        Peer address type: Random (0x01)
        Peer address: 68:55:CC:DD:E7:FB (Resolvable)
        Connection interval: 30.00 msec (0x0018)
        Connection latency: 0 (0x0000)
        Supervision timeout: 5000 msec (0x01f4)
        Central clock accuracy: 0x05
@ MGMT Event: Device Connected (0x000b) plen 13                                         {0x0001} [hci0] 119.769222
        LE Address: 8C:6A:3B:86:3A:0A (Samsung Electronics Co.,Ltd)
        Flags: 0x00000000
        Data length: 0
< HCI Command: LE Read Remote Used Features (0x08|0x0016) plen 2                            #124 [hci0] 119.769483
        Handle: 64 Address: 68:55:CC:DD:E7:FB (Resolvable)
btmon[30146]: @ RAW Open: btmon (privileged) version 2.22                                      {0x0002} 119.769539
btmon[30146]: @ RAW Close: btmon                                                               {0x0002} 119.769561
> HCI Event: Vendor (0xff) plen 5                                                           #125 [hci0] 119.770135
        55 00 00 40 00                                   U..@.           
> HCI Event: Command Status (0x0f) plen 4                                                   #126 [hci0] 119.772301
      LE Read Remote Used Features (0x08|0x0016) ncmd 1
        Status: Success (0x00)
> HCI Event: LE Meta Event (0x3e) plen 12                                                   #127 [hci0] 119.829410
      LE Read Remote Used Features (0x04)
        Status: Success (0x00)
        Handle: 64 Address: 68:55:CC:DD:E7:FB (Resolvable)
        Features: 0x3f 0x00 0x00 0x00 0x00 0x00 0x00 0x00
          LE Encryption
          Connection Parameter Request Procedure
          Extended Reject Indication
          Peripheral-initiated Features Exchange
          LE Ping
          LE Data Packet Length Extension
< ACL Data TX: Handle 64 flags 0x00 dlen 6                                                  #128 [hci0] 119.829816
      SMP: Security Request (0x0b) len 1
        Authentication requirement: Bonding, No MITM, SC, No Keypresses, CT2 (0x29)
> HCI Event: LE Meta Event (0x3e) plen 11                                                   #129 [hci0] 119.889414
      LE Data Length Change (0x07)
        Handle: 64 Address: 68:55:CC:DD:E7:FB (Resolvable)
        Max TX octets: 251
        Max TX time: 2120
        Max RX octets: 27
        Max RX time: 328
> ACL Data RX: Handle 64 flags 0x02 dlen 11                                                 #130 [hci0] 120.069217
      ATT: Read By Type Request (0x08) len 6
        Handle range: 0x0001-0xffff
        Attribute type: Device Name (0x2a00)
bluetoothd[656]: < ACL Data TX: Handle 64 flags 0x00 dlen 7                                 #131 [hci0] 120.069467
      ATT: Exchange MTU Request (0x02) len 2
        Client RX MTU: 517
bluetoothd[656]: < ACL Data TX: Handle 64 flags 0x00 dlen 21                                #132 [hci0] 120.069497
      ATT: Read By Type Response (0x09) len 16
        Attribute data length: 15
        Attribute data list: 1 entry
        Handle: 0x0003
        Value[13]: 53656e74696e656c6c652d5631
> HCI Event: Number of Completed Packets (0x13) plen 5                                      #133 [hci0] 120.159448
        Num handles: 1
        Handle: 64 Address: 68:55:CC:DD:E7:FB (Resolvable)
        Count: 2
        #128: len 6 (0 Kb/s)
        Latency: 329 msec (329-329 msec ~329 msec)
        #131: len 7 (0 Kb/s)
        Latency: 89 msec (89-329 msec ~209 msec)
> ACL Data RX: Handle 64 flags 0x02 dlen 7                                                  #134 [hci0] 120.189012
      ATT: Exchange MTU Response (0x03) len 2
        Server RX MTU: 517
> ACL Data RX: Handle 64 flags 0x02 dlen 11                                                 #135 [hci0] 120.189447
      ATT: Read By Group Type Request (0x10) len 6
        Handle range: 0x0001-0xffff
        Attribute group type: Primary Service (0x2800)
bluetoothd[656]: < ACL Data TX: Handle 64 flags 0x00 dlen 24                                #136 [hci0] 120.189715
      ATT: Read By Group Type Response (0x11) len 19
        Attribute data length: 6
        Attribute group list: 3 entries
        Handle range: 0x0001-0x0005
        UUID: Generic Access Profile (0x1800)
        Handle range: 0x0006-0x000f
        UUID: Generic Attribute Profile (0x1801)
        Handle range: 0x0010-0x0012
        UUID: Device Information (0x180a)
bluetoothd[656]: < ACL Data TX: Handle 64 flags 0x00 dlen 11                                #137 [hci0] 120.189748
      ATT: Read By Type Request (0x08) len 6
        Handle range: 0x0001-0xffff
        Attribute type: Database Hash (0x2b2a)
> HCI Event: Number of Completed Packets (0x13) plen 5                                      #138 [hci0] 120.219577
        Num handles: 1
        Handle: 64 Address: 68:55:CC:DD:E7:FB (Resolvable)
        Count: 2
        #132: len 21 (1 Kb/s)
        Latency: 150 msec (89-329 msec ~179 msec)
        #136: len 24 (6 Kb/s)
        Latency: 29 msec (29-329 msec ~104 msec)
> ACL Data RX: Handle 64 flags 0x02 dlen 11                                                 #139 [hci0] 120.249035
      ATT: Read By Type Request (0x08) len 6
        Handle range: 0x0001-0xffff
        Attribute type: Appearance (0x2a01)
bluetoothd[656]: < ACL Data TX: Handle 64 flags 0x00 dlen 10                                #140 [hci0] 120.249272
      ATT: Read By Type Response (0x09) len 5
        Attribute data length: 4
        Attribute data list: 1 entry
        Handle: 0x0005
        Value[2]: 0000
> ACL Data RX: Handle 64 flags 0x02 dlen 24                                                 #141 [hci0] 120.249678
      ATT: Read By Type Response (0x09) len 19
        Attribute data length: 18
        Attribute data list: 1 entry
        Handle: 0x0009
        Value[16]: 8a3eadd4aef49a49dc575516f4663a43
bluetoothd[656]: < ACL Data TX: Handle 64 flags 0x00 dlen 11                                #142 [hci0] 120.249771
      ATT: Read By Type Request (0x08) len 6
        Handle range: 0x000a-0xffff
        Attribute type: Database Hash (0x2b2a)
> HCI Event: Number of Completed Packets (0x13) plen 5                                      #143 [hci0] 120.279460
        Num handles: 1
        Handle: 64 Address: 68:55:CC:DD:E7:FB (Resolvable)
        Count: 2
        #137: len 11 (0 Kb/s)
        Latency: 89 msec (29-329 msec ~97 msec)
        #140: len 10 (2 Kb/s)
        Latency: 30 msec (29-329 msec ~63 msec)
> ACL Data RX: Handle 64 flags 0x02 dlen 11                                                 #144 [hci0] 120.309034
      ATT: Read By Group Type Request (0x10) len 6
        Handle range: 0x0013-0xffff
        Attribute group type: Primary Service (0x2800)
bluetoothd[656]: < ACL Data TX: Handle 64 flags 0x00 dlen 46                                #145 [hci0] 120.309184
      ATT: Read By Group Type Response (0x11) len 41
        Attribute data length: 20
        Attribute group list: 2 entries
        Handle range: 0x0013-0x0017
        UUID: Vendor specific (03b80e5a-ede8-4b33-a751-6ce34ec4c700)
        Handle range: 0x002d-0x002f
        UUID: Vendor specific (e865862f-0c29-47b7-9a5b-274b2c82ce8c)
> ACL Data RX: Handle 64 flags 0x02 dlen 9                                                  #146 [hci0] 120.309640
      ATT: Error Response (0x01) len 4
        Read By Type Request (0x08)
        Handle: 0x000a
        Error: Attribute Not Found (0x0a)
bluetoothd[656]: < ACL Data TX: Handle 64 flags 0x00 dlen 8                                 #147 [hci0] 120.328847
      ATT: Write Request (0x12) len 3
        Handle: 0x0007
          Data[1]: 05
> HCI Event: Number of Completed Packets (0x13) plen 5                                      #148 [hci0] 120.339941
        Num handles: 1
        Handle: 64 Address: 68:55:CC:DD:E7:FB (Resolvable)
        Count: 2
        #142: len 11 (0 Kb/s)
        Latency: 90 msec (29-329 msec ~76 msec)
        #145: len 46 (12 Kb/s)
        Latency: 30 msec (29-329 msec ~53 msec)
> ACL Data RX: Handle 64 flags 0x02 dlen 11                                                 #149 [hci0] 120.369035
      ATT: Read By Group Type Request (0x10) len 6
        Handle range: 0x0030-0xffff
        Attribute group type: Primary Service (0x2800)
> ACL Data RX: Handle 64 flags 0x02 dlen 5                                                  #150 [hci0] 120.369393
      ATT: Write Response (0x13) len 0
bluetoothd[656]: < ACL Data TX: Handle 64 flags 0x00 dlen 9                                 #151 [hci0] 120.397602
      ATT: Error Response (0x01) len 4
        Read By Group Type Request (0x10)
        Handle: 0x0030
        Error: Attribute Not Found (0x0a)
> HCI Event: LE Meta Event (0x3e) plen 11                                                   #152 [hci0] 120.429443
      LE Remote Connection Parameter Request (0x06)
        Handle: 64 Address: 68:55:CC:DD:E7:FB (Resolvable)
        Min connection interval: 7.50 msec (0x0006)
        Max connection interval: 7.50 msec (0x0006)
        Connection latency: 0 (0x0000)
        Supervision timeout: 5000 msec (0x01f4)
< HCI Command: LE Remote Connection Parameter Request Reply (0x08|0x0020) plen 14           #153 [hci0] 120.429476
        Handle: 64 Address: 68:55:CC:DD:E7:FB (Resolvable)
        Min connection interval: 7.50 msec (0x0006)
        Max connection interval: 7.50 msec (0x0006)
        Connection latency: 0 (0x0000)
        Supervision timeout: 5000 msec (0x01f4)
        Min connection length: 0.000 msec (0x0000)
        Max connection length: 0.000 msec (0x0000)
> HCI Event: Command Complete (0x0e) plen 6                                                 #154 [hci0] 120.433205
      LE Remote Connection Parameter Request Reply (0x08|0x0020) ncmd 1
        Status: Success (0x00)
        Handle: 64 Address: 68:55:CC:DD:E7:FB (Resolvable)
> ACL Data RX: Handle 64 flags 0x02 dlen 11                                                 #155 [hci0] 120.459211
      ATT: Read By Type Request (0x08) len 6
        Handle range: 0x0001-0x0005
        Attribute type: Include (0x2802)
bluetoothd[656]: < ACL Data TX: Handle 64 flags 0x00 dlen 9                                 #156 [hci0] 120.459390
      ATT: Error Response (0x01) len 4
        Read By Type Request (0x08)
        Handle: 0x0001
        Error: Attribute Not Found (0x0a)
> HCI Event: Number of Completed Packets (0x13) plen 5                                      #157 [hci0] 120.459411
        Num handles: 1
        Handle: 64 Address: 68:55:CC:DD:E7:FB (Resolvable)
        Count: 2
        #147: len 8 (0 Kb/s)
        Latency: 130 msec (29-329 msec ~92 msec)
        #151: len 9 (1 Kb/s)
        Latency: 61 msec (29-329 msec ~77 msec)
> ACL Data RX: Handle 64 flags 0x02 dlen 11                                                 #158 [hci0] 120.578977
      ATT: Read By Type Request (0x08) len 6
        Handle range: 0x0001-0x0005
        Attribute type: Characteristic (0x2803)
bluetoothd[656]: < ACL Data TX: Handle 64 flags 0x00 dlen 20                                #159 [hci0] 120.579128
      ATT: Read By Type Response (0x09) len 15
        Attribute data length: 7
        Attribute data list: 2 entries
        Handle: 0x0002
        Value[5]: 020300002a
            Properties: 0x02
              Read (0x02)
            Value Handle: 0x0003
            Value UUID: Device Name (0x2a00)
        Handle: 0x0004
        Value[5]: 020500012a
            Properties: 0x02
              Read (0x02)
            Value Handle: 0x0005
            Value UUID: Appearance (0x2a01)
> ACL Data RX: Handle 64 flags 0x02 dlen 11                                                 #160 [hci0] 120.639201
      ATT: Read By Type Request (0x08) len 6
        Handle range: 0x0005-0x0005
        Attribute type: Characteristic (0x2803)
bluetoothd[656]: < ACL Data TX: Handle 64 flags 0x00 dlen 9                                 #161 [hci0] 120.639319
      ATT: Error Response (0x01) len 4
        Read By Type Request (0x08)
        Handle: 0x0005
        Error: Attribute Not Found (0x0a)
> HCI Event: Number of Completed Packets (0x13) plen 5                                      #162 [hci0] 120.639428
        Num handles: 1
        Handle: 64 Address: 68:55:CC:DD:E7:FB (Resolvable)
        Count: 2
        #156: len 9 (0 Kb/s)
        Latency: 180 msec (29-329 msec ~128 msec)
        #159: len 20 (2 Kb/s)
        Latency: 60 msec (29-329 msec ~94 msec)
> ACL Data RX: Handle 64 flags 0x02 dlen 11                                                 #163 [hci0] 120.698984
      ATT: Read By Type Request (0x08) len 6
        Handle range: 0x0006-0x000f
        Attribute type: Include (0x2802)
bluetoothd[656]: < ACL Data TX: Handle 64 flags 0x00 dlen 9                                 #164 [hci0] 120.699138
      ATT: Error Response (0x01) len 4
        Read By Type Request (0x08)
        Handle: 0x0006
        Error: Attribute Not Found (0x0a)
> ACL Data RX: Handle 64 flags 0x02 dlen 11                                                 #165 [hci0] 120.759203
      ATT: Read By Type Request (0x08) len 6
        Handle range: 0x0006-0x000f
        Attribute type: Characteristic (0x2803)
bluetoothd[656]: < ACL Data TX: Handle 64 flags 0x00 dlen 27                                #166 [hci0] 120.759331
      ATT: Read By Type Response (0x09) len 22
        Attribute data length: 7
        Attribute data list: 3 entries
        Handle: 0x0007
        Value[5]: 200800052a
            Properties: 0x20
              Indicate (0x20)
            Value Handle: 0x0008
            Value UUID: Service Changed (0x2a05)
        Handle: 0x000a
        Value[5]: 0a0b00292b
            Properties: 0x0a
              Read (0x02)
              Write (0x08)
            Value Handle: 0x000b
            Value UUID: Client Supported Features (0x2b29)
        Handle: 0x000c
        Value[5]: 020d002a2b
            Properties: 0x02
              Read (0x02)
            Value Handle: 0x000d
            Value UUID: Database Hash (0x2b2a)
> HCI Event: Number of Completed Packets (0x13) plen 5                                      #167 [hci0] 120.759460
        Num handles: 1
        Handle: 64 Address: 68:55:CC:DD:E7:FB (Resolvable)
        Count: 2
        #161: len 9 (0 Kb/s)
        Latency: 120 msec (29-329 msec ~107 msec)
        #164: len 9 (1 Kb/s)
        Latency: 60 msec (29-329 msec ~83 msec)
> HCI Event: LE Meta Event (0x3e) plen 10                                                   #168 [hci0] 120.791244
      LE Connection Update Complete (0x03)
        Status: Success (0x00)
        Handle: 64 Address: 68:55:CC:DD:E7:FB (Resolvable)
        Connection interval: 7.50 msec (0x0006)
        Connection latency: 0 (0x0000)
        Supervision timeout: 5000 msec (0x01f4)
> HCI Event: LE Meta Event (0x3e) plen 11                                                   #169 [hci0] 120.798123
      LE Data Length Change (0x07)
        Handle: 64 Address: 68:55:CC:DD:E7:FB (Resolvable)
        Max TX octets: 251
        Max TX time: 2120
        Max RX octets: 251
        Max RX time: 2120
> ACL Data RX: Handle 64 flags 0x02 dlen 11                                                 #170 [hci0] 120.805191
      ATT: Read By Type Request (0x08) len 6
        Handle range: 0x000d-0x000f
        Attribute type: Characteristic (0x2803)
bluetoothd[656]: < ACL Data TX: Handle 64 flags 0x00 dlen 9                                 #171 [hci0] 120.805316
      ATT: Error Response (0x01) len 4
        Read By Type Request (0x08)
        Handle: 0x000d
        Error: Attribute Not Found (0x0a)
> ACL Data RX: Handle 64 flags 0x02 dlen 9                                                  #172 [hci0] 120.827933
      ATT: Find Information Request (0x04) len 4
        Handle range: 0x0009-0x0009
bluetoothd[656]: < ACL Data TX: Handle 64 flags 0x00 dlen 10                                #173 [hci0] 120.828034
      ATT: Find Information Response (0x05) len 5
        Format: UUID-16 (0x01)
        Handle: 0x0009
        UUID: Client Characteristic Configuration (0x2902)
> HCI Event: Number of Completed Packets (0x13) plen 5                                      #174 [hci0] 120.828159
        Num handles: 1
        Handle: 64 Address: 68:55:CC:DD:E7:FB (Resolvable)
        Count: 2
        #166: len 27 (3 Kb/s)
        Latency: 68 msec (29-329 msec ~76 msec)
        #171: len 9 (3 Kb/s)
        Latency: 22 msec (22-329 msec ~49 msec)
> ACL Data RX: Handle 64 flags 0x02 dlen 9                                                  #175 [hci0] 120.842710
      ATT: Find Information Request (0x04) len 4
        Handle range: 0x000e-0x000f
bluetoothd[656]: < ACL Data TX: Handle 64 flags 0x00 dlen 9                                 #176 [hci0] 120.842817
      ATT: Error Response (0x01) len 4
        Find Information Request (0x04)
        Handle: 0x000e
        Error: Attribute Not Found (0x0a)
> ACL Data RX: Handle 64 flags 0x02 dlen 11                                                 #177 [hci0] 120.857947
      ATT: Read By Type Request (0x08) len 6
        Handle range: 0x0010-0x0012
        Attribute type: Include (0x2802)
bluetoothd[656]: < ACL Data TX: Handle 64 flags 0x00 dlen 9                                 #178 [hci0] 120.858041
      ATT: Error Response (0x01) len 4
        Read By Type Request (0x08)
        Handle: 0x0010
        Error: Attribute Not Found (0x0a)
> HCI Event: Number of Completed Packets (0x13) plen 5                                      #179 [hci0] 120.858151
        Num handles: 1
        Handle: 64 Address: 68:55:CC:DD:E7:FB (Resolvable)
        Count: 2
        #173: len 10 (2 Kb/s)
        Latency: 30 msec (22-329 msec ~39 msec)
        #176: len 9 (4 Kb/s)
        Latency: 15 msec (15-329 msec ~27 msec)
< HCI Command: LE Set Advertising Parameters (0x08|0x0006) plen 15                          #180 [hci0] 120.869181
        Min advertising interval: 1280.000 msec (0x0800)
        Max advertising interval: 1280.000 msec (0x0800)
        Type: Connectable undirected - ADV_IND (0x00)
        Own address type: Public (0x00)
        Direct address type: Public (0x00)
        Direct address: 00:00:00:00:00:00 (OUI 00-00-00)
        Channel map: 37, 38, 39 (0x07)
        Filter policy: Allow Scan Request from Any, Allow Connect Request from Any (0x00)
> HCI Event: Command Complete (0x0e) plen 4                                                 #181 [hci0] 120.869463
      LE Set Advertising Parameters (0x08|0x0006) ncmd 1
        Status: Success (0x00)
< HCI Command: LE Set Advertise Enable (0x08|0x000a) plen 1                                 #182 [hci0] 120.869513
        Advertising: Enabled (0x01)
> HCI Event: Command Complete (0x0e) plen 4                                                 #183 [hci0] 120.869929
      LE Set Advertise Enable (0x08|0x000a) ncmd 1
        Status: Success (0x00)
> ACL Data RX: Handle 64 flags 0x02 dlen 11                                                 #184 [hci0] 120.872720
      ATT: Read By Type Request (0x08) len 6
        Handle range: 0x0010-0x0012
        Attribute type: Characteristic (0x2803)
bluetoothd[656]: < ACL Data TX: Handle 64 flags 0x00 dlen 13                                #185 [hci0] 120.872855
      ATT: Read By Type Response (0x09) len 8
        Attribute data length: 7
        Attribute data list: 1 entry
        Handle: 0x0011
        Value[5]: 021200502a
            Properties: 0x02
              Read (0x02)
            Value Handle: 0x0012
            Value UUID: PnP ID (0x2a50)
> ACL Data RX: Handle 64 flags 0x02 dlen 11                                                 #186 [hci0] 120.887946
      ATT: Read By Type Request (0x08) len 6
        Handle range: 0x0012-0x0012
        Attribute type: Characteristic (0x2803)
bluetoothd[656]: < ACL Data TX: Handle 64 flags 0x00 dlen 9                                 #187 [hci0] 120.888051
      ATT: Error Response (0x01) len 4
        Read By Type Request (0x08)
        Handle: 0x0012
        Error: Attribute Not Found (0x0a)
> HCI Event: Number of Completed Packets (0x13) plen 5                                      #188 [hci0] 120.888173
        Num handles: 1
        Handle: 64 Address: 68:55:CC:DD:E7:FB (Resolvable)
        Count: 2
        #178: len 9 (2 Kb/s)
        Latency: 30 msec (15-329 msec ~28 msec)
        #185: len 13 (6 Kb/s)
        Latency: 15 msec (15-329 msec ~22 msec)
> ACL Data RX: Handle 64 flags 0x02 dlen 11                                                 #189 [hci0] 120.902721
      ATT: Read By Type Request (0x08) len 6
        Handle range: 0x0013-0x0017
        Attribute type: Include (0x2802)
bluetoothd[656]: < ACL Data TX: Handle 64 flags 0x00 dlen 9                                 #190 [hci0] 120.902825
      ATT: Error Response (0x01) len 4
        Read By Type Request (0x08)
        Handle: 0x0013
        Error: Attribute Not Found (0x0a)
> ACL Data RX: Handle 64 flags 0x02 dlen 11                                                 #191 [hci0] 120.917985
      ATT: Read By Type Request (0x08) len 6
        Handle range: 0x0013-0x0017
        Attribute type: Characteristic (0x2803)
> HCI Event: Number of Completed Packets (0x13) plen 5                                      #192 [hci0] 120.918171
        Num handles: 1
        Handle: 64 Address: 68:55:CC:DD:E7:FB (Resolvable)
        Count: 2
        #187: len 9 (2 Kb/s)
        Latency: 30 msec (15-329 msec ~26 msec)
        #190: len 9 (4 Kb/s)
        Latency: 15 msec (15-329 msec ~20 msec)
bluetoothd[656]: < ACL Data TX: Handle 64 flags 0x00 dlen 27                                #193 [hci0] 120.918189
      ATT: Read By Type Response (0x09) len 22
        Attribute data length: 21
        Attribute data list: 1 entry
        Handle: 0x0014
        Value[19]: 1e1500f36b109d66f2a9a112416838dbe57277
            Properties: 0x1e
              Read (0x02)
              Write Without Response (0x04)
              Write (0x08)
              Notify (0x10)
            Value Handle: 0x0015
            Value UUID: Vendor specific (7772e5db-3868-4112-a1a9-f2669d106bf3)
> ACL Data RX: Handle 64 flags 0x02 dlen 11                                                 #194 [hci0] 120.932730
      ATT: Read By Type Request (0x08) len 6
        Handle range: 0x0015-0x0017
        Attribute type: Characteristic (0x2803)
bluetoothd[656]: < ACL Data TX: Handle 64 flags 0x00 dlen 9                                 #195 [hci0] 120.932907
      ATT: Error Response (0x01) len 4
        Read By Type Request (0x08)
        Handle: 0x0015
        Error: Attribute Not Found (0x0a)
> ACL Data RX: Handle 64 flags 0x02 dlen 9                                                  #196 [hci0] 120.947931
      ATT: Find Information Request (0x04) len 4
        Handle range: 0x0016-0x0017
bluetoothd[656]: < ACL Data TX: Handle 64 flags 0x00 dlen 14                                #197 [hci0] 120.948047
      ATT: Find Information Response (0x05) len 9
        Format: UUID-16 (0x01)
        Handle: 0x0016
        UUID: Client Characteristic Configuration (0x2902)
        Handle: 0x0017
        UUID: Characteristic User Description (0x2901)
> HCI Event: Number of Completed Packets (0x13) plen 5                                      #198 [hci0] 120.948178
        Num handles: 1
        Handle: 64 Address: 68:55:CC:DD:E7:FB (Resolvable)
        Count: 2
        #193: len 27 (7 Kb/s)
        Latency: 29 msec (15-329 msec ~25 msec)
        #195: len 9 (4 Kb/s)
        Latency: 15 msec (15-329 msec ~20 msec)
> ACL Data RX: Handle 64 flags 0x02 dlen 11                                                 #199 [hci0] 120.962722
      ATT: Read By Type Request (0x08) len 6
        Handle range: 0x002d-0x002f
        Attribute type: Include (0x2802)
bluetoothd[656]: < ACL Data TX: Handle 64 flags 0x00 dlen 9                                 #200 [hci0] 120.962855
      ATT: Error Response (0x01) len 4
        Read By Type Request (0x08)
        Handle: 0x002d
        Error: Attribute Not Found (0x0a)
> ACL Data RX: Handle 64 flags 0x02 dlen 11                                                 #201 [hci0] 120.977944
      ATT: Read By Type Request (0x08) len 6
        Handle range: 0x002d-0x002f
        Attribute type: Characteristic (0x2803)
bluetoothd[656]: < ACL Data TX: Handle 64 flags 0x00 dlen 27                                #202 [hci0] 120.978055
      ATT: Read By Type Response (0x09) len 22
        Attribute data length: 21
        Attribute data list: 1 entry
        Handle: 0x002e
        Value[19]: 022f00274168e036276e88434fd7b20428496f
            Properties: 0x02
              Read (0x02)
            Value Handle: 0x002f
            Value UUID: Vendor specific (6f492804-b2d7-4f43-886e-2736e0684127)
> HCI Event: Number of Completed Packets (0x13) plen 5                                      #203 [hci0] 120.978178
        Num handles: 1
        Handle: 64 Address: 68:55:CC:DD:E7:FB (Resolvable)
        Count: 2
        #197: len 14 (3 Kb/s)
        Latency: 30 msec (15-329 msec ~25 msec)
        #200: len 9 (4 Kb/s)
        Latency: 15 msec (15-329 msec ~20 msec)
> ACL Data RX: Handle 64 flags 0x02 dlen 11                                                 #204 [hci0] 120.992722
      ATT: Read By Type Request (0x08) len 6
        Handle range: 0x002f-0x002f
        Attribute type: Characteristic (0x2803)
bluetoothd[656]: < ACL Data TX: Handle 64 flags 0x00 dlen 9                                 #205 [hci0] 120.992828
      ATT: Error Response (0x01) len 4
        Read By Type Request (0x08)
        Handle: 0x002f
        Error: Attribute Not Found (0x0a)
> HCI Event: Number of Completed Packets (0x13) plen 5                                      #206 [hci0] 121.008214
        Num handles: 1
        Handle: 64 Address: 68:55:CC:DD:E7:FB (Resolvable)
        Count: 2
        #202: len 27 (7 Kb/s)
        Latency: 30 msec (15-329 msec ~25 msec)
        #205: len 9 (4 Kb/s)
        Latency: 15 msec (15-329 msec ~20 msec)
> HCI Event: LE Meta Event (0x3e) plen 11                                                   #207 [hci0] 121.008461
      LE Remote Connection Parameter Request (0x06)
        Handle: 64 Address: 68:55:CC:DD:E7:FB (Resolvable)
        Min connection interval: 30.00 msec (0x0018)
        Max connection interval: 30.00 msec (0x0018)
        Connection latency: 0 (0x0000)
        Supervision timeout: 5000 msec (0x01f4)
< HCI Command: LE Remote Connection Parameter Request Reply (0x08|0x0020) plen 14           #208 [hci0] 121.008483
        Handle: 64 Address: 68:55:CC:DD:E7:FB (Resolvable)
        Min connection interval: 30.00 msec (0x0018)
        Max connection interval: 30.00 msec (0x0018)
        Connection latency: 0 (0x0000)
        Supervision timeout: 5000 msec (0x01f4)
        Min connection length: 0.000 msec (0x0000)
        Max connection length: 0.000 msec (0x0000)
> HCI Event: Command Complete (0x0e) plen 6                                                 #209 [hci0] 121.012454
      LE Remote Connection Parameter Request Reply (0x08|0x0020) ncmd 1
        Status: Success (0x00)
        Handle: 64 Address: 68:55:CC:DD:E7:FB (Resolvable)
> HCI Event: LE Meta Event (0x3e) plen 10                                                   #210 [hci0] 121.119441
      LE Connection Update Complete (0x03)
        Status: Success (0x00)
        Handle: 64 Address: 68:55:CC:DD:E7:FB (Resolvable)
        Connection interval: 30.00 msec (0x0018)
        Connection latency: 0 (0x0000)
        Supervision timeout: 5000 msec (0x01f4)
> ACL Data RX: Handle 64 flags 0x02 dlen 6                                                  #211 [hci0] 124.688913
      SMP: Pairing Failed (0x05) len 1
        Reason: Repeated attempts (0x09)
@ MGMT Event: Authentication Failed (0x0011) plen 8                                     {0x0001} [hci0] 124.688945
        LE Address: 8C:6A:3B:86:3A:0A (Samsung Electronics Co.,Ltd)
        Status: Authentication Failed (0x05)
< HCI Command: Disconnect (0x01|0x0006) plen 3                                              #212 [hci0] 124.689095
        Handle: 64 Address: 68:55:CC:DD:E7:FB (Resolvable)
        Reason: Authentication Failure (0x05)
> HCI Event: Command Status (0x0f) plen 4                                                   #213 [hci0] 124.689753
      Disconnect (0x01|0x0006) ncmd 1
        Status: Success (0x00)
> HCI Event: Disconnect Complete (0x05) plen 4                                              #214 [hci0] 124.749892
        Status: Success (0x00)
        Handle: 64 Address: 68:55:CC:DD:E7:FB (Resolvable)
        Reason: Connection Terminated By Local Host (0x16)
@ MGMT Event: Device Disconnected (0x000c) plen 8                                       {0x0001} [hci0] 124.749908
        LE Address: 8C:6A:3B:86:3A:0A (Samsung Electronics Co.,Ltd)
        Reason: Connection terminated by local host (0x02)
< HCI Command: LE Set Advertise Enable (0x08|0x000a) plen 1                                 #215 [hci0] 124.781351
        Advertising: Disabled (0x00)
> HCI Event: Command Complete (0x0e) plen 4                                                 #216 [hci0] 124.782349
      LE Set Advertise Enable (0x08|0x000a) ncmd 1
        Status: Success (0x00)
< HCI Command: LE Set Advertising Parameters (0x08|0x0006) plen 15                          #217 [hci0] 124.782405
        Min advertising interval: 1280.000 msec (0x0800)
        Max advertising interval: 1280.000 msec (0x0800)
        Type: Connectable undirected - ADV_IND (0x00)
        Own address type: Public (0x00)
        Direct address type: Public (0x00)
        Direct address: 00:00:00:00:00:00 (OUI 00-00-00)
        Channel map: 37, 38, 39 (0x07)
        Filter policy: Allow Scan Request from Any, Allow Connect Request from Any (0x00)
> HCI Event: Command Complete (0x0e) plen 4                                                 #218 [hci0] 124.782688
      LE Set Advertising Parameters (0x08|0x0006) ncmd 1
        Status: Success (0x00)
< HCI Command: LE Set Advertise Enable (0x08|0x000a) plen 1                                 #219 [hci0] 124.782715
        Advertising: Enabled (0x01)
> HCI Event: Command Complete (0x0e) plen 4                                                 #220 [hci0] 124.783085
      LE Set Advertise Enable (0x08|0x000a) ncmd 1
        Status: Success (0x00)

